solution_map/gfx90a_rocfft_solution_map.dat
{"Version":3,
"Data":[
{"Problem":{"arch":"gfx90a","token":"kernel_token_builtin_kernel"},
 "Solutions":[ {"sol_node_type":"SOL_BUILTIN_KERNEL"}
               ]},
{"Problem":{"arch":"gfx90a","token":"kernel_len100_double_sbrr"},
 "Solutions":[ {"sol_node_type":"SOL_KERNEL_ONLY","kernel_key":{"lengths":[ 100,0 ],"precision":"double","scheme":"CS_KERNEL_STOCKHAM","sbrc_trans":"NONE","kernelConfig":{"use_3steps":false,"half_lds":true,"dir_reg":true,"buffer_inst":false,"tpb":10,"wgs":250,"tpt":[ 25,0 ],"factors":[ 5,4,5 ],"ebtype":"R2C_POST","direction":-1,"static_dim":1,"placement":"OP","iAryType":"CI","oAryType":"CI"}}}
               ]},
{"Problem":{"arch":"gfx90a","token":"kernel_len100_single_sbrr"},
 "Solutions":[ {"sol_node_type":"SOL_KERNEL_ONLY","kernel_key":{"lengths":[ 100,0 ],"precision":"single","scheme":"CS_KERNEL_STOCKHAM","sbrc_trans":"NONE","kernelConfig":{"use_3steps":false,"half_lds":true,"dir_reg":true,"buffer_inst":false,"tpb":20,"wgs":200,"tpt":[ 10,0 ],"factors":[ 10,10 ],"ebtype":"R2C_POST","direction":-1,"static_dim":1,"placement":"OP","iAryType":"CI","oAryType":"CI"}}}
              ,{"sol_node_type":"SOL_KERNEL_ONLY","kernel_key":{"lengths":[ 100,0 ],"precision":"single","scheme":"CS_KERNEL_STOCKHAM","sbrc_trans":"NONE","kernelConfig":{"use_3steps":false,"half_lds":false,"dir_reg":true,"buffer_inst":false,"tpb":6,"wgs":120,"tpt":[ 20,0 ],"factors":[ 4,5,5 ],"ebtype":"C2R_PRE","direction":1,"static_dim":1,"placement":"OP","iAryType":"CI","oAryType":"CI"}}}
              ,{"sol_node_type":"SOL_KERNEL_ONLY","kernel_key":{"lengths":[ 100,0 ],"precision":"single","scheme":"CS_KERNEL_STOCKHAM","sbrc_trans":"NONE","kernelConfig":{"use_3steps":false,"half_lds":true,"dir_reg":true,"buffer_inst":false,"tpb":19,"wgs":190,"tpt":[ 10,0 ],"factors":[ 10,10 ],"ebtype":"R2C_POST","direction":-1,"static_dim":1,"placement":"OP","iAryType":"CI","oAryType":"CI"}}}
               ]},
{"Problem":{"arch":"gfx90a","token":"kernel_len108_single_sbrr"},
 "Solutions":[ {"sol_node_type":"SOL_KERNEL_ONLY","kernel_key":{"lengths":[ 108,0 ],"precision":"single","scheme":"CS_KERNEL_STOCKHAM","sbrc_trans":"NONE","kernelConfig":{"use_3steps":false,"half_lds":true,"dir_reg":true,"buffer_inst":false,"tpb":16,"wgs":192,"tpt":[ 12,0 ],"factors":[ 9,4,3 ],"ebtype":"R2C_POST","direction":-1,"static_dim":1,"placement":"OP","iAryType":"CI","oAryType":"CI"}}}
              ,{"sol_node_type":"SOL_KERNEL_ONLY","kernel_key":{"lengths":[ 108,0 ],"precision":"single","scheme":"CS_KERNEL_STOCKHAM","sbrc_trans":"NONE","kernelConfig":{"use_3steps":false,"half_lds":false,"dir_reg":true,"buffer_inst":false,"tpb":10,"wgs":120,"tpt":[ 12,0 ],"factors":[ 9,4,3 ],"ebtype":"C2R_PRE","direction":1,"static_dim":1,"placement":"OP","iAryType":"CI","oAryType":"CI"}}}
               ]},
{"Problem":{"arch":"gfx90a","token":"kernel_len112_single_sbrr"},
 "Solutions":[ {"sol_node_type":"SOL_KERNEL_ONLY","kernel_key":{"lengths":[ 112,0 ],"precision":"single","scheme":"CS_KERNEL_STOCKHAM","sbrc_trans":"NONE","kernelConfig":{"use_3steps":false,"half_lds":true,"dir_reg":true,"buffer_inst":false,"tpb":18,"wgs":126,"tpt":[ 7,0 ],"factors":[ 4,4,7 ],"ebtype":"R2C_POST","direction":-1,"static_dim":1,"placement":"OP","iAryType":"CI","oAryType":"CI"}}}
              ,{"sol_node_type":"SOL_KERNEL_ONLY","kernel_key":{"lengths":[ 112,0 ],"precision":"single","scheme":"CS_KERNEL_STOCKHAM","sbrc_trans":"NONE","kernelConfig":{"use_3steps":false,"half_lds":false,"dir_reg":true,"buffer_inst":false,"tpb":8,"wgs":64,"tpt":[ 8,0 ],"factors":[ 2,7,8 ],"ebtype":"C2R_PRE","direction":1,"static_dim":1,"placement":"OP","iAryType":"CI","oAryType":"CI"}}}
               ]},
{"Problem":{"arch":"gfx90a","token":"kernel_len125_single_sbrr"},
 "Solutions":[ {"sol_node_type":"SOL_KERNEL_ONLY","kernel_key":{"lengths":[ 125,0 ],"precision":"single","scheme":"CS_KERNEL_STOCKHAM","sbrc_trans":"NONE","kernelConfig":{"use_3steps":false,"half_lds":true,"dir_reg":true,"buffer_inst":false,"tpb":10,"wgs":250,"tpt":[ 25,0 ],"factors":[ 5,5,5 ],"ebtype":"NONE","direction":-1,"static_dim":0,"placement":"NA","iAryType":"CI","oAryType":"CI"}}}
              ,{"sol_node_type":"SOL_KERNEL_ONLY","kernel_key":{"lengths":[ 125,0 ],"precision":"single","scheme":"CS_KERNEL_STOCKHAM","sbrc_trans":"NONE","kernelConfig":{"use_3steps":false,"half_lds":false,"dir_reg":true,"buffer_inst":false,"tpb":10,"wgs":250,"tpt":[ 25,0 ],"factors":[ 5,5,5 ],"ebtype":"NONE","direction":-1,"static_dim":0,"placement":"NA","iAryType":"CI","oAryType":"CI"}}}
               ]},
{"Problem":{"arch":"gfx90a","token":"kernel_len128_single_sbrr"},
 "Solutions":[ {"sol_node_type":"SOL_KERNEL_ONLY","kernel_key":{"lengths":[ 128,0 ],"precision":"single","scheme":"CS_KERNEL_STOCKHAM","sbrc_trans":"NONE","kernelConfig":{"use_3steps":false,"half_lds":false,"dir_reg":true,"buffer_inst":false,"tpb":8,"wgs":128,"tpt":[ 16,0 ],"factors":[ 8,2,8 ],"ebtype":"R2C_POST","direction":-1,"static_dim":1,"placement":"OP","iAryType":"CI","oAryType":"CI"}}}
              ,{"sol_node_type":"SOL_KERNEL_ONLY","kernel_key":{"lengths":[ 128,0 ],"precision":"single","scheme":"CS_KERNEL_STOCKHAM","sbrc_trans":"NONE","kernelConfig":{"use_3steps":false,"half_lds":false,"dir_reg":true,"buffer_inst":false,"tpb":8,"wgs":128,"tpt":[ 16,0 ],"factors":[ 8,2,8 ],"ebtype":"C2R_PRE","direction":-1,"static_dim":1,"placement":"OP","iAryType":"CI","oAryType":"CI"}}}
              ,{"sol_node_type":"SOL_KERNEL_ONLY","kernel_key":{"lengths":[ 128,0 ],"precision":"single","scheme":"CS_KERNEL_STOCKHAM","sbrc_trans":"NONE","kernelConfig":{"use_3steps":false,"half_lds":false,"dir_reg":true,"buffer_inst":false,"tpb":8,"wgs":128,"tpt":[ 16,0 ],"factors":[ 2,8,8 ],"ebtype":"R2C_POST","direction":-1,"static_dim":1,"placement":"OP","iAryType":"CI","oAryType":"CI"}}}
               ]},
{"Problem":{"arch":"gfx90a","token":"kernel_len192_single_sbrr"},
 "Solutions":[ {"sol_node_type":"SOL_KERNEL_ONLY","kernel_key":{"lengths":[ 192,0 ],"precision":"single","scheme":"CS_KERNEL_STOCKHAM","sbrc_trans":"NONE","kernelConfig":{"use_3steps":false,"half_lds":false,"dir_reg":true,"buffer_inst":false,"tpb":16,"wgs":256,"tpt":[ 16,0 ],"factors":[ 2,3,4,8 ],"ebtype":"NONE","direction":-1,"static_dim":2,"placement":"IP","iAryType":"CI","oAryType":"HI"}}}
              ,{"sol_node_type":"SOL_KERNEL_ONLY","kernel_key":{"lengths":[ 192,0 ],"precision":"single","scheme":"CS_KERNEL_STOCKHAM","sbrc_trans":"NONE","kernelConfig":{"use_3steps":false,"half_lds":true,"dir_reg":true,"buffer_inst":false,"tpb":16,"wgs":256,"tpt":[ 16,0 ],"factors":[ 2,4,4,3,2 ],"ebtype":"NONE","direction":-1,"static_dim":3,"placement":"IP","iAryType":"CI","oAryType":"CI"}}}
              ,{"sol_node_type":"SOL_KERNEL_ONLY","kernel_key":{"lengths":[ 192,0 ],"precision":"single","scheme":"CS_KERNEL_STOCKHAM","sbrc_trans":"NONE","kernelConfig":{"use_3steps":false,"half_lds":true,"dir_reg":true,"buffer_inst":false,"tpb":16,"wgs":256,"tpt":[ 16,0 ],"factors":[ 2,2,3,4,4 ],"ebtype":"NONE","direction":1,"static_dim":3,"placement":"IP","iAryType":"CI","oAryType":"CI"}}}
              ,{"sol_node_type":"SOL_KERNEL_ONLY","kernel_key":{"lengths":[ 192,0 ],"precision":"single","scheme":"CS_KERNEL_STOCKHAM","sbrc_trans":"NONE","kernelConfig":{"use_3steps":false,"half_lds":true,"dir_reg":true,"buffer_inst":false,"tpb":16,"wgs":256,"tpt":[ 16,0 ],"factors":[ 3,4,4,4 ],"ebtype":"NONE","direction":-1,"static_dim":3,"placement":"IP","iAryType":"CI","oAryType":"CI"}}}
              ,{"sol_node_type":"SOL_KERNEL_ONLY","kernel_key":{"lengths":[ 192,0 ],"precision":"single","scheme":"CS_KERNEL_STOCKHAM","sbrc_trans":"NONE","kernelConfig":{"use_3steps":false,"half_lds":false,"dir_reg":true,"buffer_inst":false,"tpb":16,"wgs":192,"tpt":[ 12,0 ],"factors":[ 2,2,3,4,4 ],"ebtype":"NONE","direction":1,"static_dim":3,"placement":"IP","iAryType":"CI","oAryType":"CI"}}}
               ]},
{"Problem":{"arch":"gfx90a","token":"kernel_len2187_single_sbrr"},
 "Solutions":[ {"sol_node_type":"SOL_KERNEL_ONLY","kernel_key":{"lengths":[ 2187,0 ],"precision":"single","scheme":"CS_KERNEL_STOCKHAM","sbrc_trans":"NONE","kernelConfig":{"use_3steps":false,"half_lds":false,"dir_reg":true,"buffer_inst":false,"tpb":1,"wgs":243,"tpt":[ 243,0 ],"factors":[ 9,9,9,3 ],"ebtype":"NONE","direction":-1,"static_dim":0,"placement":"NA","iAryType":"CI","oAryType":"CI"}}}
              ,{"sol_node_type":"SOL_KERNEL_ONLY","kernel_key":{"lengths":[ 2187,0 ],"precision":"single","scheme":"CS_KERNEL_STOCKHAM","sbrc_trans":"NONE","kernelConfig":{"use_3steps":false,"half_lds":true,"dir_reg":true,"buffer_inst":false,"tpb":1,"wgs":243,"tpt":[ 243,0 ],"factors":[ 9,3,3,3,3,3 ],"ebtype":"NONE","direction":-1,"static_dim":0,"placement":"NA","iAryType":"CI","oAryType":"CI"}}}
               ]},
{"Problem":{"arch":"gfx90a","token":"kernel_len243_double_sbrr"},
 "Solutions":[ {"sol_node_type":"SOL_KERNEL_ONLY","kernel_key":{"lengths":[ 243,0 ],"precision":"double","scheme":"CS_KERNEL_STOCKHAM","sbrc_trans":"NONE","kernelConfig":{"use_3steps":false,"half_lds":false,"dir_reg":true,"buffer_inst":false,"tpb":3,"wgs":243,"tpt":[ 81,0 ],"factors":[ 3,3,3,3,3 ],"ebtype":"NONE","direction":-1,"static_dim":1,"placement":"IP","iAryType":"CI","oAryType":"CI"}}}
              ,{"sol_node_type":"SOL_KERNEL_ONLY","kernel_key":{"lengths":[ 243,0 ],"precision":"double","scheme":"CS_KERNEL_STOCKHAM","sbrc_trans":"NONE","kernelConfig":{"use_3steps":false,"half_lds":true,"dir_reg":true,"buffer_inst":false,"tpb":4,"wgs":108,"tpt":[ 27,0 ],"factors":[ 9,9,3 ],"ebtype":"R2C_POST","direction":-1,"static_dim":1,"placement":"OP","iAryType":"CI","oAryType":"HI"}}}
              ,{"sol_node_type":"SOL_KERNEL_ONLY","kernel_key":{"lengths":[ 243,0 ],"precision":"double","scheme":"CS_KERNEL_STOCKHAM","sbrc_trans":"NONE","kernelConfig":{"use_3steps":false,"half_lds":false,"dir_reg":true,"buffer_inst":false,"tpb":7,"wgs":189,"tpt":[ 27,0 ],"factors":[ 9,3,9 ],"ebtype":"NONE","direction":-1,"static_dim":1,"placement":"IP","iAryType":"CI","oAryType":"CI"}}}
              ,{"sol_node_type":"SOL_KERNEL_ONLY","kernel_key":{"lengths":[ 243,0 ],"precision":"double","scheme":"CS_KERNEL_STOCKHAM","sbrc_trans":"NONE","kernelConfig":{"use_3steps":false,"half_lds":false,"dir_reg":true,"buffer_inst":false,"tpb":2,"wgs":162,"tpt":[ 81,0 ],"factors":[ 3,3,3,3,3 ],"ebtype":"NONE","direction":1,"static_dim":1,"placement":"IP","iAryType":"CI","oAryType":"CI"}}}
              ,{"sol_node_type":"SOL_KERNEL_ONLY","kernel_key":{"lengths":[ 243,0 ],"precision":"double","scheme":"CS_KERNEL_STOCKHAM","sbrc_trans":"NONE","kernelConfig":{"use_3steps":false,"half_lds":true,"dir_reg":true,"buffer_inst":false,"tpb":2,"wgs":162,"tpt":[ 81,0 ],"factors":[ 3,3,3,3,3 ],"ebtype":"C2R_PRE","direction":1,"static_dim":1,"placement":"IP","iAryType":"HI","oAryType":"CI"}}}
              ,{"sol_node_type":"SOL_KERNEL_ONLY","kernel_key":{"lengths":[ 243,0 ],"precision":"double","scheme":"CS_KERNEL_STOCKHAM","sbrc_trans":"NONE","kernelConfig":{"use_3steps":false,"half_lds":true,"dir_reg":true,"buffer_inst":false,"tpb":4,"wgs":108,"tpt":[ 27,0 ],"factors":[ 3,9,9 ],"ebtype":"C2R_PRE","direction":1,"static_dim":1,"placement":"OP","iAryType":"HI","oAryType":"CI"}}}
               ]},
{"Problem":{"arch":"gfx90a","token":"kernel_len243_single_sbrr"},
 "Solutions":[ {"sol_node_type":"SOL_KERNEL_ONLY","kernel_key":{"lengths":[ 243,0 ],"precision":"single","scheme":"CS_KERNEL_STOCKHAM","sbrc_trans":"NONE","kernelConfig":{"use_3steps":false,"half_lds":false,"dir_reg":false,"buffer_inst":false,"tpb":4,"wgs":108,"tpt":[ 27,0 ],"factors":[ 9,9,3 ],"ebtype":"NONE","direction":-1,"static_dim":0,"placement":"NA","iAryType":"CI","oAryType":"CI"}}}
              ,{"sol_node_type":"SOL_KERNEL_ONLY","kernel_key":{"lengths":[ 243,0 ],"precision":"single","scheme":"CS_KERNEL_STOCKHAM","sbrc_trans":"NONE","kernelConfig":{"use_3steps":false,"half_lds":false,"dir_reg":true,"buffer_inst":false,"tpb":7,"wgs":189,"tpt":[ 27,0 ],"factors":[ 9,9,3 ],"ebtype":"NONE","direction":-1,"static_dim":0,"placement":"NA","iAryType":"CI","oAryType":"CI"}}}
               ]},
{"Problem":{"arch":"gfx90a","token":"kernel_len256_single_sbrr"},
 "Solutions":[ {"sol_node_type":"SOL_KERNEL_ONLY","kernel_key":{"lengths":[ 256,0 ],"precision":"single","scheme":"CS_KERNEL_STOCKHAM","sbrc_trans":"NONE","kernelConfig":{"use_3steps":false,"half_lds":false,"dir_reg":true,"buffer_inst":false,"tpb":4,"wgs":128,"tpt":[ 32,0 ],"factors":[ 2,4,4,8 ],"ebtype":"NONE","direction":-1,"static_dim":0,"placement":"NA","iAryType":"CI","oAryType":"CI"}}}
               ]},
{"Problem":{"arch":"gfx90a","token":"kernel_len25_single_sbrr"},
 "Solutions":[ {"sol_node_type":"SOL_KERNEL_ONLY","kernel_key":{"lengths":[ 25,0 ],"precision":"single","scheme":"CS_KERNEL_STOCKHAM","sbrc_trans":"NONE","kernelConfig":{"use_3steps":false,"half_lds":false,"dir_reg":true,"buffer_inst":false,"tpb":13,"wgs":65,"tpt":[ 5,0 ],"factors":[ 5,5 ],"ebtype":"NONE","direction":-1,"static_dim":3,"placement":"IP","iAryType":"CI","oAryType":"HI"}}}
              ,{"sol_node_type":"SOL_KERNEL_ONLY","kernel_key":{"lengths":[ 25,0 ],"precision":"single","scheme":"CS_KERNEL_STOCKHAM","sbrc_trans":"NONE","kernelConfig":{"use_3steps":false,"half_lds":false,"dir_reg":true,"buffer_inst":false,"tpb":25,"wgs":125,"tpt":[ 5,0 ],"factors":[ 5,5 ],"ebtype":"NONE","direction":1,"static_dim":2,"placement":"IP","iAryType":"CI","oAryType":"CI"}}}
               ]},
{"Problem":{"arch":"gfx90a","token":"kernel_len26_double_sbrr"},
 "Solutions":[ {"sol_node_type":"SOL_KERNEL_ONLY","kernel_key":{"lengths":[ 26,0 ],"precision":"double","scheme":"CS_KERNEL_STOCKHAM","sbrc_trans":"NONE","kernelConfig":{"use_3steps":false,"half_lds":false,"dir_reg":true,"buffer_inst":false,"tpb":32,"wgs":64,"tpt":[ 2,0 ],"factors":[ 13,2 ],"ebtype":"R2C_POST","direction":-1,"static_dim":1,"placement":"OP","iAryType":"CI","oAryType":"CI"}}}
              ,{"sol_node_type":"SOL_KERNEL_ONLY","kernel_key":{"lengths":[ 26,0 ],"precision":"double","scheme":"CS_KERNEL_STOCKHAM","sbrc_trans":"NONE","kernelConfig":{"use_3steps":false,"half_lds":false,"dir_reg":true,"buffer_inst":false,"tpb":64,"wgs":128,"tpt":[ 2,0 ],"factors":[ 13,2 ],"ebtype":"NONE","direction":-1,"static_dim":2,"placement":"IP","iAryType":"CI","oAryType":"HI"}}}
               ]},
{"Problem":{"arch":"gfx90a","token":"kernel_len4096_single_sbrr"},
 "Solutions":[ {"sol_node_type":"SOL_KERNEL_ONLY","kernel_key":{"lengths":[ 4096,0 ],"precision":"single","scheme":"CS_KERNEL_STOCKHAM","sbrc_trans":"NONE","kernelConfig":{"use_3steps":false,"half_lds":true,"dir_reg":true,"buffer_inst":false,"tpb":2,"wgs":256,"tpt":[ 128,0 ],"factors":[ 8,16,4,8 ],"ebtype":"NONE","direction":-1,"static_dim":0,"placement":"NA","iAryType":"CI","oAryType":"CI"}}}
               ]},
{"Problem":{"arch":"gfx90a","token":"kernel_len40_single_sbrr"},
 "Solutions":[ {"sol_node_type":"SOL_KERNEL_ONLY","kernel_key":{"lengths":[ 40,0 ],"precision":"single","scheme":"CS_KERNEL_STOCKHAM","sbrc_trans":"NONE","kernelConfig":{"use_3steps":false,"half_lds":true,"dir_reg":true,"buffer_inst":false,"tpb":20,"wgs":200,"tpt":[ 10,0 ],"factors":[ 5,4,2 ],"ebtype":"R2C_POST","direction":-1,"static_dim":1,"placement":"OP","iAryType":"CI","oAryType":"CI"}}}
               ]},
{"Problem":{"arch":"gfx90a","token":"kernel_len42_single_sbrr"},
 "Solutions":[ {"sol_node_type":"SOL_KERNEL_ONLY","kernel_key":{"lengths":[ 42,0 ],"precision":"single","scheme":"CS_KERNEL_STOCKHAM","sbrc_trans":"NONE","kernelConfig":{"use_3steps":false,"half_lds":false,"dir_reg":true,"buffer_inst":false,"tpb":9,"wgs":63,"tpt":[ 7,0 ],"factors":[ 2,3,7 ],"ebtype":"NONE","direction":1,"static_dim":2,"placement":"IP","iAryType":"CI","oAryType":"CI"}}}
               ]},
{"Problem":{"arch":"gfx90a","token":"kernel_len48_single_sbrr"},
 "Solutions":[ {"sol_node_type":"SOL_KERNEL_ONLY","kernel_key":{"lengths":[ 48,0 ],"precision":"single","scheme":"CS_KERNEL_STOCKHAM","sbrc_trans":"NONE","kernelConfig":{"use_3steps":false,"half_lds":false,"dir_reg":true,"buffer_inst":false,"tpb":10,"wgs":60,"tpt":[ 6,0 ],"factors":[ 2,4,6 ],"ebtype":"R2C_POST","direction":-1,"static_dim":1,"placement":"OP","iAryType":"CI","oAryType":"CI"}}}
              ,{"sol_node_type":"SOL_KERNEL_ONLY","kernel_key":{"lengths":[ 48,0 ],"precision":"single","scheme":"CS_KERNEL_STOCKHAM","sbrc_trans":"NONE","kernelConfig":{"use_3steps":false,"half_lds":true,"dir_reg":true,"buffer_inst":false,"tpb":10,"wgs":60,"tpt":[ 6,0 ],"factors":[ 4,2,6 ],"ebtype":"C2R_PRE","direction":1,"static_dim":1,"placement":"OP","iAryType":"CI","oAryType":"CI"}}}
              ,{"sol_node_type":"SOL_KERNEL_ONLY","kernel_key":{"lengths":[ 48,0 ],"precision":"single","scheme":"CS_KERNEL_STOCKHAM","sbrc_trans":"NONE","kernelConfig":{"use_3steps":false,"half_lds":false,"dir_reg":true,"buffer_inst":false,"tpb":10,"wgs":60,"tpt":[ 6,0 ],"factors":[ 4,2,6 ],"ebtype":"C2R_PRE","direction":1,"static_dim":1,"placement":"OP","iAryType":"CI","oAryType":"CI"}}}
              ,{"sol_node_type":"SOL_KERNEL_ONLY","kernel_key":{"lengths":[ 48,0 ],"precision":"single","scheme":"CS_KERNEL_STOCKHAM","sbrc_trans":"NONE","kernelConfig":{"use_3steps":false,"half_lds":false,"dir_reg":true,"buffer_inst":false,"tpb":10,"wgs":60,"tpt":[ 6,0 ],"factors":[ 2,4,6 ],"ebtype":"C2R_PRE","direction":1,"static_dim":1,"placement":"OP","iAryType":"CI","oAryType":"CI"}}}
               ]},
{"Problem":{"arch":"gfx90a","token":"kernel_len50_double_sbrr"},
 "Solutions":[ {"sol_node_type":"SOL_KERNEL_ONLY","kernel_key":{"lengths":[ 50,0 ],"precision":"double","scheme":"CS_KERNEL_STOCKHAM","sbrc_trans":"NONE","kernelConfig":{"use_3steps":false,"half_lds":true,"dir_reg":true,"buffer_inst":false,"tpb":25,"wgs":125,"tpt":[ 5,0 ],"factors":[ 10,5 ],"ebtype":"R2C_POST","direction":-1,"static_dim":1,"placement":"OP","iAryType":"CI","oAryType":"CI"}}}
              ,{"sol_node_type":"SOL_KERNEL_ONLY","kernel_key":{"lengths":[ 50,0 ],"precision":"double","scheme":"CS_KERNEL_STOCKHAM","sbrc_trans":"NONE","kernelConfig":{"use_3steps":false,"half_lds":true,"dir_reg":true,"buffer_inst":false,"tpb":6,"wgs":60,"tpt":[ 10,0 ],"factors":[ 2,5,5 ],"ebtype":"C2R_PRE","direction":1,"static_dim":1,"placement":"OP","iAryType":"CI","oAryType":"CI"}}}
               ]},
{"Problem":{"arch":"gfx90a","token":"kernel_len50_single_sbrr"},
 "Solutions":[ {"sol_node_type":"SOL_KERNEL_ONLY","kernel_key":{"lengths":[ 50,0 ],"precision":"single","scheme":"CS_KERNEL_STOCKHAM","sbrc_trans":"NONE","kernelConfig":{"use_3steps":false,"half_lds":false,"dir_reg":true,"buffer_inst":false,"tpb":6,"wgs":60,"tpt":[ 10,0 ],"factors":[ 5,2,5 ],"ebtype":"R2C_POST","direction":-1,"static_dim":1,"placement":"OP","iAryType":"CI","oAryType":"CI"}}}
              ,{"sol_node_type":"SOL_KERNEL_ONLY","kernel_key":{"lengths":[ 50,0 ],"precision":"single","scheme":"CS_KERNEL_STOCKHAM","sbrc_trans":"NONE","kernelConfig":{"use_3steps":false,"half_lds":true,"dir_reg":true,"buffer_inst":false,"tpb":6,"wgs":60,"tpt":[ 10,0 ],"factors":[ 2,5,5 ],"ebtype":"C2R_PRE","direction":1,"static_dim":1,"placement":"OP","iAryType":"CI","oAryType":"CI"}}}
              ,{"sol_node_type":"SOL_KERNEL_ONLY","kernel_key":{"lengths":[ 50,0 ],"precision":"single","scheme":"CS_KERNEL_STOCKHAM","sbrc_trans":"NONE","kernelConfig":{"use_3steps":false,"half_lds":false,"dir_reg":true,"buffer_inst":false,"tpb":6,"wgs":60,"tpt":[ 10,0 ],"factors":[ 5,5,2 ],"ebtype":"R2C_POST","direction":-1,"static_dim":1,"placement":"OP","iAryType":"CI","oAryType":"CI"}}}
              ,{"sol_node_type":"SOL_KERNEL_ONLY","kernel_key":{"lengths":[ 50,0 ],"precision":"single","scheme":"CS_KERNEL_STOCKHAM","sbrc_trans":"NONE","kernelConfig":{"use_3steps":false,"half_lds":false,"dir_reg":true,"buffer_inst":false,"tpb":6,"wgs":60,"tpt":[ 10,0 ],"factors":[ 2,5,5 ],"ebtype":"C2R_PRE","direction":1,"static_dim":1,"placement":"OP","iAryType":"CI","oAryType":"CI"}}}
              ,{"sol_node_type":"SOL_KERNEL_ONLY","kernel_key":{"lengths":[ 50,0 ],"precision":"single","scheme":"CS_KERNEL_STOCKHAM","sbrc_trans":"NONE","kernelConfig":{"use_3steps":false,"half_lds":true,"dir_reg":true,"buffer_inst":false,"tpb":12,"wgs":60,"tpt":[ 5,0 ],"factors":[ 2,5,5 ],"ebtype":"C2R_PRE","direction":1,"static_dim":1,"placement":"OP","iAryType":"CI","oAryType":"CI"}}}
              ,{"sol_node_type":"SOL_KERNEL_ONLY","kernel_key":{"lengths":[ 50,0 ],"precision":"single","scheme":"CS_KERNEL_STOCKHAM","sbrc_trans":"NONE","kernelConfig":{"use_3steps":false,"half_lds":false,"dir_reg":true,"buffer_inst":false,"tpb":25,"wgs":125,"tpt":[ 5,0 ],"factors":[ 2,5,5 ],"ebtype":"R2C_POST","direction":-1,"static_dim":1,"placement":"OP","iAryType":"CI","oAryType":"CI"}}}
               ]},
{"Problem":{"arch":"gfx90a","token":"kernel_len52_double_sbrr"},
 "Solutions":[ {"sol_node_type":"SOL_KERNEL_ONLY","kernel_key":{"lengths":[ 52,0 ],"precision":"double","scheme":"CS_KERNEL_STOCKHAM","sbrc_trans":"NONE","kernelConfig":{"use_3steps":false,"half_lds":true,"dir_reg":true,"buffer_inst":false,"tpb":16,"wgs":64,"tpt":[ 4,0 ],"factors":[ 13,4 ],"ebtype":"R2C_POST","direction":-1,"static_dim":1,"placement":"OP","iAryType":"CI","oAryType":"CI"}}}
              ,{"sol_node_type":"SOL_KERNEL_ONLY","kernel_key":{"lengths":[ 52,0 ],"precision":"double","scheme":"CS_KERNEL_STOCKHAM","sbrc_trans":"NONE","kernelConfig":{"use_3steps":false,"half_lds":true,"dir_reg":true,"buffer_inst":false,"tpb":32,"wgs":128,"tpt":[ 4,0 ],"factors":[ 13,4 ],"ebtype":"C2R_PRE","direction":1,"static_dim":1,"placement":"OP","iAryType":"CI","oAryType":"CI"}}}
               ]},
{"Problem":{"arch":"gfx90a","token":"kernel_len52_single_sbrr"},
 "Solutions":[ {"sol_node_type":"SOL_KERNEL_ONLY","kernel_key":{"lengths":[ 52,0 ],"precision":"single","scheme":"CS_KERNEL_STOCKHAM","sbrc_trans":"NONE","kernelConfig":{"use_3steps":false,"half_lds":true,"dir_reg":true,"buffer_inst":false,"tpb":9,"wgs":117,"tpt":[ 13,0 ],"factors":[ 4,13 ],"ebtype":"R2C_POST","direction":-1,"static_dim":1,"placement":"OP","iAryType":"CI","oAryType":"CI"}}}
               ]},
{"Problem":{"arch":"gfx90a","token":"kernel_len54_single_sbrr"},
 "Solutions":[ {"sol_node_type":"SOL_KERNEL_ONLY","kernel_key":{"lengths":[ 54,0 ],"precision":"single","scheme":"CS_KERNEL_STOCKHAM","sbrc_trans":"NONE","kernelConfig":{"use_3steps":false,"half_lds":true,"dir_reg":true,"buffer_inst":false,"tpb":21,"wgs":126,"tpt":[ 6,0 ],"factors":[ 3,3,6 ],"ebtype":"R2C_POST","direction":-1,"static_dim":1,"placement":"OP","iAryType":"CI","oAryType":"CI"}}}
              ,{"sol_node_type":"SOL_KERNEL_ONLY","kernel_key":{"lengths":[ 54,0 ],"precision":"single","scheme":"CS_KERNEL_STOCKHAM","sbrc_trans":"NONE","kernelConfig":{"use_3steps":false,"half_lds":false,"dir_reg":true,"buffer_inst":false,"tpb":10,"wgs":60,"tpt":[ 6,0 ],"factors":[ 2,3,3,3 ],"ebtype":"C2R_PRE","direction":1,"static_dim":1,"placement":"OP","iAryType":"CI","oAryType":"CI"}}}
              ,{"sol_node_type":"SOL_KERNEL_ONLY","kernel_key":{"lengths":[ 54,0 ],"precision":"single","scheme":"CS_KERNEL_STOCKHAM","sbrc_trans":"NONE","kernelConfig":{"use_3steps":false,"half_lds":false,"dir_reg":true,"buffer_inst":false,"tpb":10,"wgs":60,"tpt":[ 6,0 ],"factors":[ 3,3,6 ],"ebtype":"R2C_POST","direction":-1,"static_dim":1,"placement":"OP","iAryType":"CI","oAryType":"CI"}}}
              ,{"sol_node_type":"SOL_KERNEL_ONLY","kernel_key":{"lengths":[ 54,0 ],"precision":"single","scheme":"CS_KERNEL_STOCKHAM","sbrc_trans":"NONE","kernelConfig":{"use_3steps":false,"half_lds":true,"dir_reg":true,"buffer_inst":false,"tpb":10,"wgs":60,"tpt":[ 6,0 ],"factors":[ 2,3,3,3 ],"ebtype":"C2R_PRE","direction":1,"static_dim":1,"placement":"OP","iAryType":"CI","oAryType":"CI"}}}
               ]},
{"Problem":{"arch":"gfx90a","token":"kernel_len55_double_sbrr"},
 "Solutions":[ {"sol_node_type":"SOL_KERNEL_ONLY","kernel_key":{"lengths":[ 55,0 ],"precision":"double","scheme":"CS_KERNEL_STOCKHAM","sbrc_trans":"NONE","kernelConfig":{"use_3steps":false,"half_lds":true,"dir_reg":true,"buffer_inst":false,"tpb":12,"wgs":132,"tpt":[ 11,0 ],"factors":[ 5,11 ],"ebtype":"NONE","direction":1,"static_dim":1,"placement":"IP","iAryType":"CI","oAryType":"CI"}}}
              ,{"sol_node_type":"SOL_KERNEL_ONLY","kernel_key":{"lengths":[ 55,0 ],"precision":"double","scheme":"CS_KERNEL_STOCKHAM","sbrc_trans":"NONE","kernelConfig":{"use_3steps":false,"half_lds":false,"dir_reg":true,"buffer_inst":false,"tpb":5,"wgs":55,"tpt":[ 11,0 ],"factors":[ 5,11 ],"ebtype":"NONE","direction":1,"static_dim":1,"placement":"IP","iAryType":"CI","oAryType":"CI"}}}
              ,{"sol_node_type":"SOL_KERNEL_ONLY","kernel_key":{"lengths":[ 55,0 ],"precision":"double","scheme":"CS_KERNEL_STOCKHAM","sbrc_trans":"NONE","kernelConfig":{"use_3steps":false,"half_lds":false,"dir_reg":true,"buffer_inst":false,"tpb":12,"wgs":132,"tpt":[ 11,0 ],"factors":[ 5,11 ],"ebtype":"NONE","direction":1,"static_dim":1,"placement":"IP","iAryType":"CI","oAryType":"CI"}}}
               ]},
{"Problem":{"arch":"gfx90a","token":"kernel_len55_single_sbrr"},
 "Solutions":[ {"sol_node_type":"SOL_KERNEL_ONLY","kernel_key":{"lengths":[ 55,0 ],"precision":"single","scheme":"CS_KERNEL_STOCKHAM","sbrc_trans":"NONE","kernelConfig":{"use_3steps":false,"half_lds":true,"dir_reg":true,"buffer_inst":false,"tpb":12,"wgs":132,"tpt":[ 11,0 ],"factors":[ 5,11 ],"ebtype":"NONE","direction":-1,"static_dim":1,"placement":"IP","iAryType":"CI","oAryType":"CI"}}}
              ,{"sol_node_type":"SOL_KERNEL_ONLY","kernel_key":{"lengths":[ 55,0 ],"precision":"single","scheme":"CS_KERNEL_STOCKHAM","sbrc_trans":"NONE","kernelConfig":{"use_3steps":false,"half_lds":true,"dir_reg":true,"buffer_inst":false,"tpb":11,"wgs":121,"tpt":[ 11,0 ],"factors":[ 5,11 ],"ebtype":"NONE","direction":-1,"static_dim":1,"placement":"IP","iAryType":"CI","oAryType":"CI"}}}
              ,{"sol_node_type":"SOL_KERNEL_ONLY","kernel_key":{"lengths":[ 55,0 ],"precision":"single","scheme":"CS_KERNEL_STOCKHAM","sbrc_trans":"NONE","kernelConfig":{"use_3steps":false,"half_lds":false,"dir_reg":true,"buffer_inst":false,"tpb":11,"wgs":121,"tpt":[ 11,0 ],"factors":[ 5,11 ],"ebtype":"NONE","direction":1,"static_dim":1,"placement":"IP","iAryType":"CI","oAryType":"CI"}}}
              ,{"sol_node_type":"SOL_KERNEL_ONLY","kernel_key":{"lengths":[ 55,0 ],"precision":"single","scheme":"CS_KERNEL_STOCKHAM","sbrc_trans":"NONE","kernelConfig":{"use_3steps":false,"half_lds":false,"dir_reg":true,"buffer_inst":false,"tpb":6,"wgs":66,"tpt":[ 11,0 ],"factors":[ 5,11 ],"ebtype":"NONE","direction":1,"static_dim":1,"placement":"IP","iAryType":"CI","oAryType":"CI"}}}
               ]},
{"Problem":{"arch":"gfx90a","token":"kernel_len56_double_sbrr"},
 "Solutions":[ {"sol_node_type":"SOL_KERNEL_ONLY","kernel_key":{"lengths":[ 56,0 ],"precision":"double","scheme":"CS_KERNEL_STOCKHAM","sbrc_trans":"NONE","kernelConfig":{"use_3steps":false,"half_lds":false,"dir_reg":true,"buffer_inst":false,"tpb":16,"wgs":128,"tpt":[ 8,0 ],"factors":[ 7,4,2 ],"ebtype":"NONE","direction":-1,"static_dim":0,"placement":"NA","iAryType":"CI","oAryType":"CI"}}}
              ,{"sol_node_type":"SOL_KERNEL_ONLY","kernel_key":{"lengths":[ 56,0 ],"precision":"double","scheme":"CS_KERNEL_STOCKHAM","sbrc_trans":"NONE","kernelConfig":{"use_3steps":false,"half_lds":false,"dir_reg":true,"buffer_inst":false,"tpb":8,"wgs":64,"tpt":[ 8,0 ],"factors":[ 7,4,2 ],"ebtype":"NONE","direction":-1,"static_dim":0,"placement":"NA","iAryType":"CI","oAryType":"CI"}}}
              ,{"sol_node_type":"SOL_KERNEL_ONLY","kernel_key":{"lengths":[ 56,0 ],"precision":"double","scheme":"CS_KERNEL_STOCKHAM","sbrc_trans":"NONE","kernelConfig":{"use_3steps":false,"half_lds":false,"dir_reg":true,"buffer_inst":false,"tpb":24,"wgs":192,"tpt":[ 8,0 ],"factors":[ 7,2,4 ],"ebtype":"NONE","direction":-1,"static_dim":0,"placement":"NA","iAryType":"CI","oAryType":"CI"}}}
              ,{"sol_node_type":"SOL_KERNEL_ONLY","kernel_key":{"lengths":[ 56,0 ],"precision":"double","scheme":"CS_KERNEL_STOCKHAM","sbrc_trans":"NONE","kernelConfig":{"use_3steps":false,"half_lds":false,"dir_reg":true,"buffer_inst":false,"tpb":16,"wgs":128,"tpt":[ 8,0 ],"factors":[ 4,7,2 ],"ebtype":"NONE","direction":-1,"static_dim":0,"placement":"NA","iAryType":"CI","oAryType":"CI"}}}
               ]},
{"Problem":{"arch":"gfx90a","token":"kernel_len56_single_sbrr"},
 "Solutions":[ {"sol_node_type":"SOL_KERNEL_ONLY","kernel_key":{"lengths":[ 56,0 ],"precision":"single","scheme":"CS_KERNEL_STOCKHAM","sbrc_trans":"NONE","kernelConfig":{"use_3steps":false,"half_lds":true,"dir_reg":true,"buffer_inst":false,"tpb":18,"wgs":252,"tpt":[ 14,0 ],"factors":[ 7,4,2 ],"ebtype":"R2C_POST","direction":-1,"static_dim":1,"placement":"OP","iAryType":"CI","oAryType":"CI"}}}
              ,{"sol_node_type":"SOL_KERNEL_ONLY","kernel_key":{"lengths":[ 56,0 ],"precision":"single","scheme":"CS_KERNEL_STOCKHAM","sbrc_trans":"NONE","kernelConfig":{"use_3steps":false,"half_lds":false,"dir_reg":true,"buffer_inst":false,"tpb":4,"wgs":56,"tpt":[ 14,0 ],"factors":[ 2,4,7 ],"ebtype":"C2R_PRE","direction":1,"static_dim":1,"placement":"OP","iAryType":"CI","oAryType":"CI"}}}
               ]},
{"Problem":{"arch":"gfx90a","token":"kernel_len64_single_sbrr"},
 "Solutions":[ {"sol_node_type":"SOL_KERNEL_ONLY","kernel_key":{"lengths":[ 64,0 ],"precision":"single","scheme":"CS_KERNEL_STOCKHAM","sbrc_trans":"NONE","kernelConfig":{"use_3steps":false,"half_lds":true,"dir_reg":true,"buffer_inst":false,"tpb":8,"wgs":64,"tpt":[ 8,0 ],"factors":[ 8,8 ],"ebtype":"R2C_POST","direction":-1,"static_dim":1,"placement":"OP","iAryType":"CI","oAryType":"CI"}}}
              ,{"sol_node_type":"SOL_KERNEL_ONLY","kernel_key":{"lengths":[ 64,0 ],"precision":"single","scheme":"CS_KERNEL_STOCKHAM","sbrc_trans":"NONE","kernelConfig":{"use_3steps":false,"half_lds":false,"dir_reg":true,"buffer_inst":false,"tpb":8,"wgs":64,"tpt":[ 8,0 ],"factors":[ 8,8 ],"ebtype":"C2R_PRE","direction":1,"static_dim":1,"placement":"OP","iAryType":"CI","oAryType":"CI"}}}
               ]},
{"Problem":{"arch":"gfx90a","token":"kernel_len72_single_sbrr"},
 "Solutions":[ {"sol_node_type":"SOL_KERNEL_ONLY","kernel_key":{"lengths":[ 72,0 ],"precision":"single","scheme":"CS_KERNEL_STOCKHAM","sbrc_trans":"NONE","kernelConfig":{"use_3steps":false,"half_lds":true,"dir_reg":true,"buffer_inst":false,"tpb":8,"wgs":64,"tpt":[ 8,0 ],"factors":[ 3,3,8 ],"ebtype":"R2C_POST","direction":-1,"static_dim":1,"placement":"OP","iAryType":"CI","oAryType":"CI"}}}
              ,{"sol_node_type":"SOL_KERNEL_ONLY","kernel_key":{"lengths":[ 72,0 ],"precision":"single","scheme":"CS_KERNEL_STOCKHAM","sbrc_trans":"NONE","kernelConfig":{"use_3steps":false,"half_lds":false,"dir_reg":true,"buffer_inst":false,"tpb":8,"wgs":64,"tpt":[ 8,0 ],"factors":[ 2,3,3,4 ],"ebtype":"C2R_PRE","direction":1,"static_dim":1,"placement":"OP","iAryType":"CI","oAryType":"CI"}}}
               ]},
{"Problem":{"arch":"gfx90a","token":"kernel_len75_double_sbrr"},
 "Solutions":[ {"sol_node_type":"SOL_KERNEL_ONLY","kernel_key":{"lengths":[ 75,0 ],"precision":"double","scheme":"CS_KERNEL_STOCKHAM","sbrc_trans":"NONE","kernelConfig":{"use_3steps":false,"half_lds":false,"dir_reg":true,"buffer_inst":false,"tpb":13,"wgs":195,"tpt":[ 15,0 ],"factors":[ 5,3,5 ],"ebtype":"NONE","direction":1,"static_dim":1,"placement":"IP","iAryType":"CI","oAryType":"CI"}}}
               ]},
{"Problem":{"arch":"gfx90a","token":"kernel_len75_single_sbrr"},
 "Solutions":[ {"sol_node_type":"SOL_KERNEL_ONLY","kernel_key":{"lengths":[ 75,0 ],"precision":"single","scheme":"CS_KERNEL_STOCKHAM","sbrc_trans":"NONE","kernelConfig":{"use_3steps":false,"half_lds":false,"dir_reg":true,"buffer_inst":false,"tpb":8,"wgs":120,"tpt":[ 15,0 ],"factors":[ 3,5,5 ],"ebtype":"NONE","direction":-1,"static_dim":1,"placement":"IP","iAryType":"CI","oAryType":"CI"}}}
               ]},
{"Problem":{"arch":"gfx90a","token":"kernel_len81_double_sbrr"},
 "Solutions":[ {"sol_node_type":"SOL_KERNEL_ONLY","kernel_key":{"lengths":[ 81,0 ],"precision":"double","scheme":"CS_KERNEL_STOCKHAM","sbrc_trans":"NONE","kernelConfig":{"use_3steps":false,"half_lds":false,"dir_reg":true,"buffer_inst":false,"tpb":21,"wgs":189,"tpt":[ 9,0 ],"factors":[ 9,3,3 ],"ebtype":"NONE","direction":-1,"static_dim":0,"placement":"NA","iAryType":"CI","oAryType":"CI"}}}
               ]},
{"Problem":{"arch":"gfx90a","token":"kernel_len84_single_sbrr"},
 "Solutions":[ {"sol_node_type":"SOL_KERNEL_ONLY","kernel_key":{"lengths":[ 84,0 ],"precision":"single","scheme":"CS_KERNEL_STOCKHAM","sbrc_trans":"NONE","kernelConfig":{"use_3steps":false,"half_lds":true,"dir_reg":true,"buffer_inst":false,"tpb":9,"wgs":126,"tpt":[ 14,0 ],"factors":[ 2,6,7 ],"ebtype":"R2C_POST","direction":-1,"static_dim":1,"placement":"OP","iAryType":"CI","oAryType":"CI"}}}
              ,{"sol_node_type":"SOL_KERNEL_ONLY","kernel_key":{"lengths":[ 84,0 ],"precision":"single","scheme":"CS_KERNEL_STOCKHAM","sbrc_trans":"NONE","kernelConfig":{"use_3steps":false,"half_lds":false,"dir_reg":true,"buffer_inst":false,"tpb":9,"wgs":126,"tpt":[ 14,0 ],"factors":[ 2,6,7 ],"ebtype":"C2R_PRE","direction":1,"static_dim":1,"placement":"OP","iAryType":"CI","oAryType":"CI"}}}
              ,{"sol_node_type":"SOL_KERNEL_ONLY","kernel_key":{"lengths":[ 84,0 ],"precision":"single","scheme":"CS_KERNEL_STOCKHAM","sbrc_trans":"NONE","kernelConfig":{"use_3steps":false,"half_lds":false,"dir_reg":true,"buffer_inst":false,"tpb":18,"wgs":252,"tpt":[ 14,0 ],"factors":[ 7,6,2 ],"ebtype":"R2C_POST","direction":-1,"static_dim":1,"placement":"OP","iAryType":"CI","oAryType":"CI"}}}
              ,{"sol_node_type":"SOL_KERNEL_ONLY","kernel_key":{"lengths":[ 84,0 ],"precision":"single","scheme":"CS_KERNEL_STOCKHAM","sbrc_trans":"NONE","kernelConfig":{"use_3steps":false,"half_lds":true,"dir_reg":true,"buffer_inst":false,"tpb":9,"wgs":126,"tpt":[ 14,0 ],"factors":[ 2,6,7 ],"ebtype":"C2R_PRE","direction":1,"static_dim":1,"placement":"OP","iAryType":"CI","oAryType":"CI"}}}
               ]},
{"Problem":{"arch":"gfx90a","token":"kernel_len96_single_sbrr"},
 "Solutions":[ {"sol_node_type":"SOL_KERNEL_ONLY","kernel_key":{"lengths":[ 96,0 ],"precision":"single","scheme":"CS_KERNEL_STOCKHAM","sbrc_trans":"NONE","kernelConfig":{"use_3steps":false,"half_lds":false,"dir_reg":true,"buffer_inst":false,"tpb":8,"wgs":64,"tpt":[ 8,0 ],"factors":[ 2,2,3,8 ],"ebtype":"R2C_POST","direction":-1,"static_dim":1,"placement":"OP","iAryType":"CI","oAryType":"CI"}}}
              ,{"sol_node_type":"SOL_KERNEL_ONLY","kernel_key":{"lengths":[ 96,0 ],"precision":"single","scheme":"CS_KERNEL_STOCKHAM","sbrc_trans":"NONE","kernelConfig":{"use_3steps":false,"half_lds":false,"dir_reg":true,"buffer_inst":false,"tpb":8,"wgs":64,"tpt":[ 8,0 ],"factors":[ 2,3,4,4 ],"ebtype":"C2R_PRE","direction":1,"static_dim":1,"placement":"OP","iAryType":"CI","oAryType":"CI"}}}
              ,{"sol_node_type":"SOL_KERNEL_ONLY","kernel_key":{"lengths":[ 96,0 ],"precision":"single","scheme":"CS_KERNEL_STOCKHAM","sbrc_trans":"NONE","kernelConfig":{"use_3steps":false,"half_lds":false,"dir_reg":true,"buffer_inst":false,"tpb":8,"wgs":64,"tpt":[ 8,0 ],"factors":[ 2,6,8 ],"ebtype":"R2C_POST","direction":-1,"static_dim":1,"placement":"OP","iAryType":"CI","oAryType":"CI"}}}
              ,{"sol_node_type":"SOL_KERNEL_ONLY","kernel_key":{"lengths":[ 96,0 ],"precision":"single","scheme":"CS_KERNEL_STOCKHAM","sbrc_trans":"NONE","kernelConfig":{"use_3steps":false,"half_lds":true,"dir_reg":true,"buffer_inst":false,"tpb":8,"wgs":64,"tpt":[ 8,0 ],"factors":[ 2,3,4,4 ],"ebtype":"C2R_PRE","direction":1,"static_dim":1,"placement":"OP","iAryType":"CI","oAryType":"CI"}}}
              ,{"sol_node_type":"SOL_KERNEL_ONLY","kernel_key":{"lengths":[ 96,0 ],"precision":"single","scheme":"CS_KERNEL_STOCKHAM","sbrc_trans":"NONE","kernelConfig":{"use_3steps":false,"half_lds":true,"dir_reg":true,"buffer_inst":false,"tpb":8,"wgs":64,"tpt":[ 8,0 ],"factors":[ 2,6,8 ],"ebtype":"R2C_POST","direction":-1,"static_dim":1,"placement":"OP","iAryType":"CI","oAryType":"CI"}}}
              ,{"sol_node_type":"SOL_KERNEL_ONLY","kernel_key":{"lengths":[ 96,0 ],"precision":"single","scheme":"CS_KERNEL_STOCKHAM","sbrc_trans":"NONE","kernelConfig":{"use_3steps":false,"half_lds":true,"dir_reg":true,"buffer_inst":false,"tpb":16,"wgs":128,"tpt":[ 8,0 ],"factors":[ 2,3,4,4 ],"ebtype":"C2R_PRE","direction":1,"static_dim":1,"placement":"OP","iAryType":"CI","oAryType":"CI"}}}
              ,{"sol_node_type":"SOL_KERNEL_ONLY","kernel_key":{"lengths":[ 96,0 ],"precision":"single","scheme":"CS_KERNEL_STOCKHAM","sbrc_trans":"NONE","kernelConfig":{"use_3steps":false,"half_lds":true,"dir_reg":true,"buffer_inst":false,"tpb":8,"wgs":64,"tpt":[ 8,0 ],"factors":[ 4,3,8 ],"ebtype":"R2C_POST","direction":-1,"static_dim":1,"placement":"OP","iAryType":"CI","oAryType":"CI"}}}
              ,{"sol_node_type":"SOL_KERNEL_ONLY","kernel_key":{"lengths":[ 96,0 ],"precision":"single","scheme":"CS_KERNEL_STOCKHAM","sbrc_trans":"NONE","kernelConfig":{"use_3steps":false,"half_lds":false,"dir_reg":true,"buffer_inst":false,"tpb":16,"wgs":128,"tpt":[ 8,0 ],"factors":[ 4,3,8 ],"ebtype":"C2R_PRE","direction":1,"static_dim":1,"placement":"OP","iAryType":"CI","oAryType":"CI"}}}
               ]},
{"Problem":{"arch":"gfx90a","token":"kernel_len100_double_sbcc"},
 "Solutions":[ {"sol_node_type":"SOL_KERNEL_ONLY","kernel_key":{"lengths":[ 100,0 ],"precision":"double","scheme":"CS_KERNEL_STOCKHAM_BLOCK_CC","sbrc_trans":"NONE","kernelConfig":{"use_3steps":true,"half_lds":true,"dir_reg":true,"buffer_inst":false,"tpb":12,"wgs":120,"tpt":[ 10,0 ],"factors":[ 10,2,5 ],"ebtype":"NONE","direction":-1,"static_dim":0,"placement":"NA","iAryType":"CI","oAryType":"CI"}}}
              ,{"sol_node_type":"SOL_KERNEL_ONLY","kernel_key":{"lengths":[ 100,0 ],"precision":"double","scheme":"CS_KERNEL_STOCKHAM_BLOCK_CC","sbrc_trans":"NONE","kernelConfig":{"use_3steps":false,"half_lds":false,"dir_reg":true,"buffer_inst":false,"tpb":20,"wgs":200,"tpt":[ 10,0 ],"factors":[ 2,10,5 ],"ebtype":"NONE","direction":-1,"static_dim":3,"placement":"IP","iAryType":"CI","oAryType":"CI"}}}
              ,{"sol_node_type":"SOL_KERNEL_ONLY","kernel_key":{"lengths":[ 100,0 ],"precision":"double","scheme":"CS_KERNEL_STOCKHAM_BLOCK_CC","sbrc_trans":"NONE","kernelConfig":{"use_3steps":false,"half_lds":false,"dir_reg":true,"buffer_inst":false,"tpb":13,"wgs":130,"tpt":[ 10,0 ],"factors":[ 2,2,5,5 ],"ebtype":"NONE","direction":-1,"static_dim":2,"placement":"IP","iAryType":"CI","oAryType":"HI"}}}
              ,{"sol_node_type":"SOL_KERNEL_ONLY","kernel_key":{"lengths":[ 100,0 ],"precision":"double","scheme":"CS_KERNEL_STOCKHAM_BLOCK_CC","sbrc_trans":"NONE","kernelConfig":{"use_3steps":false,"half_lds":false,"dir_reg":true,"buffer_inst":true,"tpb":19,"wgs":190,"tpt":[ 10,0 ],"factors":[ 10,5,2 ],"ebtype":"NONE","direction":1,"static_dim":3,"placement":"IP","iAryType":"HI","oAryType":"CI"}}}
              ,{"sol_node_type":"SOL_KERNEL_ONLY","kernel_key":{"lengths":[ 100,0 ],"precision":"double","scheme":"CS_KERNEL_STOCKHAM_BLOCK_CC","sbrc_trans":"NONE","kernelConfig":{"use_3steps":false,"half_lds":false,"dir_reg":true,"buffer_inst":true,"tpb":19,"wgs":190,"tpt":[ 10,0 ],"factors":[ 10,10 ],"ebtype":"NONE","direction":1,"static_dim":2,"placement":"IP","iAryType":"CI","oAryType":"CI"}}}
               ]},
{"Problem":{"arch":"gfx90a","token":"kernel_len100_single_sbcc"},
 "Solutions":[ {"sol_node_type":"SOL_KERNEL_ONLY","kernel_key":{"lengths":[ 100,0 ],"precision":"single","scheme":"CS_KERNEL_STOCKHAM_BLOCK_CC","sbrc_trans":"NONE","kernelConfig":{"use_3steps":false,"half_lds":false,"dir_reg":true,"buffer_inst":false,"tpb":25,"wgs":250,"tpt":[ 10,0 ],"factors":[ 10,5,2 ],"ebtype":"NONE","direction":-1,"static_dim":3,"placement":"IP","iAryType":"CI","oAryType":"CI"}}}
              ,{"sol_node_type":"SOL_KERNEL_ONLY","kernel_key":{"lengths":[ 100,0 ],"precision":"single","scheme":"CS_KERNEL_STOCKHAM_BLOCK_CC","sbrc_trans":"NONE","kernelConfig":{"use_3steps":false,"half_lds":false,"dir_reg":true,"buffer_inst":false,"tpb":25,"wgs":250,"tpt":[ 10,0 ],"factors":[ 5,2,10 ],"ebtype":"NONE","direction":-1,"static_dim":2,"placement":"IP","iAryType":"CI","oAryType":"HI"}}}
              ,{"sol_node_type":"SOL_KERNEL_ONLY","kernel_key":{"lengths":[ 100,0 ],"precision":"single","scheme":"CS_KERNEL_STOCKHAM_BLOCK_CC","sbrc_trans":"NONE","kernelConfig":{"use_3steps":false,"half_lds":false,"dir_reg":true,"buffer_inst":true,"tpb":25,"wgs":250,"tpt":[ 10,0 ],"factors":[ 5,10,2 ],"ebtype":"NONE","direction":1,"static_dim":3,"placement":"IP","iAryType":"HI","oAryType":"CI"}}}
              ,{"sol_node_type":"SOL_KERNEL_ONLY","kernel_key":{"lengths":[ 100,0 ],"precision":"single","scheme":"CS_KERNEL_STOCKHAM_BLOCK_CC","sbrc_trans":"NONE","kernelConfig":{"use_3steps":false,"half_lds":false,"dir_reg":true,"buffer_inst":true,"tpb":25,"wgs":250,"tpt":[ 10,0 ],"factors":[ 10,10 ],"ebtype":"NONE","direction":1,"static_dim":2,"placement":"IP","iAryType":"CI","oAryType":"CI"}}}
               ]},
{"Problem":{"arch":"gfx90a","token":"kernel_len104_double_sbcc"},
 "Solutions":[ {"sol_node_type":"SOL_KERNEL_ONLY","kernel_key":{"lengths":[ 104,0 ],"precision":"double","scheme":"CS_KERNEL_STOCKHAM_BLOCK_CC","sbrc_trans":"NONE","kernelConfig":{"use_3steps":false,"half_lds":false,"dir_reg":true,"buffer_inst":true,"tpb":19,"wgs":152,"tpt":[ 8,0 ],"factors":[ 2,2,13,2 ],"ebtype":"NONE","direction":-1,"static_dim":2,"placement":"IP","iAryType":"CI","oAryType":"HI"}}}
              ,{"sol_node_type":"SOL_KERNEL_ONLY","kernel_key":{"lengths":[ 104,0 ],"precision":"double","scheme":"CS_KERNEL_STOCKHAM_BLOCK_CC","sbrc_trans":"NONE","kernelConfig":{"use_3steps":false,"half_lds":false,"dir_reg":true,"buffer_inst":true,"tpb":8,"wgs":208,"tpt":[ 26,0 ],"factors":[ 4,13,2 ],"ebtype":"NONE","direction":1,"static_dim":2,"placement":"IP","iAryType":"CI","oAryType":"CI"}}}
               ]},
{"Problem":{"arch":"gfx90a","token":"kernel_len104_single_sbcc"},
 "Solutions":[ {"sol_node_type":"SOL_KERNEL_ONLY","kernel_key":{"lengths":[ 104,0 ],"precision":"single","scheme":"CS_KERNEL_STOCKHAM_BLOCK_CC","sbrc_trans":"NONE","kernelConfig":{"use_3steps":false,"half_lds":true,"dir_reg":true,"buffer_inst":true,"tpb":8,"wgs":208,"tpt":[ 26,0 ],"factors":[ 4,13,2 ],"ebtype":"NONE","direction":-1,"static_dim":2,"placement":"IP","iAryType":"CI","oAryType":"HI"}}}
              ,{"sol_node_type":"SOL_KERNEL_ONLY","kernel_key":{"lengths":[ 104,0 ],"precision":"single","scheme":"CS_KERNEL_STOCKHAM_BLOCK_CC","sbrc_trans":"NONE","kernelConfig":{"use_3steps":false,"half_lds":true,"dir_reg":true,"buffer_inst":false,"tpb":8,"wgs":208,"tpt":[ 26,0 ],"factors":[ 2,13,2,2 ],"ebtype":"NONE","direction":1,"static_dim":2,"placement":"IP","iAryType":"CI","oAryType":"CI"}}}
               ]},
{"Problem":{"arch":"gfx90a","token":"kernel_len108_single_sbcc"},
 "Solutions":[ {"sol_node_type":"SOL_KERNEL_ONLY","kernel_key":{"lengths":[ 108,0 ],"precision":"single","scheme":"CS_KERNEL_STOCKHAM_BLOCK_CC","sbrc_trans":"NONE","kernelConfig":{"use_3steps":false,"half_lds":false,"dir_reg":true,"buffer_inst":true,"tpb":21,"wgs":252,"tpt":[ 12,0 ],"factors":[ 9,2,6 ],"ebtype":"NONE","direction":-1,"static_dim":3,"placement":"IP","iAryType":"CI","oAryType":"CI"}}}
              ,{"sol_node_type":"SOL_KERNEL_ONLY","kernel_key":{"lengths":[ 108,0 ],"precision":"single","scheme":"CS_KERNEL_STOCKHAM_BLOCK_CC","sbrc_trans":"NONE","kernelConfig":{"use_3steps":false,"half_lds":false,"dir_reg":true,"buffer_inst":false,"tpb":21,"wgs":252,"tpt":[ 12,0 ],"factors":[ 9,3,4 ],"ebtype":"NONE","direction":-1,"static_dim":2,"placement":"IP","iAryType":"CI","oAryType":"HI"}}}
              ,{"sol_node_type":"SOL_KERNEL_ONLY","kernel_key":{"lengths":[ 108,0 ],"precision":"single","scheme":"CS_KERNEL_STOCKHAM_BLOCK_CC","sbrc_trans":"NONE","kernelConfig":{"use_3steps":false,"half_lds":false,"dir_reg":true,"buffer_inst":false,"tpb":22,"wgs":198,"tpt":[ 9,0 ],"factors":[ 3,4,9 ],"ebtype":"NONE","direction":-1,"static_dim":2,"placement":"IP","iAryType":"CI","oAryType":"HI"}}}
              ,{"sol_node_type":"SOL_KERNEL_ONLY","kernel_key":{"lengths":[ 108,0 ],"precision":"single","scheme":"CS_KERNEL_STOCKHAM_BLOCK_CC","sbrc_trans":"NONE","kernelConfig":{"use_3steps":false,"half_lds":false,"dir_reg":true,"buffer_inst":false,"tpb":28,"wgs":252,"tpt":[ 9,0 ],"factors":[ 2,6,9 ],"ebtype":"NONE","direction":-1,"static_dim":2,"placement":"IP","iAryType":"CI","oAryType":"HI"}}}
              ,{"sol_node_type":"SOL_KERNEL_ONLY","kernel_key":{"lengths":[ 108,0 ],"precision":"single","scheme":"CS_KERNEL_STOCKHAM_BLOCK_CC","sbrc_trans":"NONE","kernelConfig":{"use_3steps":false,"half_lds":true,"dir_reg":true,"buffer_inst":false,"tpb":28,"wgs":252,"tpt":[ 9,0 ],"factors":[ 2,2,3,9 ],"ebtype":"NONE","direction":1,"static_dim":2,"placement":"IP","iAryType":"CI","oAryType":"CI"}}}
              ,{"sol_node_type":"SOL_KERNEL_ONLY","kernel_key":{"lengths":[ 108,0 ],"precision":"single","scheme":"CS_KERNEL_STOCKHAM_BLOCK_CC","sbrc_trans":"NONE","kernelConfig":{"use_3steps":false,"half_lds":false,"dir_reg":true,"buffer_inst":false,"tpb":28,"wgs":252,"tpt":[ 9,0 ],"factors":[ 4,3,9 ],"ebtype":"NONE","direction":-1,"static_dim":2,"placement":"IP","iAryType":"CI","oAryType":"HI"}}}
              ,{"sol_node_type":"SOL_KERNEL_ONLY","kernel_key":{"lengths":[ 108,0 ],"precision":"single","scheme":"CS_KERNEL_STOCKHAM_BLOCK_CC","sbrc_trans":"NONE","kernelConfig":{"use_3steps":false,"half_lds":false,"dir_reg":true,"buffer_inst":false,"tpb":28,"wgs":252,"tpt":[ 9,0 ],"factors":[ 6,2,9 ],"ebtype":"NONE","direction":1,"static_dim":2,"placement":"IP","iAryType":"CI","oAryType":"CI"}}}
               ]},
{"Problem":{"arch":"gfx90a","token":"kernel_len112_single_sbcc"},
 "Solutions":[ {"sol_node_type":"SOL_KERNEL_ONLY","kernel_key":{"lengths":[ 112,0 ],"precision":"single","scheme":"CS_KERNEL_STOCKHAM_BLOCK_CC","sbrc_trans":"NONE","kernelConfig":{"use_3steps":false,"half_lds":true,"dir_reg":true,"buffer_inst":false,"tpb":28,"wgs":196,"tpt":[ 7,0 ],"factors":[ 4,2,2,7 ],"ebtype":"NONE","direction":-1,"static_dim":2,"placement":"IP","iAryType":"CI","oAryType":"HI"}}}
              ,{"sol_node_type":"SOL_KERNEL_ONLY","kernel_key":{"lengths":[ 112,0 ],"precision":"single","scheme":"CS_KERNEL_STOCKHAM_BLOCK_CC","sbrc_trans":"NONE","kernelConfig":{"use_3steps":false,"half_lds":false,"dir_reg":true,"buffer_inst":false,"tpb":19,"wgs":133,"tpt":[ 7,0 ],"factors":[ 4,4,7 ],"ebtype":"NONE","direction":1,"static_dim":2,"placement":"IP","iAryType":"CI","oAryType":"CI"}}}
              ,{"sol_node_type":"SOL_KERNEL_ONLY","kernel_key":{"lengths":[ 112,0 ],"precision":"single","scheme":"CS_KERNEL_STOCKHAM_BLOCK_CC","sbrc_trans":"NONE","kernelConfig":{"use_3steps":false,"half_lds":false,"dir_reg":true,"buffer_inst":true,"tpb":19,"wgs":133,"tpt":[ 7,0 ],"factors":[ 4,4,7 ],"ebtype":"NONE","direction":-1,"static_dim":2,"placement":"IP","iAryType":"CI","oAryType":"HI"}}}
               ]},
{"Problem":{"arch":"gfx90a","token":"kernel_len125_double_sbcc"},
 "Solutions":[ {"sol_node_type":"SOL_KERNEL_ONLY","kernel_key":{"lengths":[ 125,0 ],"precision":"double","scheme":"CS_KERNEL_STOCKHAM_BLOCK_CC","sbrc_trans":"NONE","kernelConfig":{"use_3steps":true,"half_lds":false,"dir_reg":true,"buffer_inst":true,"tpb":9,"wgs":225,"tpt":[ 25,0 ],"factors":[ 5,5,5 ],"ebtype":"NONE","direction":-1,"static_dim":0,"placement":"NA","iAryType":"CI","oAryType":"CI"}}}
              ,{"sol_node_type":"SOL_KERNEL_ONLY","kernel_key":{"lengths":[ 125,0 ],"precision":"double","scheme":"CS_KERNEL_STOCKHAM_BLOCK_CC","sbrc_trans":"NONE","kernelConfig":{"use_3steps":true,"half_lds":false,"dir_reg":true,"buffer_inst":true,"tpb":10,"wgs":250,"tpt":[ 25,0 ],"factors":[ 5,5,5 ],"ebtype":"NONE","direction":-1,"static_dim":0,"placement":"NA","iAryType":"CI","oAryType":"CI"}}}
               ]},
{"Problem":{"arch":"gfx90a","token":"kernel_len125_single_sbcc"},
 "Solutions":[ {"sol_node_type":"SOL_KERNEL_ONLY","kernel_key":{"lengths":[ 125,0 ],"precision":"single","scheme":"CS_KERNEL_STOCKHAM_BLOCK_CC","sbrc_trans":"NONE","kernelConfig":{"use_3steps":false,"half_lds":false,"dir_reg":true,"buffer_inst":true,"tpb":32,"wgs":160,"tpt":[ 5,0 ],"factors":[ 5,5,5 ],"ebtype":"NONE","direction":-1,"static_dim":0,"placement":"NA","iAryType":"CI","oAryType":"CI"}}}
              ,{"sol_node_type":"SOL_KERNEL_ONLY","kernel_key":{"lengths":[ 125,0 ],"precision":"single","scheme":"CS_KERNEL_STOCKHAM_BLOCK_CC","sbrc_trans":"NONE","kernelConfig":{"use_3steps":false,"half_lds":false,"dir_reg":true,"buffer_inst":true,"tpb":20,"wgs":500,"tpt":[ 25,0 ],"factors":[ 5,5,5 ],"ebtype":"NONE","direction":-1,"static_dim":0,"placement":"NA","iAryType":"CI","oAryType":"CI"}}}
              ,{"sol_node_type":"SOL_KERNEL_ONLY","kernel_key":{"lengths":[ 125,0 ],"precision":"single","scheme":"CS_KERNEL_STOCKHAM_BLOCK_CC","sbrc_trans":"NONE","kernelConfig":{"use_3steps":false,"half_lds":false,"dir_reg":true,"buffer_inst":false,"tpb":20,"wgs":500,"tpt":[ 25,0 ],"factors":[ 5,5,5 ],"ebtype":"NONE","direction":-1,"static_dim":0,"placement":"NA","iAryType":"CI","oAryType":"CI"}}}
               ]},
{"Problem":{"arch":"gfx90a","token":"kernel_len128_single_sbcc"},
 "Solutions":[ {"sol_node_type":"SOL_KERNEL_ONLY","kernel_key":{"lengths":[ 128,0 ],"precision":"single","scheme":"CS_KERNEL_STOCKHAM_BLOCK_CC","sbrc_trans":"NONE","kernelConfig":{"use_3steps":false,"half_lds":false,"dir_reg":true,"buffer_inst":true,"tpb":16,"wgs":128,"tpt":[ 8,0 ],"factors":[ 8,4,2,2 ],"ebtype":"NONE","direction":-1,"static_dim":3,"placement":"IP","iAryType":"CI","oAryType":"CI"}}}
              ,{"sol_node_type":"SOL_KERNEL_ONLY","kernel_key":{"lengths":[ 128,0 ],"precision":"single","scheme":"CS_KERNEL_STOCKHAM_BLOCK_CC","sbrc_trans":"NONE","kernelConfig":{"use_3steps":false,"half_lds":false,"dir_reg":true,"buffer_inst":true,"tpb":32,"wgs":128,"tpt":[ 4,0 ],"factors":[ 2,4,4,4 ],"ebtype":"NONE","direction":-1,"static_dim":2,"placement":"IP","iAryType":"CI","oAryType":"HI"}}}
              ,{"sol_node_type":"SOL_KERNEL_ONLY","kernel_key":{"lengths":[ 128,0 ],"precision":"single","scheme":"CS_KERNEL_STOCKHAM_BLOCK_CC","sbrc_trans":"NONE","kernelConfig":{"use_3steps":false,"half_lds":false,"dir_reg":true,"buffer_inst":true,"tpb":16,"wgs":128,"tpt":[ 8,0 ],"factors":[ 4,4,4,2 ],"ebtype":"NONE","direction":-1,"static_dim":2,"placement":"IP","iAryType":"CI","oAryType":"HI"}}}
              ,{"sol_node_type":"SOL_KERNEL_ONLY","kernel_key":{"lengths":[ 128,0 ],"precision":"single","scheme":"CS_KERNEL_STOCKHAM_BLOCK_CC","sbrc_trans":"NONE","kernelConfig":{"use_3steps":false,"half_lds":false,"dir_reg":true,"buffer_inst":false,"tpb":32,"wgs":128,"tpt":[ 4,0 ],"factors":[ 2,4,4,4 ],"ebtype":"NONE","direction":1,"static_dim":2,"placement":"IP","iAryType":"CI","oAryType":"CI"}}}
               ]},
{"Problem":{"arch":"gfx90a","token":"kernel_len160_single_sbcc"},
 "Solutions":[ {"sol_node_type":"SOL_KERNEL_ONLY","kernel_key":{"lengths":[ 160,0 ],"precision":"single","scheme":"CS_KERNEL_STOCKHAM_BLOCK_CC","sbrc_trans":"NONE","kernelConfig":{"use_3steps":false,"half_lds":false,"dir_reg":true,"buffer_inst":true,"tpb":20,"wgs":200,"tpt":[ 10,0 ],"factors":[ 2,8,10 ],"ebtype":"NONE","direction":-1,"static_dim":3,"placement":"IP","iAryType":"CI","oAryType":"CI"}}}
              ,{"sol_node_type":"SOL_KERNEL_ONLY","kernel_key":{"lengths":[ 160,0 ],"precision":"single","scheme":"CS_KERNEL_STOCKHAM_BLOCK_CC","sbrc_trans":"NONE","kernelConfig":{"use_3steps":false,"half_lds":false,"dir_reg":true,"buffer_inst":false,"tpb":19,"wgs":190,"tpt":[ 10,0 ],"factors":[ 4,4,10 ],"ebtype":"NONE","direction":-1,"static_dim":2,"placement":"IP","iAryType":"CI","oAryType":"HI"}}}
              ,{"sol_node_type":"SOL_KERNEL_ONLY","kernel_key":{"lengths":[ 160,0 ],"precision":"single","scheme":"CS_KERNEL_STOCKHAM_BLOCK_CC","sbrc_trans":"NONE","kernelConfig":{"use_3steps":false,"half_lds":false,"dir_reg":true,"buffer_inst":false,"tpb":25,"wgs":250,"tpt":[ 10,0 ],"factors":[ 2,4,4,5 ],"ebtype":"NONE","direction":-1,"static_dim":3,"placement":"IP","iAryType":"CI","oAryType":"CI"}}}
              ,{"sol_node_type":"SOL_KERNEL_ONLY","kernel_key":{"lengths":[ 160,0 ],"precision":"single","scheme":"CS_KERNEL_STOCKHAM_BLOCK_CC","sbrc_trans":"NONE","kernelConfig":{"use_3steps":false,"half_lds":false,"dir_reg":true,"buffer_inst":false,"tpb":20,"wgs":200,"tpt":[ 10,0 ],"factors":[ 2,4,4,5 ],"ebtype":"NONE","direction":1,"static_dim":3,"placement":"IP","iAryType":"CI","oAryType":"CI"}}}
              ,{"sol_node_type":"SOL_KERNEL_ONLY","kernel_key":{"lengths":[ 160,0 ],"precision":"single","scheme":"CS_KERNEL_STOCKHAM_BLOCK_CC","sbrc_trans":"NONE","kernelConfig":{"use_3steps":false,"half_lds":true,"dir_reg":true,"buffer_inst":true,"tpb":20,"wgs":200,"tpt":[ 10,0 ],"factors":[ 2,4,4,5 ],"ebtype":"NONE","direction":1,"static_dim":2,"placement":"IP","iAryType":"CI","oAryType":"CI"}}}
              ,{"sol_node_type":"SOL_KERNEL_ONLY","kernel_key":{"lengths":[ 160,0 ],"precision":"single","scheme":"CS_KERNEL_STOCKHAM_BLOCK_CC","sbrc_trans":"NONE","kernelConfig":{"use_3steps":false,"half_lds":false,"dir_reg":true,"buffer_inst":false,"tpb":19,"wgs":190,"tpt":[ 10,0 ],"factors":[ 2,8,10 ],"ebtype":"NONE","direction":-1,"static_dim":3,"placement":"IP","iAryType":"CI","oAryType":"HI"}}}
               ]},
{"Problem":{"arch":"gfx90a","token":"kernel_len168_double_sbcc"},
 "Solutions":[ {"sol_node_type":"SOL_KERNEL_ONLY","kernel_key":{"lengths":[ 168,0 ],"precision":"double","scheme":"CS_KERNEL_STOCKHAM_BLOCK_CC","sbrc_trans":"NONE","kernelConfig":{"use_3steps":true,"half_lds":true,"dir_reg":true,"buffer_inst":true,"tpb":12,"wgs":252,"tpt":[ 21,0 ],"factors":[ 7,8,3 ],"ebtype":"NONE","direction":-1,"static_dim":0,"placement":"NA","iAryType":"CI","oAryType":"CI"}}}
              ,{"sol_node_type":"SOL_KERNEL_ONLY","kernel_key":{"lengths":[ 168,0 ],"precision":"double","scheme":"CS_KERNEL_STOCKHAM_BLOCK_CC","sbrc_trans":"NONE","kernelConfig":{"use_3steps":true,"half_lds":true,"dir_reg":true,"buffer_inst":true,"tpb":12,"wgs":168,"tpt":[ 14,0 ],"factors":[ 7,6,2,2 ],"ebtype":"NONE","direction":-1,"static_dim":0,"placement":"NA","iAryType":"CI","oAryType":"CI"}}}
              ,{"sol_node_type":"SOL_KERNEL_ONLY","kernel_key":{"lengths":[ 168,0 ],"precision":"double","scheme":"CS_KERNEL_STOCKHAM_BLOCK_CC","sbrc_trans":"NONE","kernelConfig":{"use_3steps":true,"half_lds":true,"dir_reg":true,"buffer_inst":true,"tpb":12,"wgs":168,"tpt":[ 14,0 ],"factors":[ 2,7,6,2 ],"ebtype":"NONE","direction":-1,"static_dim":0,"placement":"NA","iAryType":"CI","oAryType":"CI"}}}
               ]},
{"Problem":{"arch":"gfx90a","token":"kernel_len168_single_sbcc"},
 "Solutions":[ {"sol_node_type":"SOL_KERNEL_ONLY","kernel_key":{"lengths":[ 168,0 ],"precision":"single","scheme":"CS_KERNEL_STOCKHAM_BLOCK_CC","sbrc_trans":"NONE","kernelConfig":{"use_3steps":false,"half_lds":false,"dir_reg":true,"buffer_inst":false,"tpb":18,"wgs":252,"tpt":[ 14,0 ],"factors":[ 7,4,3,2 ],"ebtype":"NONE","direction":-1,"static_dim":2,"placement":"IP","iAryType":"CI","oAryType":"HI"}}}
              ,{"sol_node_type":"SOL_KERNEL_ONLY","kernel_key":{"lengths":[ 168,0 ],"precision":"single","scheme":"CS_KERNEL_STOCKHAM_BLOCK_CC","sbrc_trans":"NONE","kernelConfig":{"use_3steps":false,"half_lds":false,"dir_reg":true,"buffer_inst":true,"tpb":10,"wgs":140,"tpt":[ 14,0 ],"factors":[ 2,3,4,7 ],"ebtype":"NONE","direction":1,"static_dim":2,"placement":"IP","iAryType":"CI","oAryType":"CI"}}}
              ,{"sol_node_type":"SOL_KERNEL_ONLY","kernel_key":{"lengths":[ 168,0 ],"precision":"single","scheme":"CS_KERNEL_STOCKHAM_BLOCK_CC","sbrc_trans":"NONE","kernelConfig":{"use_3steps":false,"half_lds":false,"dir_reg":true,"buffer_inst":false,"tpb":14,"wgs":196,"tpt":[ 14,0 ],"factors":[ 2,2,6,7 ],"ebtype":"NONE","direction":-1,"static_dim":2,"placement":"IP","iAryType":"CI","oAryType":"HI"}}}
              ,{"sol_node_type":"SOL_KERNEL_ONLY","kernel_key":{"lengths":[ 168,0 ],"precision":"single","scheme":"CS_KERNEL_STOCKHAM_BLOCK_CC","sbrc_trans":"NONE","kernelConfig":{"use_3steps":false,"half_lds":false,"dir_reg":true,"buffer_inst":false,"tpb":10,"wgs":140,"tpt":[ 14,0 ],"factors":[ 2,6,7,2 ],"ebtype":"NONE","direction":1,"static_dim":2,"placement":"IP","iAryType":"CI","oAryType":"CI"}}}
              ,{"sol_node_type":"SOL_KERNEL_ONLY","kernel_key":{"lengths":[ 168,0 ],"precision":"single","scheme":"CS_KERNEL_STOCKHAM_BLOCK_CC","sbrc_trans":"NONE","kernelConfig":{"use_3steps":false,"half_lds":false,"dir_reg":true,"buffer_inst":false,"tpb":14,"wgs":196,"tpt":[ 14,0 ],"factors":[ 2,3,4,7 ],"ebtype":"NONE","direction":-1,"static_dim":3,"placement":"IP","iAryType":"CI","oAryType":"CI"}}}
              ,{"sol_node_type":"SOL_KERNEL_ONLY","kernel_key":{"lengths":[ 168,0 ],"precision":"single","scheme":"CS_KERNEL_STOCKHAM_BLOCK_CC","sbrc_trans":"NONE","kernelConfig":{"use_3steps":false,"half_lds":false,"dir_reg":true,"buffer_inst":true,"tpb":14,"wgs":196,"tpt":[ 14,0 ],"factors":[ 7,6,2,2 ],"ebtype":"NONE","direction":-1,"static_dim":2,"placement":"IP","iAryType":"CI","oAryType":"HI"}}}
              ,{"sol_node_type":"SOL_KERNEL_ONLY","kernel_key":{"lengths":[ 168,0 ],"precision":"single","scheme":"CS_KERNEL_STOCKHAM_BLOCK_CC","sbrc_trans":"NONE","kernelConfig":{"use_3steps":false,"half_lds":false,"dir_reg":true,"buffer_inst":false,"tpb":24,"wgs":192,"tpt":[ 8,0 ],"factors":[ 3,7,8 ],"ebtype":"NONE","direction":1,"static_dim":2,"placement":"IP","iAryType":"CI","oAryType":"CI"}}}
              ,{"sol_node_type":"SOL_KERNEL_ONLY","kernel_key":{"lengths":[ 168,0 ],"precision":"single","scheme":"CS_KERNEL_STOCKHAM_BLOCK_CC","sbrc_trans":"NONE","kernelConfig":{"use_3steps":false,"half_lds":false,"dir_reg":true,"buffer_inst":true,"tpb":14,"wgs":196,"tpt":[ 14,0 ],"factors":[ 3,4,7,2 ],"ebtype":"NONE","direction":1,"static_dim":3,"placement":"IP","iAryType":"CI","oAryType":"CI"}}}
              ,{"sol_node_type":"SOL_KERNEL_ONLY","kernel_key":{"lengths":[ 168,0 ],"precision":"single","scheme":"CS_KERNEL_STOCKHAM_BLOCK_CC","sbrc_trans":"NONE","kernelConfig":{"use_3steps":false,"half_lds":false,"dir_reg":true,"buffer_inst":true,"tpb":18,"wgs":252,"tpt":[ 14,0 ],"factors":[ 7,4,3,2 ],"ebtype":"NONE","direction":-1,"static_dim":3,"placement":"IP","iAryType":"CI","oAryType":"HI"}}}
              ,{"sol_node_type":"SOL_KERNEL_ONLY","kernel_key":{"lengths":[ 168,0 ],"precision":"single","scheme":"CS_KERNEL_STOCKHAM_BLOCK_CC","sbrc_trans":"NONE","kernelConfig":{"use_3steps":false,"half_lds":false,"dir_reg":true,"buffer_inst":false,"tpb":18,"wgs":252,"tpt":[ 14,0 ],"factors":[ 2,3,4,7 ],"ebtype":"NONE","direction":1,"static_dim":2,"placement":"IP","iAryType":"CI","oAryType":"CI"}}}
               ]},
{"Problem":{"arch":"gfx90a","token":"kernel_len192_single_sbcc"},
 "Solutions":[ {"sol_node_type":"SOL_KERNEL_ONLY","kernel_key":{"lengths":[ 192,0 ],"precision":"single","scheme":"CS_KERNEL_STOCKHAM_BLOCK_CC","sbrc_trans":"NONE","kernelConfig":{"use_3steps":false,"half_lds":false,"dir_reg":true,"buffer_inst":true,"tpb":16,"wgs":256,"tpt":[ 16,0 ],"factors":[ 4,3,16 ],"ebtype":"NONE","direction":-1,"static_dim":3,"placement":"IP","iAryType":"CI","oAryType":"CI"}}}
              ,{"sol_node_type":"SOL_KERNEL_ONLY","kernel_key":{"lengths":[ 192,0 ],"precision":"single","scheme":"CS_KERNEL_STOCKHAM_BLOCK_CC","sbrc_trans":"NONE","kernelConfig":{"use_3steps":false,"half_lds":false,"dir_reg":true,"buffer_inst":false,"tpb":16,"wgs":256,"tpt":[ 16,0 ],"factors":[ 4,2,2,3,4 ],"ebtype":"NONE","direction":-1,"static_dim":2,"placement":"IP","iAryType":"CI","oAryType":"HI"}}}
              ,{"sol_node_type":"SOL_KERNEL_ONLY","kernel_key":{"lengths":[ 192,0 ],"precision":"single","scheme":"CS_KERNEL_STOCKHAM_BLOCK_CC","sbrc_trans":"NONE","kernelConfig":{"use_3steps":false,"half_lds":false,"dir_reg":true,"buffer_inst":true,"tpb":16,"wgs":256,"tpt":[ 16,0 ],"factors":[ 2,6,16 ],"ebtype":"NONE","direction":1,"static_dim":3,"placement":"IP","iAryType":"CI","oAryType":"CI"}}}
              ,{"sol_node_type":"SOL_KERNEL_ONLY","kernel_key":{"lengths":[ 192,0 ],"precision":"single","scheme":"CS_KERNEL_STOCKHAM_BLOCK_CC","sbrc_trans":"NONE","kernelConfig":{"use_3steps":false,"half_lds":false,"dir_reg":true,"buffer_inst":true,"tpb":16,"wgs":256,"tpt":[ 16,0 ],"factors":[ 2,2,6,8 ],"ebtype":"NONE","direction":1,"static_dim":2,"placement":"IP","iAryType":"CI","oAryType":"CI"}}}
              ,{"sol_node_type":"SOL_KERNEL_ONLY","kernel_key":{"lengths":[ 192,0 ],"precision":"single","scheme":"CS_KERNEL_STOCKHAM_BLOCK_CC","sbrc_trans":"NONE","kernelConfig":{"use_3steps":false,"half_lds":false,"dir_reg":true,"buffer_inst":false,"tpb":16,"wgs":192,"tpt":[ 12,0 ],"factors":[ 8,2,3,4 ],"ebtype":"NONE","direction":-1,"static_dim":2,"placement":"IP","iAryType":"CI","oAryType":"HI"}}}
              ,{"sol_node_type":"SOL_KERNEL_ONLY","kernel_key":{"lengths":[ 192,0 ],"precision":"single","scheme":"CS_KERNEL_STOCKHAM_BLOCK_CC","sbrc_trans":"NONE","kernelConfig":{"use_3steps":false,"half_lds":false,"dir_reg":true,"buffer_inst":false,"tpb":21,"wgs":252,"tpt":[ 12,0 ],"factors":[ 4,4,2,2,3 ],"ebtype":"NONE","direction":1,"static_dim":3,"placement":"IP","iAryType":"CI","oAryType":"CI"}}}
              ,{"sol_node_type":"SOL_KERNEL_ONLY","kernel_key":{"lengths":[ 192,0 ],"precision":"single","scheme":"CS_KERNEL_STOCKHAM_BLOCK_CC","sbrc_trans":"NONE","kernelConfig":{"use_3steps":false,"half_lds":false,"dir_reg":true,"buffer_inst":false,"tpb":16,"wgs":256,"tpt":[ 16,0 ],"factors":[ 2,2,3,4,4 ],"ebtype":"NONE","direction":1,"static_dim":2,"placement":"IP","iAryType":"CI","oAryType":"CI"}}}
              ,{"sol_node_type":"SOL_KERNEL_ONLY","kernel_key":{"lengths":[ 192,0 ],"precision":"single","scheme":"CS_KERNEL_STOCKHAM_BLOCK_CC","sbrc_trans":"NONE","kernelConfig":{"use_3steps":false,"half_lds":false,"dir_reg":true,"buffer_inst":true,"tpb":16,"wgs":192,"tpt":[ 12,0 ],"factors":[ 16,4,3 ],"ebtype":"NONE","direction":-1,"static_dim":3,"placement":"IP","iAryType":"CI","oAryType":"HI"}}}
              ,{"sol_node_type":"SOL_KERNEL_ONLY","kernel_key":{"lengths":[ 192,0 ],"precision":"single","scheme":"CS_KERNEL_STOCKHAM_BLOCK_CC","sbrc_trans":"NONE","kernelConfig":{"use_3steps":false,"half_lds":true,"dir_reg":true,"buffer_inst":true,"tpb":16,"wgs":256,"tpt":[ 16,0 ],"factors":[ 4,4,3,4 ],"ebtype":"NONE","direction":1,"static_dim":2,"placement":"IP","iAryType":"CI","oAryType":"CI"}}}
              ,{"sol_node_type":"SOL_KERNEL_ONLY","kernel_key":{"lengths":[ 192,0 ],"precision":"single","scheme":"CS_KERNEL_STOCKHAM_BLOCK_CC","sbrc_trans":"NONE","kernelConfig":{"use_3steps":false,"half_lds":false,"dir_reg":true,"buffer_inst":false,"tpb":16,"wgs":192,"tpt":[ 12,0 ],"factors":[ 4,4,6,2 ],"ebtype":"NONE","direction":-1,"static_dim":3,"placement":"IP","iAryType":"CI","oAryType":"HI"}}}
              ,{"sol_node_type":"SOL_KERNEL_ONLY","kernel_key":{"lengths":[ 192,0 ],"precision":"single","scheme":"CS_KERNEL_STOCKHAM_BLOCK_CC","sbrc_trans":"NONE","kernelConfig":{"use_3steps":false,"half_lds":true,"dir_reg":true,"buffer_inst":true,"tpb":16,"wgs":256,"tpt":[ 16,0 ],"factors":[ 2,2,3,4,4 ],"ebtype":"NONE","direction":1,"static_dim":2,"placement":"IP","iAryType":"CI","oAryType":"CI"}}}
               ]},
{"Problem":{"arch":"gfx90a","token":"kernel_len200_double_sbcc"},
 "Solutions":[ {"sol_node_type":"SOL_KERNEL_ONLY","kernel_key":{"lengths":[ 200,0 ],"precision":"double","scheme":"CS_KERNEL_STOCKHAM_BLOCK_CC","sbrc_trans":"NONE","kernelConfig":{"use_3steps":false,"half_lds":false,"dir_reg":true,"buffer_inst":false,"tpb":10,"wgs":200,"tpt":[ 20,0 ],"factors":[ 10,2,10 ],"ebtype":"NONE","direction":-1,"static_dim":3,"placement":"IP","iAryType":"CI","oAryType":"CI"}}}
               ]},
{"Problem":{"arch":"gfx90a","token":"kernel_len200_single_sbcc"},
 "Solutions":[ {"sol_node_type":"SOL_KERNEL_ONLY","kernel_key":{"lengths":[ 200,0 ],"precision":"single","scheme":"CS_KERNEL_STOCKHAM_BLOCK_CC","sbrc_trans":"NONE","kernelConfig":{"use_3steps":false,"half_lds":false,"dir_reg":true,"buffer_inst":true,"tpb":12,"wgs":240,"tpt":[ 20,0 ],"factors":[ 2,10,5,2 ],"ebtype":"NONE","direction":-1,"static_dim":2,"placement":"IP","iAryType":"CI","oAryType":"HI"}}}
              ,{"sol_node_type":"SOL_KERNEL_ONLY","kernel_key":{"lengths":[ 200,0 ],"precision":"single","scheme":"CS_KERNEL_STOCKHAM_BLOCK_CC","sbrc_trans":"NONE","kernelConfig":{"use_3steps":false,"half_lds":false,"dir_reg":true,"buffer_inst":true,"tpb":10,"wgs":200,"tpt":[ 20,0 ],"factors":[ 2,5,10,2 ],"ebtype":"NONE","direction":1,"static_dim":2,"placement":"IP","iAryType":"CI","oAryType":"CI"}}}
              ,{"sol_node_type":"SOL_KERNEL_ONLY","kernel_key":{"lengths":[ 200,0 ],"precision":"single","scheme":"CS_KERNEL_STOCKHAM_BLOCK_CC","sbrc_trans":"NONE","kernelConfig":{"use_3steps":false,"half_lds":false,"dir_reg":true,"buffer_inst":false,"tpb":12,"wgs":240,"tpt":[ 20,0 ],"factors":[ 2,2,5,10 ],"ebtype":"NONE","direction":-1,"static_dim":3,"placement":"IP","iAryType":"CI","oAryType":"CI"}}}
              ,{"sol_node_type":"SOL_KERNEL_ONLY","kernel_key":{"lengths":[ 200,0 ],"precision":"single","scheme":"CS_KERNEL_STOCKHAM_BLOCK_CC","sbrc_trans":"NONE","kernelConfig":{"use_3steps":false,"half_lds":false,"dir_reg":true,"buffer_inst":false,"tpb":12,"wgs":240,"tpt":[ 20,0 ],"factors":[ 2,10,10 ],"ebtype":"NONE","direction":1,"static_dim":3,"placement":"IP","iAryType":"CI","oAryType":"CI"}}}
              ,{"sol_node_type":"SOL_KERNEL_ONLY","kernel_key":{"lengths":[ 200,0 ],"precision":"single","scheme":"CS_KERNEL_STOCKHAM_BLOCK_CC","sbrc_trans":"NONE","kernelConfig":{"use_3steps":false,"half_lds":false,"dir_reg":true,"buffer_inst":true,"tpb":16,"wgs":320,"tpt":[ 20,0 ],"factors":[ 2,4,5,5 ],"ebtype":"NONE","direction":-1,"static_dim":3,"placement":"IP","iAryType":"CI","oAryType":"CI"}}}
              ,{"sol_node_type":"SOL_KERNEL_ONLY","kernel_key":{"lengths":[ 200,0 ],"precision":"single","scheme":"CS_KERNEL_STOCKHAM_BLOCK_CC","sbrc_trans":"NONE","kernelConfig":{"use_3steps":false,"half_lds":false,"dir_reg":true,"buffer_inst":true,"tpb":16,"wgs":320,"tpt":[ 20,0 ],"factors":[ 2,2,5,10 ],"ebtype":"NONE","direction":-1,"static_dim":2,"placement":"IP","iAryType":"CI","oAryType":"HI"}}}
               ]},
{"Problem":{"arch":"gfx90a","token":"kernel_len208_double_sbcc"},
 "Solutions":[ {"sol_node_type":"SOL_KERNEL_ONLY","kernel_key":{"lengths":[ 208,0 ],"precision":"double","scheme":"CS_KERNEL_STOCKHAM_BLOCK_CC","sbrc_trans":"NONE","kernelConfig":{"use_3steps":false,"half_lds":false,"dir_reg":true,"buffer_inst":false,"tpb":9,"wgs":234,"tpt":[ 26,0 ],"factors":[ 13,8,2 ],"ebtype":"NONE","direction":-1,"static_dim":3,"placement":"IP","iAryType":"CI","oAryType":"CI"}}}
              ,{"sol_node_type":"SOL_KERNEL_ONLY","kernel_key":{"lengths":[ 208,0 ],"precision":"double","scheme":"CS_KERNEL_STOCKHAM_BLOCK_CC","sbrc_trans":"NONE","kernelConfig":{"use_3steps":false,"half_lds":false,"dir_reg":true,"buffer_inst":true,"tpb":9,"wgs":234,"tpt":[ 26,0 ],"factors":[ 13,8,2 ],"ebtype":"NONE","direction":1,"static_dim":3,"placement":"IP","iAryType":"HI","oAryType":"CI"}}}
               ]},
{"Problem":{"arch":"gfx90a","token":"kernel_len208_single_sbcc"},
 "Solutions":[ {"sol_node_type":"SOL_KERNEL_ONLY","kernel_key":{"lengths":[ 208,0 ],"precision":"single","scheme":"CS_KERNEL_STOCKHAM_BLOCK_CC","sbrc_trans":"NONE","kernelConfig":{"use_3steps":false,"half_lds":false,"dir_reg":true,"buffer_inst":false,"tpb":19,"wgs":247,"tpt":[ 13,0 ],"factors":[ 2,2,4,13 ],"ebtype":"NONE","direction":-1,"static_dim":3,"placement":"IP","iAryType":"CI","oAryType":"CI"}}}
              ,{"sol_node_type":"SOL_KERNEL_ONLY","kernel_key":{"lengths":[ 208,0 ],"precision":"single","scheme":"CS_KERNEL_STOCKHAM_BLOCK_CC","sbrc_trans":"NONE","kernelConfig":{"use_3steps":false,"half_lds":false,"dir_reg":true,"buffer_inst":true,"tpb":19,"wgs":247,"tpt":[ 13,0 ],"factors":[ 2,2,4,13 ],"ebtype":"NONE","direction":1,"static_dim":3,"placement":"IP","iAryType":"HI","oAryType":"CI"}}}
              ,{"sol_node_type":"SOL_KERNEL_ONLY","kernel_key":{"lengths":[ 208,0 ],"precision":"single","scheme":"CS_KERNEL_STOCKHAM_BLOCK_CC","sbrc_trans":"NONE","kernelConfig":{"use_3steps":false,"half_lds":false,"dir_reg":true,"buffer_inst":true,"tpb":19,"wgs":247,"tpt":[ 13,0 ],"factors":[ 2,8,13 ],"ebtype":"NONE","direction":1,"static_dim":3,"placement":"IP","iAryType":"CI","oAryType":"CI"}}}
               ]},
{"Problem":{"arch":"gfx90a","token":"kernel_len216_single_sbcc"},
 "Solutions":[ {"sol_node_type":"SOL_KERNEL_ONLY","kernel_key":{"lengths":[ 216,0 ],"precision":"single","scheme":"CS_KERNEL_STOCKHAM_BLOCK_CC","sbrc_trans":"NONE","kernelConfig":{"use_3steps":false,"half_lds":false,"dir_reg":true,"buffer_inst":false,"tpb":8,"wgs":144,"tpt":[ 18,0 ],"factors":[ 2,2,3,3,6 ],"ebtype":"NONE","direction":-1,"static_dim":3,"placement":"IP","iAryType":"CI","oAryType":"CI"}}}
              ,{"sol_node_type":"SOL_KERNEL_ONLY","kernel_key":{"lengths":[ 216,0 ],"precision":"single","scheme":"CS_KERNEL_STOCKHAM_BLOCK_CC","sbrc_trans":"NONE","kernelConfig":{"use_3steps":false,"half_lds":false,"dir_reg":true,"buffer_inst":false,"tpb":8,"wgs":144,"tpt":[ 18,0 ],"factors":[ 2,6,9,2 ],"ebtype":"NONE","direction":1,"static_dim":3,"placement":"IP","iAryType":"CI","oAryType":"CI"}}}
              ,{"sol_node_type":"SOL_KERNEL_ONLY","kernel_key":{"lengths":[ 216,0 ],"precision":"single","scheme":"CS_KERNEL_STOCKHAM_BLOCK_CC","sbrc_trans":"NONE","kernelConfig":{"use_3steps":false,"half_lds":false,"dir_reg":true,"buffer_inst":true,"tpb":14,"wgs":252,"tpt":[ 18,0 ],"factors":[ 9,6,2,2 ],"ebtype":"NONE","direction":-1,"static_dim":3,"placement":"IP","iAryType":"CI","oAryType":"CI"}}}
              ,{"sol_node_type":"SOL_KERNEL_ONLY","kernel_key":{"lengths":[ 216,0 ],"precision":"single","scheme":"CS_KERNEL_STOCKHAM_BLOCK_CC","sbrc_trans":"NONE","kernelConfig":{"use_3steps":false,"half_lds":false,"dir_reg":true,"buffer_inst":true,"tpb":14,"wgs":252,"tpt":[ 18,0 ],"factors":[ 3,2,6,6 ],"ebtype":"NONE","direction":-1,"static_dim":2,"placement":"IP","iAryType":"CI","oAryType":"HI"}}}
              ,{"sol_node_type":"SOL_KERNEL_ONLY","kernel_key":{"lengths":[ 216,0 ],"precision":"single","scheme":"CS_KERNEL_STOCKHAM_BLOCK_CC","sbrc_trans":"NONE","kernelConfig":{"use_3steps":false,"half_lds":false,"dir_reg":true,"buffer_inst":true,"tpb":14,"wgs":252,"tpt":[ 18,0 ],"factors":[ 9,4,3,2 ],"ebtype":"NONE","direction":1,"static_dim":3,"placement":"IP","iAryType":"CI","oAryType":"CI"}}}
              ,{"sol_node_type":"SOL_KERNEL_ONLY","kernel_key":{"lengths":[ 216,0 ],"precision":"single","scheme":"CS_KERNEL_STOCKHAM_BLOCK_CC","sbrc_trans":"NONE","kernelConfig":{"use_3steps":false,"half_lds":false,"dir_reg":true,"buffer_inst":false,"tpb":14,"wgs":252,"tpt":[ 18,0 ],"factors":[ 6,4,3,3 ],"ebtype":"NONE","direction":1,"static_dim":2,"placement":"IP","iAryType":"CI","oAryType":"CI"}}}
               ]},
{"Problem":{"arch":"gfx90a","token":"kernel_len224_double_sbcc"},
 "Solutions":[ {"sol_node_type":"SOL_KERNEL_ONLY","kernel_key":{"lengths":[ 224,0 ],"precision":"double","scheme":"CS_KERNEL_STOCKHAM_BLOCK_CC","sbrc_trans":"NONE","kernelConfig":{"use_3steps":false,"half_lds":false,"dir_reg":true,"buffer_inst":false,"tpb":9,"wgs":252,"tpt":[ 28,0 ],"factors":[ 7,2,4,4 ],"ebtype":"NONE","direction":-1,"static_dim":0,"placement":"NA","iAryType":"CI","oAryType":"CI"}}}
               ]},
{"Problem":{"arch":"gfx90a","token":"kernel_len224_single_sbcc"},
 "Solutions":[ {"sol_node_type":"SOL_KERNEL_ONLY","kernel_key":{"lengths":[ 224,0 ],"precision":"single","scheme":"CS_KERNEL_STOCKHAM_BLOCK_CC","sbrc_trans":"NONE","kernelConfig":{"use_3steps":false,"half_lds":false,"dir_reg":true,"buffer_inst":true,"tpb":18,"wgs":252,"tpt":[ 14,0 ],"factors":[ 2,4,4,7 ],"ebtype":"NONE","direction":-1,"static_dim":3,"placement":"IP","iAryType":"CI","oAryType":"CI"}}}
              ,{"sol_node_type":"SOL_KERNEL_ONLY","kernel_key":{"lengths":[ 224,0 ],"precision":"single","scheme":"CS_KERNEL_STOCKHAM_BLOCK_CC","sbrc_trans":"NONE","kernelConfig":{"use_3steps":false,"half_lds":false,"dir_reg":true,"buffer_inst":false,"tpb":14,"wgs":196,"tpt":[ 14,0 ],"factors":[ 4,7,2,2,2 ],"ebtype":"NONE","direction":-1,"static_dim":3,"placement":"IP","iAryType":"CI","oAryType":"CI"}}}
              ,{"sol_node_type":"SOL_KERNEL_ONLY","kernel_key":{"lengths":[ 224,0 ],"precision":"single","scheme":"CS_KERNEL_STOCKHAM_BLOCK_CC","sbrc_trans":"NONE","kernelConfig":{"use_3steps":false,"half_lds":false,"dir_reg":true,"buffer_inst":false,"tpb":14,"wgs":196,"tpt":[ 14,0 ],"factors":[ 2,2,2,4,7 ],"ebtype":"NONE","direction":1,"static_dim":3,"placement":"IP","iAryType":"CI","oAryType":"CI"}}}
              ,{"sol_node_type":"SOL_KERNEL_ONLY","kernel_key":{"lengths":[ 224,0 ],"precision":"single","scheme":"CS_KERNEL_STOCKHAM_BLOCK_CC","sbrc_trans":"NONE","kernelConfig":{"use_3steps":false,"half_lds":false,"dir_reg":true,"buffer_inst":false,"tpb":16,"wgs":256,"tpt":[ 16,0 ],"factors":[ 2,2,7,8 ],"ebtype":"NONE","direction":-1,"static_dim":2,"placement":"IP","iAryType":"CI","oAryType":"HI"}}}
              ,{"sol_node_type":"SOL_KERNEL_ONLY","kernel_key":{"lengths":[ 224,0 ],"precision":"single","scheme":"CS_KERNEL_STOCKHAM_BLOCK_CC","sbrc_trans":"NONE","kernelConfig":{"use_3steps":false,"half_lds":false,"dir_reg":true,"buffer_inst":false,"tpb":18,"wgs":252,"tpt":[ 14,0 ],"factors":[ 2,4,4,7 ],"ebtype":"NONE","direction":1,"static_dim":2,"placement":"IP","iAryType":"CI","oAryType":"CI"}}}
               ]},
{"Problem":{"arch":"gfx90a","token":"kernel_len240_single_sbcc"},
 "Solutions":[ {"sol_node_type":"SOL_KERNEL_ONLY","kernel_key":{"lengths":[ 240,0 ],"precision":"single","scheme":"CS_KERNEL_STOCKHAM_BLOCK_CC","sbrc_trans":"NONE","kernelConfig":{"use_3steps":false,"half_lds":false,"dir_reg":true,"buffer_inst":true,"tpb":12,"wgs":240,"tpt":[ 20,0 ],"factors":[ 4,5,3,4 ],"ebtype":"NONE","direction":-1,"static_dim":3,"placement":"IP","iAryType":"CI","oAryType":"CI"}}}
              ,{"sol_node_type":"SOL_KERNEL_ONLY","kernel_key":{"lengths":[ 240,0 ],"precision":"single","scheme":"CS_KERNEL_STOCKHAM_BLOCK_CC","sbrc_trans":"NONE","kernelConfig":{"use_3steps":false,"half_lds":false,"dir_reg":true,"buffer_inst":true,"tpb":12,"wgs":240,"tpt":[ 20,0 ],"factors":[ 4,4,3,5 ],"ebtype":"NONE","direction":1,"static_dim":3,"placement":"IP","iAryType":"CI","oAryType":"CI"}}}
              ,{"sol_node_type":"SOL_KERNEL_ONLY","kernel_key":{"lengths":[ 240,0 ],"precision":"single","scheme":"CS_KERNEL_STOCKHAM_BLOCK_CC","sbrc_trans":"NONE","kernelConfig":{"use_3steps":false,"half_lds":false,"dir_reg":true,"buffer_inst":false,"tpb":7,"wgs":140,"tpt":[ 20,0 ],"factors":[ 2,3,4,5,2 ],"ebtype":"NONE","direction":-1,"static_dim":3,"placement":"IP","iAryType":"CI","oAryType":"CI"}}}
              ,{"sol_node_type":"SOL_KERNEL_ONLY","kernel_key":{"lengths":[ 240,0 ],"precision":"single","scheme":"CS_KERNEL_STOCKHAM_BLOCK_CC","sbrc_trans":"NONE","kernelConfig":{"use_3steps":false,"half_lds":false,"dir_reg":true,"buffer_inst":true,"tpb":9,"wgs":180,"tpt":[ 20,0 ],"factors":[ 2,3,10,2,2 ],"ebtype":"NONE","direction":-1,"static_dim":3,"placement":"IP","iAryType":"CI","oAryType":"CI"}}}
              ,{"sol_node_type":"SOL_KERNEL_ONLY","kernel_key":{"lengths":[ 240,0 ],"precision":"single","scheme":"CS_KERNEL_STOCKHAM_BLOCK_CC","sbrc_trans":"NONE","kernelConfig":{"use_3steps":false,"half_lds":false,"dir_reg":true,"buffer_inst":true,"tpb":9,"wgs":180,"tpt":[ 20,0 ],"factors":[ 2,2,10,3,2 ],"ebtype":"NONE","direction":1,"static_dim":3,"placement":"IP","iAryType":"CI","oAryType":"CI"}}}
              ,{"sol_node_type":"SOL_KERNEL_ONLY","kernel_key":{"lengths":[ 240,0 ],"precision":"single","scheme":"CS_KERNEL_STOCKHAM_BLOCK_CC","sbrc_trans":"NONE","kernelConfig":{"use_3steps":false,"half_lds":false,"dir_reg":true,"buffer_inst":false,"tpb":12,"wgs":240,"tpt":[ 20,0 ],"factors":[ 5,3,4,4 ],"ebtype":"NONE","direction":-1,"static_dim":3,"placement":"IP","iAryType":"CI","oAryType":"CI"}}}
              ,{"sol_node_type":"SOL_KERNEL_ONLY","kernel_key":{"lengths":[ 240,0 ],"precision":"single","scheme":"CS_KERNEL_STOCKHAM_BLOCK_CC","sbrc_trans":"NONE","kernelConfig":{"use_3steps":false,"half_lds":false,"dir_reg":true,"buffer_inst":false,"tpb":12,"wgs":240,"tpt":[ 20,0 ],"factors":[ 4,5,3,4 ],"ebtype":"NONE","direction":1,"static_dim":3,"placement":"IP","iAryType":"CI","oAryType":"CI"}}}
               ]},
{"Problem":{"arch":"gfx90a","token":"kernel_len243_double_sbcc"},
 "Solutions":[ {"sol_node_type":"SOL_KERNEL_ONLY","kernel_key":{"lengths":[ 243,0 ],"precision":"double","scheme":"CS_KERNEL_STOCKHAM_BLOCK_CC","sbrc_trans":"NONE","kernelConfig":{"use_3steps":true,"half_lds":false,"dir_reg":true,"buffer_inst":false,"tpb":7,"wgs":189,"tpt":[ 27,0 ],"factors":[ 3,9,3,3 ],"ebtype":"NONE","direction":-1,"static_dim":0,"placement":"NA","iAryType":"CI","oAryType":"CI"}}}
              ,{"sol_node_type":"SOL_KERNEL_ONLY","kernel_key":{"lengths":[ 243,0 ],"precision":"double","scheme":"CS_KERNEL_STOCKHAM_BLOCK_CC","sbrc_trans":"NONE","kernelConfig":{"use_3steps":true,"half_lds":false,"dir_reg":true,"buffer_inst":false,"tpb":7,"wgs":189,"tpt":[ 27,0 ],"factors":[ 9,3,3,3 ],"ebtype":"NONE","direction":-1,"static_dim":0,"placement":"NA","iAryType":"CI","oAryType":"CI"}}}
              ,{"sol_node_type":"SOL_KERNEL_ONLY","kernel_key":{"lengths":[ 243,0 ],"precision":"double","scheme":"CS_KERNEL_STOCKHAM_BLOCK_CC","sbrc_trans":"NONE","kernelConfig":{"use_3steps":false,"half_lds":false,"dir_reg":true,"buffer_inst":false,"tpb":8,"wgs":216,"tpt":[ 27,0 ],"factors":[ 9,9,3 ],"ebtype":"NONE","direction":-1,"static_dim":0,"placement":"NA","iAryType":"CI","oAryType":"CI"}}}
               ]},
{"Problem":{"arch":"gfx90a","token":"kernel_len243_single_sbcc"},
 "Solutions":[ {"sol_node_type":"SOL_KERNEL_ONLY","kernel_key":{"lengths":[ 243,0 ],"precision":"single","scheme":"CS_KERNEL_STOCKHAM_BLOCK_CC","sbrc_trans":"NONE","kernelConfig":{"use_3steps":false,"half_lds":false,"dir_reg":true,"buffer_inst":false,"tpb":16,"wgs":432,"tpt":[ 27,0 ],"factors":[ 3,3,9,3 ],"ebtype":"NONE","direction":-1,"static_dim":0,"placement":"NA","iAryType":"CI","oAryType":"CI"}}}
               ]},
{"Problem":{"arch":"gfx90a","token":"kernel_len280_single_sbcc"},
 "Solutions":[ {"sol_node_type":"SOL_KERNEL_ONLY","kernel_key":{"lengths":[ 280,0 ],"precision":"single","scheme":"CS_KERNEL_STOCKHAM_BLOCK_CC","sbrc_trans":"NONE","kernelConfig":{"use_3steps":false,"half_lds":false,"dir_reg":true,"buffer_inst":true,"tpb":9,"wgs":252,"tpt":[ 28,0 ],"factors":[ 2,7,10,2 ],"ebtype":"NONE","direction":-1,"static_dim":3,"placement":"IP","iAryType":"CI","oAryType":"CI"}}}
              ,{"sol_node_type":"SOL_KERNEL_ONLY","kernel_key":{"lengths":[ 280,0 ],"precision":"single","scheme":"CS_KERNEL_STOCKHAM_BLOCK_CC","sbrc_trans":"NONE","kernelConfig":{"use_3steps":false,"half_lds":false,"dir_reg":true,"buffer_inst":true,"tpb":9,"wgs":252,"tpt":[ 28,0 ],"factors":[ 2,2,7,5,2 ],"ebtype":"NONE","direction":1,"static_dim":3,"placement":"IP","iAryType":"CI","oAryType":"CI"}}}
               ]},
{"Problem":{"arch":"gfx90a","token":"kernel_len336_double_sbcc"},
 "Solutions":[ {"sol_node_type":"SOL_KERNEL_ONLY","kernel_key":{"lengths":[ 336,0 ],"precision":"double","scheme":"CS_KERNEL_STOCKHAM_BLOCK_CC","sbrc_trans":"NONE","kernelConfig":{"use_3steps":false,"half_lds":false,"dir_reg":true,"buffer_inst":false,"tpb":6,"wgs":168,"tpt":[ 28,0 ],"factors":[ 4,7,3,4 ],"ebtype":"NONE","direction":-1,"static_dim":0,"placement":"NA","iAryType":"CI","oAryType":"CI"}}}
              ,{"sol_node_type":"SOL_KERNEL_ONLY","kernel_key":{"lengths":[ 336,0 ],"precision":"double","scheme":"CS_KERNEL_STOCKHAM_BLOCK_CC","sbrc_trans":"NONE","kernelConfig":{"use_3steps":false,"half_lds":true,"dir_reg":true,"buffer_inst":false,"tpb":6,"wgs":126,"tpt":[ 21,0 ],"factors":[ 7,8,2,3 ],"ebtype":"NONE","direction":-1,"static_dim":0,"placement":"NA","iAryType":"CI","oAryType":"CI"}}}
              ,{"sol_node_type":"SOL_KERNEL_ONLY","kernel_key":{"lengths":[ 336,0 ],"precision":"double","scheme":"CS_KERNEL_STOCKHAM_BLOCK_CC","sbrc_trans":"NONE","kernelConfig":{"use_3steps":false,"half_lds":false,"dir_reg":true,"buffer_inst":true,"tpb":4,"wgs":112,"tpt":[ 28,0 ],"factors":[ 2,7,6,4 ],"ebtype":"NONE","direction":-1,"static_dim":0,"placement":"NA","iAryType":"CI","oAryType":"CI"}}}
              ,{"sol_node_type":"SOL_KERNEL_ONLY","kernel_key":{"lengths":[ 336,0 ],"precision":"double","scheme":"CS_KERNEL_STOCKHAM_BLOCK_CC","sbrc_trans":"NONE","kernelConfig":{"use_3steps":false,"half_lds":true,"dir_reg":true,"buffer_inst":false,"tpb":6,"wgs":252,"tpt":[ 42,0 ],"factors":[ 3,7,8,2 ],"ebtype":"NONE","direction":-1,"static_dim":0,"placement":"NA","iAryType":"CI","oAryType":"CI"}}}
              ,{"sol_node_type":"SOL_KERNEL_ONLY","kernel_key":{"lengths":[ 336,0 ],"precision":"double","scheme":"CS_KERNEL_STOCKHAM_BLOCK_CC","sbrc_trans":"NONE","kernelConfig":{"use_3steps":false,"half_lds":false,"dir_reg":true,"buffer_inst":false,"tpb":6,"wgs":168,"tpt":[ 28,0 ],"factors":[ 7,3,4,4 ],"ebtype":"NONE","direction":-1,"static_dim":0,"placement":"NA","iAryType":"CI","oAryType":"CI"}}}
              ,{"sol_node_type":"SOL_KERNEL_ONLY","kernel_key":{"lengths":[ 336,0 ],"precision":"double","scheme":"CS_KERNEL_STOCKHAM_BLOCK_CC","sbrc_trans":"NONE","kernelConfig":{"use_3steps":false,"half_lds":false,"dir_reg":true,"buffer_inst":false,"tpb":4,"wgs":168,"tpt":[ 42,0 ],"factors":[ 3,7,8,2 ],"ebtype":"NONE","direction":-1,"static_dim":0,"placement":"NA","iAryType":"CI","oAryType":"CI"}}}
              ,{"sol_node_type":"SOL_KERNEL_ONLY","kernel_key":{"lengths":[ 336,0 ],"precision":"double","scheme":"CS_KERNEL_STOCKHAM_BLOCK_CC","sbrc_trans":"NONE","kernelConfig":{"use_3steps":false,"half_lds":true,"dir_reg":true,"buffer_inst":true,"tpb":6,"wgs":252,"tpt":[ 42,0 ],"factors":[ 7,8,2,3 ],"ebtype":"NONE","direction":-1,"static_dim":0,"placement":"NA","iAryType":"CI","oAryType":"CI"}}}
              ,{"sol_node_type":"SOL_KERNEL_ONLY","kernel_key":{"lengths":[ 336,0 ],"precision":"double","scheme":"CS_KERNEL_STOCKHAM_BLOCK_CC","sbrc_trans":"NONE","kernelConfig":{"use_3steps":false,"half_lds":false,"dir_reg":true,"buffer_inst":true,"tpb":6,"wgs":126,"tpt":[ 21,0 ],"factors":[ 7,16,3 ],"ebtype":"NONE","direction":-1,"static_dim":0,"placement":"NA","iAryType":"CI","oAryType":"CI"}}}
               ]},
{"Problem":{"arch":"gfx90a","token":"kernel_len343_double_sbcc"},
 "Solutions":[ {"sol_node_type":"SOL_KERNEL_ONLY","kernel_key":{"lengths":[ 343,0 ],"precision":"double","scheme":"CS_KERNEL_STOCKHAM_BLOCK_CC","sbrc_trans":"NONE","kernelConfig":{"use_3steps":true,"half_lds":false,"dir_reg":true,"buffer_inst":true,"tpb":4,"wgs":196,"tpt":[ 49,0 ],"factors":[ 7,7,7 ],"ebtype":"NONE","direction":-1,"static_dim":0,"placement":"NA","iAryType":"CI","oAryType":"CI"}}}
              ,{"sol_node_type":"SOL_KERNEL_ONLY","kernel_key":{"lengths":[ 343,0 ],"precision":"double","scheme":"CS_KERNEL_STOCKHAM_BLOCK_CC","sbrc_trans":"NONE","kernelConfig":{"use_3steps":true,"half_lds":false,"dir_reg":true,"buffer_inst":false,"tpb":4,"wgs":196,"tpt":[ 49,0 ],"factors":[ 7,7,7 ],"ebtype":"NONE","direction":1,"static_dim":2,"placement":"IP","iAryType":"CI","oAryType":"CI"}}}
               ]},
{"Problem":{"arch":"gfx90a","token":"kernel_len60_single_sbcc"},
 "Solutions":[ {"sol_node_type":"SOL_KERNEL_ONLY","kernel_key":{"lengths":[ 60,0 ],"precision":"single","scheme":"CS_KERNEL_STOCKHAM_BLOCK_CC","sbrc_trans":"NONE","kernelConfig":{"use_3steps":false,"half_lds":true,"dir_reg":true,"buffer_inst":true,"tpb":11,"wgs":132,"tpt":[ 12,0 ],"factors":[ 5,2,6 ],"ebtype":"NONE","direction":-1,"static_dim":3,"placement":"IP","iAryType":"CI","oAryType":"HI"}}}
              ,{"sol_node_type":"SOL_KERNEL_ONLY","kernel_key":{"lengths":[ 60,0 ],"precision":"single","scheme":"CS_KERNEL_STOCKHAM_BLOCK_CC","sbrc_trans":"NONE","kernelConfig":{"use_3steps":false,"half_lds":true,"dir_reg":true,"buffer_inst":true,"tpb":38,"wgs":190,"tpt":[ 5,0 ],"factors":[ 3,4,5 ],"ebtype":"NONE","direction":1,"static_dim":2,"placement":"IP","iAryType":"CI","oAryType":"CI"}}}
               ]},
{"Problem":{"arch":"gfx90a","token":"kernel_len64_double_sbcc"},
 "Solutions":[ {"sol_node_type":"SOL_KERNEL_ONLY","kernel_key":{"lengths":[ 64,0 ],"precision":"double","scheme":"CS_KERNEL_STOCKHAM_BLOCK_CC","sbrc_trans":"NONE","kernelConfig":{"use_3steps":true,"half_lds":true,"dir_reg":true,"buffer_inst":false,"tpb":16,"wgs":64,"tpt":[ 4,0 ],"factors":[ 8,2,4 ],"ebtype":"NONE","direction":-1,"static_dim":0,"placement":"NA","iAryType":"CI","oAryType":"CI"}}}
              ,{"sol_node_type":"SOL_KERNEL_ONLY","kernel_key":{"lengths":[ 64,0 ],"precision":"double","scheme":"CS_KERNEL_STOCKHAM_BLOCK_CC","sbrc_trans":"NONE","kernelConfig":{"use_3steps":true,"half_lds":true,"dir_reg":true,"buffer_inst":true,"tpb":16,"wgs":64,"tpt":[ 4,0 ],"factors":[ 4,4,2,2 ],"ebtype":"NONE","direction":-1,"static_dim":0,"placement":"NA","iAryType":"CI","oAryType":"CI"}}}
              ,{"sol_node_type":"SOL_KERNEL_ONLY","kernel_key":{"lengths":[ 64,0 ],"precision":"double","scheme":"CS_KERNEL_STOCKHAM_BLOCK_CC","sbrc_trans":"NONE","kernelConfig":{"use_3steps":false,"half_lds":false,"dir_reg":true,"buffer_inst":false,"tpb":16,"wgs":64,"tpt":[ 4,0 ],"factors":[ 8,2,2,2 ],"ebtype":"NONE","direction":-1,"static_dim":2,"placement":"OP","iAryType":"CI","oAryType":"CI"}}}
              ,{"sol_node_type":"SOL_KERNEL_ONLY","kernel_key":{"lengths":[ 64,0 ],"precision":"double","scheme":"CS_KERNEL_STOCKHAM_BLOCK_CC","sbrc_trans":"NONE","kernelConfig":{"use_3steps":false,"half_lds":false,"dir_reg":true,"buffer_inst":false,"tpb":16,"wgs":64,"tpt":[ 4,0 ],"factors":[ 2,2,8,2 ],"ebtype":"NONE","direction":-1,"static_dim":2,"placement":"OP","iAryType":"CI","oAryType":"CI"}}}
              ,{"sol_node_type":"SOL_KERNEL_ONLY","kernel_key":{"lengths":[ 64,0 ],"precision":"double","scheme":"CS_KERNEL_STOCKHAM_BLOCK_CC","sbrc_trans":"NONE","kernelConfig":{"use_3steps":false,"half_lds":false,"dir_reg":true,"buffer_inst":true,"tpb":16,"wgs":64,"tpt":[ 4,0 ],"factors":[ 4,4,2,2 ],"ebtype":"NONE","direction":1,"static_dim":2,"placement":"OP","iAryType":"CI","oAryType":"CI"}}}
               ]},
{"Problem":{"arch":"gfx90a","token":"kernel_len64_single_sbcc"},
 "Solutions":[ {"sol_node_type":"SOL_KERNEL_ONLY","kernel_key":{"lengths":[ 64,0 ],"precision":"single","scheme":"CS_KERNEL_STOCKHAM_BLOCK_CC","sbrc_trans":"NONE","kernelConfig":{"use_3steps":false,"half_lds":true,"dir_reg":true,"buffer_inst":false,"tpb":16,"wgs":64,"tpt":[ 4,0 ],"factors":[ 2,2,4,4 ],"ebtype":"NONE","direction":-1,"static_dim":3,"placement":"IP","iAryType":"CI","oAryType":"HI"}}}
              ,{"sol_node_type":"SOL_KERNEL_ONLY","kernel_key":{"lengths":[ 64,0 ],"precision":"single","scheme":"CS_KERNEL_STOCKHAM_BLOCK_CC","sbrc_trans":"NONE","kernelConfig":{"use_3steps":false,"half_lds":true,"dir_reg":true,"buffer_inst":true,"tpb":16,"wgs":64,"tpt":[ 4,0 ],"factors":[ 4,4,4 ],"ebtype":"NONE","direction":1,"static_dim":2,"placement":"IP","iAryType":"CI","oAryType":"CI"}}}
              ,{"sol_node_type":"SOL_KERNEL_ONLY","kernel_key":{"lengths":[ 64,0 ],"precision":"single","scheme":"CS_KERNEL_STOCKHAM_BLOCK_CC","sbrc_trans":"NONE","kernelConfig":{"use_3steps":false,"half_lds":true,"dir_reg":true,"buffer_inst":true,"tpb":16,"wgs":64,"tpt":[ 4,0 ],"factors":[ 2,2,4,4 ],"ebtype":"NONE","direction":-1,"static_dim":3,"placement":"IP","iAryType":"CI","oAryType":"HI"}}}
               ]},
{"Problem":{"arch":"gfx90a","token":"kernel_len72_single_sbcc"},
 "Solutions":[ {"sol_node_type":"SOL_KERNEL_ONLY","kernel_key":{"lengths":[ 72,0 ],"precision":"single","scheme":"CS_KERNEL_STOCKHAM_BLOCK_CC","sbrc_trans":"NONE","kernelConfig":{"use_3steps":false,"half_lds":true,"dir_reg":true,"buffer_inst":true,"tpb":32,"wgs":192,"tpt":[ 6,0 ],"factors":[ 2,6,3,2 ],"ebtype":"NONE","direction":-1,"static_dim":3,"placement":"IP","iAryType":"CI","oAryType":"HI"}}}
              ,{"sol_node_type":"SOL_KERNEL_ONLY","kernel_key":{"lengths":[ 72,0 ],"precision":"single","scheme":"CS_KERNEL_STOCKHAM_BLOCK_CC","sbrc_trans":"NONE","kernelConfig":{"use_3steps":false,"half_lds":true,"dir_reg":true,"buffer_inst":true,"tpb":32,"wgs":192,"tpt":[ 6,0 ],"factors":[ 2,6,6 ],"ebtype":"NONE","direction":1,"static_dim":2,"placement":"IP","iAryType":"CI","oAryType":"CI"}}}
              ,{"sol_node_type":"SOL_KERNEL_ONLY","kernel_key":{"lengths":[ 72,0 ],"precision":"single","scheme":"CS_KERNEL_STOCKHAM_BLOCK_CC","sbrc_trans":"NONE","kernelConfig":{"use_3steps":false,"half_lds":true,"dir_reg":true,"buffer_inst":false,"tpb":42,"wgs":252,"tpt":[ 6,0 ],"factors":[ 3,4,6 ],"ebtype":"NONE","direction":-1,"static_dim":3,"placement":"IP","iAryType":"CI","oAryType":"HI"}}}
              ,{"sol_node_type":"SOL_KERNEL_ONLY","kernel_key":{"lengths":[ 72,0 ],"precision":"single","scheme":"CS_KERNEL_STOCKHAM_BLOCK_CC","sbrc_trans":"NONE","kernelConfig":{"use_3steps":false,"half_lds":true,"dir_reg":true,"buffer_inst":false,"tpb":32,"wgs":192,"tpt":[ 6,0 ],"factors":[ 2,6,6 ],"ebtype":"NONE","direction":1,"static_dim":2,"placement":"IP","iAryType":"CI","oAryType":"CI"}}}
               ]},
{"Problem":{"arch":"gfx90a","token":"kernel_len80_single_sbcc"},
 "Solutions":[ {"sol_node_type":"SOL_KERNEL_ONLY","kernel_key":{"lengths":[ 80,0 ],"precision":"single","scheme":"CS_KERNEL_STOCKHAM_BLOCK_CC","sbrc_trans":"NONE","kernelConfig":{"use_3steps":false,"half_lds":true,"dir_reg":true,"buffer_inst":false,"tpb":51,"wgs":255,"tpt":[ 5,0 ],"factors":[ 4,4,5 ],"ebtype":"NONE","direction":-1,"static_dim":3,"placement":"IP","iAryType":"CI","oAryType":"HI"}}}
              ,{"sol_node_type":"SOL_KERNEL_ONLY","kernel_key":{"lengths":[ 80,0 ],"precision":"single","scheme":"CS_KERNEL_STOCKHAM_BLOCK_CC","sbrc_trans":"NONE","kernelConfig":{"use_3steps":false,"half_lds":true,"dir_reg":true,"buffer_inst":false,"tpb":51,"wgs":255,"tpt":[ 5,0 ],"factors":[ 2,2,4,5 ],"ebtype":"NONE","direction":1,"static_dim":2,"placement":"IP","iAryType":"CI","oAryType":"CI"}}}
              ,{"sol_node_type":"SOL_KERNEL_ONLY","kernel_key":{"lengths":[ 80,0 ],"precision":"single","scheme":"CS_KERNEL_STOCKHAM_BLOCK_CC","sbrc_trans":"NONE","kernelConfig":{"use_3steps":false,"half_lds":true,"dir_reg":true,"buffer_inst":true,"tpb":38,"wgs":190,"tpt":[ 5,0 ],"factors":[ 4,4,5 ],"ebtype":"NONE","direction":1,"static_dim":2,"placement":"IP","iAryType":"CI","oAryType":"CI"}}}
              ,{"sol_node_type":"SOL_KERNEL_ONLY","kernel_key":{"lengths":[ 80,0 ],"precision":"single","scheme":"CS_KERNEL_STOCKHAM_BLOCK_CC","sbrc_trans":"NONE","kernelConfig":{"use_3steps":false,"half_lds":false,"dir_reg":true,"buffer_inst":false,"tpb":38,"wgs":190,"tpt":[ 5,0 ],"factors":[ 2,2,4,5 ],"ebtype":"NONE","direction":-1,"static_dim":3,"placement":"IP","iAryType":"CI","oAryType":"CI"}}}
              ,{"sol_node_type":"SOL_KERNEL_ONLY","kernel_key":{"lengths":[ 80,0 ],"precision":"single","scheme":"CS_KERNEL_STOCKHAM_BLOCK_CC","sbrc_trans":"NONE","kernelConfig":{"use_3steps":false,"half_lds":false,"dir_reg":true,"buffer_inst":false,"tpb":25,"wgs":125,"tpt":[ 5,0 ],"factors":[ 2,2,4,5 ],"ebtype":"NONE","direction":1,"static_dim":3,"placement":"IP","iAryType":"CI","oAryType":"CI"}}}
               ]},
{"Problem":{"arch":"gfx90a","token":"kernel_len81_double_sbcc"},
 "Solutions":[ {"sol_node_type":"SOL_KERNEL_ONLY","kernel_key":{"lengths":[ 81,0 ],"precision":"double","scheme":"CS_KERNEL_STOCKHAM_BLOCK_CC","sbrc_trans":"NONE","kernelConfig":{"use_3steps":false,"half_lds":false,"dir_reg":false,"buffer_inst":false,"tpb":21,"wgs":189,"tpt":[ 9,0 ],"factors":[ 3,9,3 ],"ebtype":"NONE","direction":-1,"static_dim":0,"placement":"NA","iAryType":"CI","oAryType":"CI"}}}
               ]},
{"Problem":{"arch":"gfx90a","token":"kernel_len81_single_sbcc"},
 "Solutions":[ {"sol_node_type":"SOL_KERNEL_ONLY","kernel_key":{"lengths":[ 81,0 ],"precision":"single","scheme":"CS_KERNEL_STOCKHAM_BLOCK_CC","sbrc_trans":"NONE","kernelConfig":{"use_3steps":true,"half_lds":false,"dir_reg":true,"buffer_inst":true,"tpb":21,"wgs":189,"tpt":[ 9,0 ],"factors":[ 9,3,3 ],"ebtype":"NONE","direction":-1,"static_dim":0,"placement":"NA","iAryType":"CI","oAryType":"CI"}}}
              ,{"sol_node_type":"SOL_KERNEL_ONLY","kernel_key":{"lengths":[ 81,0 ],"precision":"single","scheme":"CS_KERNEL_STOCKHAM_BLOCK_CC","sbrc_trans":"NONE","kernelConfig":{"use_3steps":true,"half_lds":false,"dir_reg":true,"buffer_inst":false,"tpb":21,"wgs":189,"tpt":[ 9,0 ],"factors":[ 3,9,3 ],"ebtype":"NONE","direction":-1,"static_dim":0,"placement":"NA","iAryType":"CI","oAryType":"CI"}}}
               ]},
{"Problem":{"arch":"gfx90a","token":"kernel_len84_single_sbcc"},
 "Solutions":[ {"sol_node_type":"SOL_KERNEL_ONLY","kernel_key":{"lengths":[ 84,0 ],"precision":"single","scheme":"CS_KERNEL_STOCKHAM_BLOCK_CC","sbrc_trans":"NONE","kernelConfig":{"use_3steps":false,"half_lds":false,"dir_reg":true,"buffer_inst":false,"tpb":14,"wgs":196,"tpt":[ 14,0 ],"factors":[ 2,6,7 ],"ebtype":"NONE","direction":-1,"static_dim":3,"placement":"IP","iAryType":"CI","oAryType":"HI"}}}
              ,{"sol_node_type":"SOL_KERNEL_ONLY","kernel_key":{"lengths":[ 84,0 ],"precision":"single","scheme":"CS_KERNEL_STOCKHAM_BLOCK_CC","sbrc_trans":"NONE","kernelConfig":{"use_3steps":false,"half_lds":true,"dir_reg":true,"buffer_inst":false,"tpb":36,"wgs":252,"tpt":[ 7,0 ],"factors":[ 6,2,7 ],"ebtype":"NONE","direction":1,"static_dim":2,"placement":"IP","iAryType":"CI","oAryType":"CI"}}}
              ,{"sol_node_type":"SOL_KERNEL_ONLY","kernel_key":{"lengths":[ 84,0 ],"precision":"single","scheme":"CS_KERNEL_STOCKHAM_BLOCK_CC","sbrc_trans":"NONE","kernelConfig":{"use_3steps":false,"half_lds":false,"dir_reg":true,"buffer_inst":false,"tpb":27,"wgs":189,"tpt":[ 7,0 ],"factors":[ 3,4,7 ],"ebtype":"NONE","direction":-1,"static_dim":2,"placement":"IP","iAryType":"CI","oAryType":"HI"}}}
              ,{"sol_node_type":"SOL_KERNEL_ONLY","kernel_key":{"lengths":[ 84,0 ],"precision":"single","scheme":"CS_KERNEL_STOCKHAM_BLOCK_CC","sbrc_trans":"NONE","kernelConfig":{"use_3steps":false,"half_lds":false,"dir_reg":true,"buffer_inst":false,"tpb":27,"wgs":189,"tpt":[ 7,0 ],"factors":[ 2,6,7 ],"ebtype":"NONE","direction":1,"static_dim":2,"placement":"IP","iAryType":"CI","oAryType":"CI"}}}
               ]},
{"Problem":{"arch":"gfx90a","token":"kernel_len96_double_sbcc"},
 "Solutions":[ {"sol_node_type":"SOL_KERNEL_ONLY","kernel_key":{"lengths":[ 96,0 ],"precision":"double","scheme":"CS_KERNEL_STOCKHAM_BLOCK_CC","sbrc_trans":"NONE","kernelConfig":{"use_3steps":false,"half_lds":false,"dir_reg":true,"buffer_inst":false,"tpb":16,"wgs":192,"tpt":[ 12,0 ],"factors":[ 8,3,4 ],"ebtype":"NONE","direction":-1,"static_dim":0,"placement":"NA","iAryType":"CI","oAryType":"CI"}}}
              ,{"sol_node_type":"SOL_KERNEL_ONLY","kernel_key":{"lengths":[ 96,0 ],"precision":"double","scheme":"CS_KERNEL_STOCKHAM_BLOCK_CC","sbrc_trans":"NONE","kernelConfig":{"use_3steps":false,"half_lds":true,"dir_reg":true,"buffer_inst":true,"tpb":16,"wgs":128,"tpt":[ 8,0 ],"factors":[ 4,2,3,4 ],"ebtype":"NONE","direction":-1,"static_dim":0,"placement":"NA","iAryType":"CI","oAryType":"CI"}}}
               ]},
{"Problem":{"arch":"gfx90a","token":"kernel_len96_single_sbcc"},
 "Solutions":[ {"sol_node_type":"SOL_KERNEL_ONLY","kernel_key":{"lengths":[ 96,0 ],"precision":"single","scheme":"CS_KERNEL_STOCKHAM_BLOCK_CC","sbrc_trans":"NONE","kernelConfig":{"use_3steps":false,"half_lds":false,"dir_reg":true,"buffer_inst":true,"tpb":21,"wgs":126,"tpt":[ 6,0 ],"factors":[ 2,2,4,6 ],"ebtype":"NONE","direction":-1,"static_dim":2,"placement":"IP","iAryType":"CI","oAryType":"HI"}}}
              ,{"sol_node_type":"SOL_KERNEL_ONLY","kernel_key":{"lengths":[ 96,0 ],"precision":"single","scheme":"CS_KERNEL_STOCKHAM_BLOCK_CC","sbrc_trans":"NONE","kernelConfig":{"use_3steps":false,"half_lds":false,"dir_reg":true,"buffer_inst":false,"tpb":24,"wgs":192,"tpt":[ 8,0 ],"factors":[ 3,4,8 ],"ebtype":"NONE","direction":1,"static_dim":2,"placement":"IP","iAryType":"CI","oAryType":"CI"}}}
              ,{"sol_node_type":"SOL_KERNEL_ONLY","kernel_key":{"lengths":[ 96,0 ],"precision":"single","scheme":"CS_KERNEL_STOCKHAM_BLOCK_CC","sbrc_trans":"NONE","kernelConfig":{"use_3steps":false,"half_lds":false,"dir_reg":true,"buffer_inst":true,"tpb":24,"wgs":192,"tpt":[ 8,0 ],"factors":[ 2,6,8 ],"ebtype":"NONE","direction":-1,"static_dim":2,"placement":"IP","iAryType":"CI","oAryType":"HI"}}}
              ,{"sol_node_type":"SOL_KERNEL_ONLY","kernel_key":{"lengths":[ 96,0 ],"precision":"single","scheme":"CS_KERNEL_STOCKHAM_BLOCK_CC","sbrc_trans":"NONE","kernelConfig":{"use_3steps":false,"half_lds":false,"dir_reg":true,"buffer_inst":false,"tpb":24,"wgs":192,"tpt":[ 8,0 ],"factors":[ 4,3,8 ],"ebtype":"NONE","direction":-1,"static_dim":3,"placement":"IP","iAryType":"CI","oAryType":"CI"}}}
              ,{"sol_node_type":"SOL_KERNEL_ONLY","kernel_key":{"lengths":[ 96,0 ],"precision":"single","scheme":"CS_KERNEL_STOCKHAM_BLOCK_CC","sbrc_trans":"NONE","kernelConfig":{"use_3steps":false,"half_lds":false,"dir_reg":true,"buffer_inst":true,"tpb":24,"wgs":192,"tpt":[ 8,0 ],"factors":[ 3,4,8 ],"ebtype":"NONE","direction":1,"static_dim":3,"placement":"IP","iAryType":"CI","oAryType":"CI"}}}
              ,{"sol_node_type":"SOL_KERNEL_ONLY","kernel_key":{"lengths":[ 96,0 ],"precision":"single","scheme":"CS_KERNEL_STOCKHAM_BLOCK_CC","sbrc_trans":"NONE","kernelConfig":{"use_3steps":false,"half_lds":false,"dir_reg":true,"buffer_inst":true,"tpb":24,"wgs":192,"tpt":[ 8,0 ],"factors":[ 4,2,3,4 ],"ebtype":"NONE","direction":1,"static_dim":2,"placement":"IP","iAryType":"CI","oAryType":"CI"}}}
               ]},
{"Problem":{"arch":"gfx90a","token":"kernel_len100_double_sbrc"},
 "Solutions":[ {"sol_node_type":"SOL_KERNEL_ONLY","kernel_key":{"lengths":[ 100,0 ],"precision":"double","scheme":"CS_KERNEL_STOCKHAM_BLOCK_RC","sbrc_trans":"TILE_ALIGNED","kernelConfig":{"use_3steps":false,"half_lds":false,"dir_reg":true,"buffer_inst":false,"tpb":20,"wgs":200,"tpt":[ 10,0 ],"factors":[ 10,5,2 ],"ebtype":"NONE","direction":-1,"static_dim":0,"placement":"NA","iAryType":"CI","oAryType":"CI"}}}
               ]},
{"Problem":{"arch":"gfx90a","token":"kernel_len112_double_sbrc"},
 "Solutions":[ {"sol_node_type":"SOL_KERNEL_ONLY","kernel_key":{"lengths":[ 112,0 ],"precision":"double","scheme":"CS_KERNEL_STOCKHAM_BLOCK_RC","sbrc_trans":"TILE_ALIGNED","kernelConfig":{"use_3steps":false,"half_lds":false,"dir_reg":true,"buffer_inst":false,"tpb":16,"wgs":128,"tpt":[ 8,0 ],"factors":[ 7,2,8 ],"ebtype":"NONE","direction":-1,"static_dim":0,"placement":"NA","iAryType":"CI","oAryType":"CI"}}}
              ,{"sol_node_type":"SOL_KERNEL_ONLY","kernel_key":{"lengths":[ 112,0 ],"precision":"double","scheme":"CS_KERNEL_STOCKHAM_BLOCK_RC","sbrc_trans":"TILE_ALIGNED","kernelConfig":{"use_3steps":false,"half_lds":false,"dir_reg":true,"buffer_inst":false,"tpb":16,"wgs":128,"tpt":[ 8,0 ],"factors":[ 2,4,7,2 ],"ebtype":"NONE","direction":-1,"static_dim":0,"placement":"NA","iAryType":"CI","oAryType":"CI"}}}
              ,{"sol_node_type":"SOL_KERNEL_ONLY","kernel_key":{"lengths":[ 112,0 ],"precision":"double","scheme":"CS_KERNEL_STOCKHAM_BLOCK_RC","sbrc_trans":"TILE_ALIGNED","kernelConfig":{"use_3steps":false,"half_lds":false,"dir_reg":true,"buffer_inst":false,"tpb":8,"wgs":64,"tpt":[ 8,0 ],"factors":[ 7,2,8 ],"ebtype":"NONE","direction":-1,"static_dim":0,"placement":"NA","iAryType":"CI","oAryType":"CI"}}}
               ]},
{"Problem":{"arch":"gfx90a","token":"kernel_len125_double_sbrc"},
 "Solutions":[ {"sol_node_type":"SOL_KERNEL_ONLY","kernel_key":{"lengths":[ 125,0 ],"precision":"double","scheme":"CS_KERNEL_STOCKHAM_BLOCK_RC","sbrc_trans":"TILE_UNALIGNED","kernelConfig":{"use_3steps":false,"half_lds":false,"dir_reg":true,"buffer_inst":false,"tpb":10,"wgs":250,"tpt":[ 25,0 ],"factors":[ 5,5,5 ],"ebtype":"NONE","direction":-1,"static_dim":0,"placement":"NA","iAryType":"CI","oAryType":"CI"}}}
               ]},
{"Problem":{"arch":"gfx90a","token":"kernel_len128_double_sbrc"},
 "Solutions":[ {"sol_node_type":"SOL_KERNEL_ONLY","kernel_key":{"lengths":[ 128,0 ],"precision":"double","scheme":"CS_KERNEL_STOCKHAM_BLOCK_RC","sbrc_trans":"TILE_ALIGNED","kernelConfig":{"use_3steps":false,"half_lds":false,"dir_reg":true,"buffer_inst":false,"tpb":8,"wgs":128,"tpt":[ 16,0 ],"factors":[ 8,8,2 ],"ebtype":"NONE","direction":-1,"static_dim":0,"placement":"NA","iAryType":"CI","oAryType":"CI"}}}
              ,{"sol_node_type":"SOL_KERNEL_ONLY","kernel_key":{"lengths":[ 128,0 ],"precision":"double","scheme":"CS_KERNEL_STOCKHAM_BLOCK_RC","sbrc_trans":"TILE_ALIGNED","kernelConfig":{"use_3steps":false,"half_lds":false,"dir_reg":true,"buffer_inst":false,"tpb":16,"wgs":128,"tpt":[ 8,0 ],"factors":[ 8,2,8 ],"ebtype":"NONE","direction":-1,"static_dim":0,"placement":"NA","iAryType":"CI","oAryType":"CI"}}}
              ,{"sol_node_type":"SOL_KERNEL_ONLY","kernel_key":{"lengths":[ 128,0 ],"precision":"double","scheme":"CS_KERNEL_STOCKHAM_BLOCK_RC","sbrc_trans":"TILE_ALIGNED","kernelConfig":{"use_3steps":false,"half_lds":false,"dir_reg":true,"buffer_inst":false,"tpb":16,"wgs":128,"tpt":[ 8,0 ],"factors":[ 4,2,2,8 ],"ebtype":"NONE","direction":-1,"static_dim":2,"placement":"OP","iAryType":"CI","oAryType":"CI"}}}
              ,{"sol_node_type":"SOL_KERNEL_ONLY","kernel_key":{"lengths":[ 128,0 ],"precision":"double","scheme":"CS_KERNEL_STOCKHAM_BLOCK_RC","sbrc_trans":"TILE_ALIGNED","kernelConfig":{"use_3steps":false,"half_lds":false,"dir_reg":true,"buffer_inst":false,"tpb":16,"wgs":128,"tpt":[ 8,0 ],"factors":[ 4,16,2 ],"ebtype":"NONE","direction":-1,"static_dim":2,"placement":"OP","iAryType":"CI","oAryType":"CI"}}}
              ,{"sol_node_type":"SOL_KERNEL_ONLY","kernel_key":{"lengths":[ 128,0 ],"precision":"double","scheme":"CS_KERNEL_STOCKHAM_BLOCK_RC","sbrc_trans":"TILE_ALIGNED","kernelConfig":{"use_3steps":false,"half_lds":false,"dir_reg":true,"buffer_inst":false,"tpb":16,"wgs":128,"tpt":[ 8,0 ],"factors":[ 2,4,4,4 ],"ebtype":"NONE","direction":1,"static_dim":2,"placement":"OP","iAryType":"CI","oAryType":"CI"}}}
               ]},
{"Problem":{"arch":"gfx90a","token":"kernel_len192_double_sbrc"},
 "Solutions":[ {"sol_node_type":"SOL_KERNEL_ONLY","kernel_key":{"lengths":[ 192,0 ],"precision":"double","scheme":"CS_KERNEL_STOCKHAM_BLOCK_RC","sbrc_trans":"TILE_ALIGNED","kernelConfig":{"use_3steps":false,"half_lds":false,"dir_reg":true,"buffer_inst":false,"tpb":4,"wgs":64,"tpt":[ 16,0 ],"factors":[ 2,8,6,2 ],"ebtype":"NONE","direction":-1,"static_dim":0,"placement":"NA","iAryType":"CI","oAryType":"CI"}}}
              ,{"sol_node_type":"SOL_KERNEL_ONLY","kernel_key":{"lengths":[ 192,0 ],"precision":"double","scheme":"CS_KERNEL_STOCKHAM_BLOCK_RC","sbrc_trans":"TILE_ALIGNED","kernelConfig":{"use_3steps":false,"half_lds":false,"dir_reg":true,"buffer_inst":false,"tpb":8,"wgs":128,"tpt":[ 16,0 ],"factors":[ 8,4,3,2 ],"ebtype":"NONE","direction":-1,"static_dim":0,"placement":"NA","iAryType":"CI","oAryType":"CI"}}}
              ,{"sol_node_type":"SOL_KERNEL_ONLY","kernel_key":{"lengths":[ 192,0 ],"precision":"double","scheme":"CS_KERNEL_STOCKHAM_BLOCK_RC","sbrc_trans":"TILE_ALIGNED","kernelConfig":{"use_3steps":false,"half_lds":false,"dir_reg":true,"buffer_inst":false,"tpb":8,"wgs":192,"tpt":[ 24,0 ],"factors":[ 8,3,8 ],"ebtype":"NONE","direction":-1,"static_dim":0,"placement":"NA","iAryType":"CI","oAryType":"CI"}}}
               ]},
{"Problem":{"arch":"gfx90a","token":"kernel_len256_double_sbrc"},
 "Solutions":[ {"sol_node_type":"SOL_KERNEL_ONLY","kernel_key":{"lengths":[ 256,0 ],"precision":"double","scheme":"CS_KERNEL_STOCKHAM_BLOCK_RC","sbrc_trans":"TILE_ALIGNED","kernelConfig":{"use_3steps":false,"half_lds":false,"dir_reg":true,"buffer_inst":false,"tpb":8,"wgs":256,"tpt":[ 32,0 ],"factors":[ 8,4,4,2 ],"ebtype":"NONE","direction":-1,"static_dim":0,"placement":"NA","iAryType":"CI","oAryType":"CI"}}}
               ]},
{"Problem":{"arch":"gfx90a","token":"kernel_len49_double_sbrc"},
 "Solutions":[ {"sol_node_type":"SOL_KERNEL_ONLY","kernel_key":{"lengths":[ 49,0 ],"precision":"double","scheme":"CS_KERNEL_STOCKHAM_BLOCK_RC","sbrc_trans":"TILE_UNALIGNED","kernelConfig":{"use_3steps":false,"half_lds":false,"dir_reg":false,"buffer_inst":false,"tpb":28,"wgs":196,"tpt":[ 7,0 ],"factors":[ 7,7 ],"ebtype":"NONE","direction":-1,"static_dim":0,"placement":"NA","iAryType":"CI","oAryType":"CI"}}}
              ,{"sol_node_type":"SOL_KERNEL_ONLY","kernel_key":{"lengths":[ 49,0 ],"precision":"double","scheme":"CS_KERNEL_STOCKHAM_BLOCK_RC","sbrc_trans":"TILE_UNALIGNED","kernelConfig":{"use_3steps":false,"half_lds":false,"dir_reg":true,"buffer_inst":false,"tpb":28,"wgs":196,"tpt":[ 7,0 ],"factors":[ 7,7 ],"ebtype":"NONE","direction":1,"static_dim":2,"placement":"OP","iAryType":"CI","oAryType":"CI"}}}
               ]},
{"Problem":{"arch":"gfx90a","token":"kernel_len81_double_sbrc"},
 "Solutions":[ {"sol_node_type":"SOL_KERNEL_ONLY","kernel_key":{"lengths":[ 81,0 ],"precision":"double","scheme":"CS_KERNEL_STOCKHAM_BLOCK_RC","sbrc_trans":"TILE_UNALIGNED","kernelConfig":{"use_3steps":false,"half_lds":false,"dir_reg":true,"buffer_inst":false,"tpb":22,"wgs":198,"tpt":[ 9,0 ],"factors":[ 9,3,3 ],"ebtype":"NONE","direction":-1,"static_dim":0,"placement":"NA","iAryType":"CI","oAryType":"CI"}}}
               ]},
{"Problem":{"arch":"gfx90a","token":"kernel_len81_single_sbrc"},
 "Solutions":[ {"sol_node_type":"SOL_KERNEL_ONLY","kernel_key":{"lengths":[ 81,0 ],"precision":"single","scheme":"CS_KERNEL_STOCKHAM_BLOCK_RC","sbrc_trans":"TILE_UNALIGNED","kernelConfig":{"use_3steps":false,"half_lds":false,"dir_reg":false,"buffer_inst":false,"tpb":36,"wgs":324,"tpt":[ 9,0 ],"factors":[ 9,3,3 ],"ebtype":"NONE","direction":-1,"static_dim":0,"placement":"NA","iAryType":"CI","oAryType":"CI"}}}
              ,{"sol_node_type":"SOL_KERNEL_ONLY","kernel_key":{"lengths":[ 81,0 ],"precision":"single","scheme":"CS_KERNEL_STOCKHAM_BLOCK_RC","sbrc_trans":"TILE_UNALIGNED","kernelConfig":{"use_3steps":false,"half_lds":false,"dir_reg":true,"buffer_inst":false,"tpb":36,"wgs":324,"tpt":[ 9,0 ],"factors":[ 9,3,3 ],"ebtype":"NONE","direction":-1,"static_dim":0,"placement":"NA","iAryType":"CI","oAryType":"CI"}}}
              ,{"sol_node_type":"SOL_KERNEL_ONLY","kernel_key":{"lengths":[ 81,0 ],"precision":"single","scheme":"CS_KERNEL_STOCKHAM_BLOCK_RC","sbrc_trans":"TILE_UNALIGNED","kernelConfig":{"use_3steps":false,"half_lds":false,"dir_reg":true,"buffer_inst":false,"tpb":36,"wgs":324,"tpt":[ 9,0 ],"factors":[ 3,9,3 ],"ebtype":"NONE","direction":-1,"static_dim":0,"placement":"NA","iAryType":"CI","oAryType":"CI"}}}
               ]},
{"Problem":{"arch":"gfx90a","token":"kernel_len336_double_sbcr"},
 "Solutions":[ {"sol_node_type":"SOL_KERNEL_ONLY","kernel_key":{"lengths":[ 336,0 ],"precision":"double","scheme":"CS_KERNEL_STOCKHAM_BLOCK_CR","sbrc_trans":"NONE","kernelConfig":{"use_3steps":false,"half_lds":false,"dir_reg":true,"buffer_inst":false,"tpb":6,"wgs":252,"tpt":[ 42,0 ],"factors":[ 8,2,3,7 ],"ebtype":"NONE","direction":-1,"static_dim":0,"placement":"NA","iAryType":"CI","oAryType":"CI"}}}
              ,{"sol_node_type":"SOL_KERNEL_ONLY","kernel_key":{"lengths":[ 336,0 ],"precision":"double","scheme":"CS_KERNEL_STOCKHAM_BLOCK_CR","sbrc_trans":"NONE","kernelConfig":{"use_3steps":false,"half_lds":false,"dir_reg":true,"buffer_inst":true,"tpb":6,"wgs":252,"tpt":[ 42,0 ],"factors":[ 7,8,2,3 ],"ebtype":"NONE","direction":-1,"static_dim":0,"placement":"NA","iAryType":"CI","oAryType":"CI"}}}
              ,{"sol_node_type":"SOL_KERNEL_ONLY","kernel_key":{"lengths":[ 336,0 ],"precision":"double","scheme":"CS_KERNEL_STOCKHAM_BLOCK_CR","sbrc_trans":"NONE","kernelConfig":{"use_3steps":false,"half_lds":false,"dir_reg":true,"buffer_inst":true,"tpb":6,"wgs":252,"tpt":[ 42,0 ],"factors":[ 7,2,4,6 ],"ebtype":"NONE","direction":-1,"static_dim":0,"placement":"NA","iAryType":"CI","oAryType":"CI"}}}
              ,{"sol_node_type":"SOL_KERNEL_ONLY","kernel_key":{"lengths":[ 336,0 ],"precision":"double","scheme":"CS_KERNEL_STOCKHAM_BLOCK_CR","sbrc_trans":"NONE","kernelConfig":{"use_3steps":false,"half_lds":false,"dir_reg":true,"buffer_inst":true,"tpb":6,"wgs":252,"tpt":[ 42,0 ],"factors":[ 8,2,3,7 ],"ebtype":"NONE","direction":-1,"static_dim":0,"placement":"NA","iAryType":"CI","oAryType":"CI"}}}
               ]},
{"Problem":{"arch":"gfx90a","token":"kernel_len56_double_sbcr"},
 "Solutions":[ {"sol_node_type":"SOL_KERNEL_ONLY","kernel_key":{"lengths":[ 56,0 ],"precision":"double","scheme":"CS_KERNEL_STOCKHAM_BLOCK_CR","sbrc_trans":"NONE","kernelConfig":{"use_3steps":false,"half_lds":false,"dir_reg":true,"buffer_inst":true,"tpb":16,"wgs":128,"tpt":[ 8,0 ],"factors":[ 2,7,4 ],"ebtype":"NONE","direction":-1,"static_dim":0,"placement":"NA","iAryType":"CI","oAryType":"CI"}}}
              ,{"sol_node_type":"SOL_KERNEL_ONLY","kernel_key":{"lengths":[ 56,0 ],"precision":"double","scheme":"CS_KERNEL_STOCKHAM_BLOCK_CR","sbrc_trans":"NONE","kernelConfig":{"use_3steps":false,"half_lds":false,"dir_reg":true,"buffer_inst":false,"tpb":16,"wgs":128,"tpt":[ 8,0 ],"factors":[ 2,7,4 ],"ebtype":"NONE","direction":-1,"static_dim":0,"placement":"NA","iAryType":"CI","oAryType":"CI"}}}
               ]},
{"Problem":{"arch":"gfx90a","token":"kernel_len256_single_sbrc_xy_z"},
 "Solutions":[ {"sol_node_type":"SOL_KERNEL_ONLY","kernel_key":{"lengths":[ 256,0 ],"precision":"single","scheme":"CS_KERNEL_STOCKHAM_TRANSPOSE_XY_Z","sbrc_trans":"TILE_ALIGNED","kernelConfig":{"use_3steps":false,"half_lds":false,"dir_reg":true,"buffer_inst":false,"tpb":16,"wgs":256,"tpt":[ 16,0 ],"factors":[ 4,2,2,16 ],"ebtype":"NONE","direction":-1,"static_dim":0,"placement":"NA","iAryType":"CI","oAryType":"CI"}}}
              ,{"sol_node_type":"SOL_KERNEL_ONLY","kernel_key":{"lengths":[ 256,0 ],"precision":"single","scheme":"CS_KERNEL_STOCKHAM_TRANSPOSE_XY_Z","sbrc_trans":"TILE_ALIGNED","kernelConfig":{"use_3steps":false,"half_lds":false,"dir_reg":true,"buffer_inst":false,"tpb":16,"wgs":256,"tpt":[ 16,0 ],"factors":[ 8,2,16 ],"ebtype":"NONE","direction":-1,"static_dim":0,"placement":"NA","iAryType":"CI","oAryType":"CI"}}}
               ]},
{"Problem":{"arch":"gfx90a","token":"kernel_len10x20_single_2d_single"},
 "Solutions":[ {"sol_node_type":"SOL_KERNEL_ONLY","kernel_key":{"lengths":[ 10,20 ],"precision":"single","scheme":"CS_KERNEL_2D_SINGLE","sbrc_trans":"NONE","kernelConfig":{"use_3steps":false,"half_lds":false,"dir_reg":false,"buffer_inst":false,"tpb":1,"wgs":100,"tpt":[ 1,10 ],"factors":[ 10,2,10 ],"ebtype":"R2C_POST","direction":-1,"static_dim":3,"placement":"OP","iAryType":"CI","oAryType":"CI"}}}
               ]},
{"Problem":{"arch":"gfx90a","token":"kernel_len20x10_single_2d_single"},
 "Solutions":[ {"sol_node_type":"SOL_KERNEL_ONLY","kernel_key":{"lengths":[ 20,10 ],"precision":"single","scheme":"CS_KERNEL_2D_SINGLE","sbrc_trans":"NONE","kernelConfig":{"use_3steps":false,"half_lds":false,"dir_reg":false,"buffer_inst":false,"tpb":1,"wgs":100,"tpt":[ 5,5 ],"factors":[ 5,4,5,2 ],"ebtype":"C2R_PRE","direction":1,"static_dim":3,"placement":"OP","iAryType":"CI","oAryType":"CI"}}}
               ]},
{"Problem":{"arch":"gfx90a","token":"kernel_len26x64_single_2d_single"},
 "Solutions":[ {"sol_node_type":"SOL_KERNEL_ONLY","kernel_key":{"lengths":[ 26,64 ],"precision":"single","scheme":"CS_KERNEL_2D_SINGLE","sbrc_trans":"NONE","kernelConfig":{"use_3steps":false,"half_lds":false,"dir_reg":false,"buffer_inst":false,"tpb":1,"wgs":208,"tpt":[ 2,8 ],"factors":[ 13,2,8,8 ],"ebtype":"R2C_POST","direction":-1,"static_dim":3,"placement":"OP","iAryType":"CI","oAryType":"CI"}}}
               ]},
{"Problem":{"arch":"gfx90a","token":"kernel_len26x72_single_2d_single"},
 "Solutions":[ {"sol_node_type":"SOL_KERNEL_ONLY","kernel_key":{"lengths":[ 26,72 ],"precision":"single","scheme":"CS_KERNEL_2D_SINGLE","sbrc_trans":"NONE","kernelConfig":{"use_3steps":false,"half_lds":false,"dir_reg":false,"buffer_inst":false,"tpb":1,"wgs":234,"tpt":[ 2,9 ],"factors":[ 13,2,9,8 ],"ebtype":"R2C_POST","direction":-1,"static_dim":3,"placement":"OP","iAryType":"CI","oAryType":"CI"}}}
               ]},
{"Problem":{"arch":"gfx90a","token":"kernel_len30x60_single_2d_single"},
 "Solutions":[ {"sol_node_type":"SOL_KERNEL_ONLY","kernel_key":{"lengths":[ 30,60 ],"precision":"single","scheme":"CS_KERNEL_2D_SINGLE","sbrc_trans":"NONE","kernelConfig":{"use_3steps":false,"half_lds":false,"dir_reg":false,"buffer_inst":false,"tpb":1,"wgs":180,"tpt":[ 3,6 ],"factors":[ 10,3,6,10 ],"ebtype":"R2C_POST","direction":-1,"static_dim":3,"placement":"OP","iAryType":"CI","oAryType":"CI"}}}
               ]},
{"Problem":{"arch":"gfx90a","token":"kernel_len32x16_single_2d_single"},
 "Solutions":[ {"sol_node_type":"SOL_KERNEL_ONLY","kernel_key":{"lengths":[ 32,16 ],"precision":"single","scheme":"CS_KERNEL_2D_SINGLE","sbrc_trans":"NONE","kernelConfig":{"use_3steps":false,"half_lds":false,"dir_reg":false,"buffer_inst":false,"tpb":1,"wgs":256,"tpt":[ 16,8 ],"factors":[ 2,2,2,4,2,2,4 ],"ebtype":"C2R_PRE","direction":1,"static_dim":3,"placement":"OP","iAryType":"CI","oAryType":"CI"}}}
               ]},
{"Problem":{"arch":"gfx90a","token":"kernel_len32x64_single_2d_single"},
 "Solutions":[ {"sol_node_type":"SOL_KERNEL_ONLY","kernel_key":{"lengths":[ 32,64 ],"precision":"single","scheme":"CS_KERNEL_2D_SINGLE","sbrc_trans":"NONE","kernelConfig":{"use_3steps":false,"half_lds":false,"dir_reg":false,"buffer_inst":false,"tpb":1,"wgs":256,"tpt":[ 2,8 ],"factors":[ 2,16,8,8 ],"ebtype":"R2C_POST","direction":-1,"static_dim":3,"placement":"OP","iAryType":"CI","oAryType":"CI"}}}
               ]},
{"Problem":{"arch":"gfx90a","token":"kernel_len36x72_single_2d_single"},
 "Solutions":[ {"sol_node_type":"SOL_KERNEL_ONLY","kernel_key":{"lengths":[ 36,72 ],"precision":"single","scheme":"CS_KERNEL_2D_SINGLE","sbrc_trans":"NONE","kernelConfig":{"use_3steps":false,"half_lds":false,"dir_reg":false,"buffer_inst":false,"tpb":1,"wgs":432,"tpt":[ 6,12 ],"factors":[ 6,6,2,6,6 ],"ebtype":"R2C_POST","direction":-1,"static_dim":3,"placement":"OP","iAryType":"CI","oAryType":"CI"}}}
               ]},
{"Problem":{"arch":"gfx90a","token":"kernel_len36x80_single_2d_single"},
 "Solutions":[ {"sol_node_type":"SOL_KERNEL_ONLY","kernel_key":{"lengths":[ 36,80 ],"precision":"single","scheme":"CS_KERNEL_2D_SINGLE","sbrc_trans":"NONE","kernelConfig":{"use_3steps":false,"half_lds":false,"dir_reg":false,"buffer_inst":false,"tpb":1,"wgs":480,"tpt":[ 6,10 ],"factors":[ 6,6,8,10 ],"ebtype":"R2C_POST","direction":-1,"static_dim":3,"placement":"OP","iAryType":"CI","oAryType":"CI"}}}
               ]},
{"Problem":{"arch":"gfx90a","token":"kernel_len36x84_single_2d_single"},
 "Solutions":[ {"sol_node_type":"SOL_KERNEL_ONLY","kernel_key":{"lengths":[ 36,84 ],"precision":"single","scheme":"CS_KERNEL_2D_SINGLE","sbrc_trans":"NONE","kernelConfig":{"use_3steps":false,"half_lds":false,"dir_reg":false,"buffer_inst":false,"tpb":1,"wgs":504,"tpt":[ 6,12 ],"factors":[ 6,6,3,4,7 ],"ebtype":"R2C_POST","direction":-1,"static_dim":3,"placement":"OP","iAryType":"CI","oAryType":"CI"}}}
               ]},
{"Problem":{"arch":"gfx90a","token":"kernel_len40x80_single_2d_single"},
 "Solutions":[ {"sol_node_type":"SOL_KERNEL_ONLY","kernel_key":{"lengths":[ 40,80 ],"precision":"single","scheme":"CS_KERNEL_2D_SINGLE","sbrc_trans":"NONE","kernelConfig":{"use_3steps":false,"half_lds":false,"dir_reg":false,"buffer_inst":false,"tpb":1,"wgs":400,"tpt":[ 5,10 ],"factors":[ 5,8,10,8 ],"ebtype":"R2C_POST","direction":-1,"static_dim":3,"placement":"OP","iAryType":"CI","oAryType":"CI"}}}
               ]},
{"Problem":{"arch":"gfx90a","token":"kernel_len42x84_single_2d_single"},
 "Solutions":[ {"sol_node_type":"SOL_KERNEL_ONLY","kernel_key":{"lengths":[ 42,84 ],"precision":"single","scheme":"CS_KERNEL_2D_SINGLE","sbrc_trans":"NONE","kernelConfig":{"use_3steps":false,"half_lds":false,"dir_reg":false,"buffer_inst":false,"tpb":1,"wgs":504,"tpt":[ 6,12 ],"factors":[ 6,7,3,4,7 ],"ebtype":"R2C_POST","direction":-1,"static_dim":3,"placement":"OP","iAryType":"CI","oAryType":"CI"}}}
               ]},
{"Problem":{"arch":"gfx90a","token":"kernel_len42x96_single_2d_single"},
 "Solutions":[ {"sol_node_type":"SOL_KERNEL_ONLY","kernel_key":{"lengths":[ 42,96 ],"precision":"single","scheme":"CS_KERNEL_2D_SINGLE","sbrc_trans":"NONE","kernelConfig":{"use_3steps":false,"half_lds":false,"dir_reg":false,"buffer_inst":false,"tpb":1,"wgs":672,"tpt":[ 7,16 ],"factors":[ 7,6,4,4,6 ],"ebtype":"R2C_POST","direction":-1,"static_dim":3,"placement":"OP","iAryType":"CI","oAryType":"CI"}}}
               ]},
{"Problem":{"arch":"gfx90a","token":"kernel_len60x30_single_2d_single"},
 "Solutions":[ {"sol_node_type":"SOL_KERNEL_ONLY","kernel_key":{"lengths":[ 60,30 ],"precision":"single","scheme":"CS_KERNEL_2D_SINGLE","sbrc_trans":"NONE","kernelConfig":{"use_3steps":false,"half_lds":false,"dir_reg":false,"buffer_inst":false,"tpb":1,"wgs":180,"tpt":[ 6,3 ],"factors":[ 10,6,10,3 ],"ebtype":"C2R_PRE","direction":1,"static_dim":3,"placement":"OP","iAryType":"CI","oAryType":"CI"}}}
               ]},
{"Problem":{"arch":"gfx90a","token":"kernel_len64x26_single_2d_single"},
 "Solutions":[ {"sol_node_type":"SOL_KERNEL_ONLY","kernel_key":{"lengths":[ 64,26 ],"precision":"single","scheme":"CS_KERNEL_2D_SINGLE","sbrc_trans":"NONE","kernelConfig":{"use_3steps":false,"half_lds":false,"dir_reg":false,"buffer_inst":false,"tpb":1,"wgs":128,"tpt":[ 4,2 ],"factors":[ 4,16,2,13 ],"ebtype":"C2R_PRE","direction":1,"static_dim":3,"placement":"OP","iAryType":"CI","oAryType":"CI"}}}
               ]},
{"Problem":{"arch":"gfx90a","token":"kernel_len64x32_single_2d_single"},
 "Solutions":[ {"sol_node_type":"SOL_KERNEL_ONLY","kernel_key":{"lengths":[ 64,32 ],"precision":"single","scheme":"CS_KERNEL_2D_SINGLE","sbrc_trans":"NONE","kernelConfig":{"use_3steps":false,"half_lds":false,"dir_reg":false,"buffer_inst":false,"tpb":1,"wgs":256,"tpt":[ 8,4 ],"factors":[ 8,8,2,2,8 ],"ebtype":"C2R_PRE","direction":1,"static_dim":3,"placement":"OP","iAryType":"CI","oAryType":"CI"}}}
               ]},
{"Problem":{"arch":"gfx90a","token":"kernel_len72x26_single_2d_single"},
 "Solutions":[ {"sol_node_type":"SOL_KERNEL_ONLY","kernel_key":{"lengths":[ 72,26 ],"precision":"single","scheme":"CS_KERNEL_2D_SINGLE","sbrc_trans":"NONE","kernelConfig":{"use_3steps":false,"half_lds":false,"dir_reg":false,"buffer_inst":false,"tpb":1,"wgs":234,"tpt":[ 9,2 ],"factors":[ 9,8,13,2 ],"ebtype":"C2R_PRE","direction":1,"static_dim":3,"placement":"OP","iAryType":"CI","oAryType":"CI"}}}
               ]},
{"Problem":{"arch":"gfx90a","token":"kernel_len72x36_single_2d_single"},
 "Solutions":[ {"sol_node_type":"SOL_KERNEL_ONLY","kernel_key":{"lengths":[ 72,36 ],"precision":"single","scheme":"CS_KERNEL_2D_SINGLE","sbrc_trans":"NONE","kernelConfig":{"use_3steps":false,"half_lds":false,"dir_reg":false,"buffer_inst":false,"tpb":1,"wgs":432,"tpt":[ 12,6 ],"factors":[ 2,6,6,6,6 ],"ebtype":"C2R_PRE","direction":1,"static_dim":3,"placement":"OP","iAryType":"CI","oAryType":"CI"}}}
               ]},
{"Problem":{"arch":"gfx90a","token":"kernel_len80x36_single_2d_single"},
 "Solutions":[ {"sol_node_type":"SOL_KERNEL_ONLY","kernel_key":{"lengths":[ 80,36 ],"precision":"single","scheme":"CS_KERNEL_2D_SINGLE","sbrc_trans":"NONE","kernelConfig":{"use_3steps":false,"half_lds":false,"dir_reg":false,"buffer_inst":false,"tpb":1,"wgs":480,"tpt":[ 10,6 ],"factors":[ 10,8,6,6 ],"ebtype":"C2R_PRE","direction":1,"static_dim":3,"placement":"OP","iAryType":"CI","oAryType":"CI"}}}
               ]},
{"Problem":{"arch":"gfx90a","token":"kernel_len80x40_single_2d_single"},
 "Solutions":[ {"sol_node_type":"SOL_KERNEL_ONLY","kernel_key":{"lengths":[ 80,40 ],"precision":"single","scheme":"CS_KERNEL_2D_SINGLE","sbrc_trans":"NONE","kernelConfig":{"use_3steps":false,"half_lds":false,"dir_reg":false,"buffer_inst":false,"tpb":1,"wgs":400,"tpt":[ 10,5 ],"factors":[ 8,10,5,8 ],"ebtype":"C2R_PRE","direction":1,"static_dim":3,"placement":"OP","iAryType":"CI","oAryType":"CI"}}}
               ]},
{"Problem":{"arch":"gfx90a","token":"kernel_len84x36_single_2d_single"},
 "Solutions":[ {"sol_node_type":"SOL_KERNEL_ONLY","kernel_key":{"lengths":[ 84,36 ],"precision":"single","scheme":"CS_KERNEL_2D_SINGLE","sbrc_trans":"NONE","kernelConfig":{"use_3steps":false,"half_lds":false,"dir_reg":false,"buffer_inst":false,"tpb":1,"wgs":504,"tpt":[ 12,6 ],"factors":[ 4,3,7,6,6 ],"ebtype":"C2R_PRE","direction":1,"static_dim":3,"placement":"OP","iAryType":"CI","oAryType":"CI"}}}
               ]},
{"Problem":{"arch":"gfx90a","token":"kernel_len84x42_single_2d_single"},
 "Solutions":[ {"sol_node_type":"SOL_KERNEL_ONLY","kernel_key":{"lengths":[ 84,42 ],"precision":"single","scheme":"CS_KERNEL_2D_SINGLE","sbrc_trans":"NONE","kernelConfig":{"use_3steps":false,"half_lds":false,"dir_reg":false,"buffer_inst":false,"tpb":1,"wgs":504,"tpt":[ 12,6 ],"factors":[ 4,3,7,6,7 ],"ebtype":"C2R_PRE","direction":1,"static_dim":3,"placement":"OP","iAryType":"CI","oAryType":"CI"}}}
               ]},
{"Problem":{"arch":"gfx90a","token":"kernel_len84x7_single_2d_single"},
 "Solutions":[ {"sol_node_type":"SOL_KERNEL_ONLY","kernel_key":{"lengths":[ 84,7 ],"precision":"single","scheme":"CS_KERNEL_2D_SINGLE","sbrc_trans":"NONE","kernelConfig":{"use_3steps":false,"half_lds":false,"dir_reg":false,"buffer_inst":false,"tpb":1,"wgs":84,"tpt":[ 12,1 ],"factors":[ 3,7,4,7 ],"ebtype":"C2R_PRE","direction":1,"static_dim":3,"placement":"OP","iAryType":"CI","oAryType":"CI"}}}
               ]},
{"Problem":{"arch":"gfx90a","token":"kernel_len96x42_single_2d_single"},
 "Solutions":[ {"sol_node_type":"SOL_KERNEL_ONLY","kernel_key":{"lengths":[ 96,42 ],"precision":"single","scheme":"CS_KERNEL_2D_SINGLE","sbrc_trans":"NONE","kernelConfig":{"use_3steps":false,"half_lds":false,"dir_reg":false,"buffer_inst":false,"tpb":1,"wgs":672,"tpt":[ 16,7 ],"factors":[ 4,4,6,6,7 ],"ebtype":"C2R_PRE","direction":1,"static_dim":3,"placement":"OP","iAryType":"CI","oAryType":"CI"}}}
               ]},
{"Problem":{"arch":"gfx90a","token":"100_dp_ip_complex"},
 "Solutions":[ {"sol_node_type":"SOL_DUMMY","using_scheme":"CS_NONE","solution_childnodes":[  ]}
              ,{"sol_node_type":"SOL_INTERNAL_NODE","using_scheme":"CS_REAL_TRANSFORM_EVEN","solution_childnodes":[ {"child_token":"50_dp_ip_complex","child_option":1} ]}
              ,{"sol_node_type":"SOL_LEAF_NODE","using_scheme":"CS_KERNEL_STOCKHAM","solution_childnodes":[ {"child_token":"kernel_len100_double_sbrr","child_option":0} ]}
               ]},
{"Problem":{"arch":"gfx90a","token":"108_sp_ip_complex"},
 "Solutions":[ {"sol_node_type":"SOL_DUMMY","using_scheme":"CS_NONE","solution_childnodes":[  ]}
              ,{"sol_node_type":"SOL_INTERNAL_NODE","using_scheme":"CS_REAL_TRANSFORM_EVEN","solution_childnodes":[ {"child_token":"54_sp_ip_complex","child_option":1} ]}
              ,{"sol_node_type":"SOL_INTERNAL_NODE","using_scheme":"CS_REAL_TRANSFORM_EVEN","solution_childnodes":[ {"child_token":"54_sp_ip_complex","child_option":3} ]}
              ,{"sol_node_type":"SOL_LEAF_NODE","using_scheme":"CS_KERNEL_STOCKHAM","solution_childnodes":[ {"child_token":"kernel_len108_single_sbrr","child_option":0} ]}
              ,{"sol_node_type":"SOL_LEAF_NODE","using_scheme":"CS_KERNEL_STOCKHAM","solution_childnodes":[ {"child_token":"kernel_len108_single_sbrr","child_option":1} ]}
               ]},
{"Problem":{"arch":"gfx90a","token":"112_sp_ip_complex"},
 "Solutions":[ {"sol_node_type":"SOL_DUMMY","using_scheme":"CS_NONE","solution_childnodes":[  ]}
              ,{"sol_node_type":"SOL_INTERNAL_NODE","using_scheme":"CS_REAL_TRANSFORM_EVEN","solution_childnodes":[ {"child_token":"56_sp_ip_complex","child_option":1} ]}
              ,{"sol_node_type":"SOL_LEAF_NODE","using_scheme":"CS_KERNEL_STOCKHAM","solution_childnodes":[ {"child_token":"kernel_len112_single_sbrr","child_option":0} ]}
              ,{"sol_node_type":"SOL_LEAF_NODE","using_scheme":"CS_KERNEL_STOCKHAM","solution_childnodes":[ {"child_token":"kernel_len112_single_sbrr","child_option":1} ]}
               ]},
{"Problem":{"arch":"gfx90a","token":"125_sp_ip_complex"},
 "Solutions":[ {"sol_node_type":"SOL_DUMMY","using_scheme":"CS_NONE","solution_childnodes":[  ]}
              ,{"sol_node_type":"SOL_LEAF_NODE","using_scheme":"CS_KERNEL_STOCKHAM","solution_childnodes":[ {"child_token":"kernel_len125_single_sbrr","child_option":0} ]}
              ,{"sol_node_type":"SOL_LEAF_NODE","using_scheme":"CS_KERNEL_STOCKHAM","solution_childnodes":[ {"child_token":"kernel_len125_single_sbrr","child_option":1} ]}
               ]},
{"Problem":{"arch":"gfx90a","token":"128_sp_ip_complex"},
 "Solutions":[ {"sol_node_type":"SOL_DUMMY","using_scheme":"CS_NONE","solution_childnodes":[  ]}
              ,{"sol_node_type":"SOL_LEAF_NODE","using_scheme":"CS_KERNEL_STOCKHAM","solution_childnodes":[ {"child_token":"kernel_len128_single_sbrr","child_option":1} ]}
              ,{"sol_node_type":"SOL_INTERNAL_NODE","using_scheme":"CS_REAL_TRANSFORM_EVEN","solution_childnodes":[ {"child_token":"64_sp_ip_complex","child_option":1} ]}
              ,{"sol_node_type":"SOL_LEAF_NODE","using_scheme":"CS_KERNEL_STOCKHAM","solution_childnodes":[ {"child_token":"kernel_len128_single_sbrr","child_option":2} ]}
               ]},
{"Problem":{"arch":"gfx90a","token":"192_sp_ip_complex"},
 "Solutions":[ {"sol_node_type":"SOL_DUMMY","using_scheme":"CS_NONE","solution_childnodes":[  ]}
              ,{"sol_node_type":"SOL_INTERNAL_NODE","using_scheme":"CS_REAL_TRANSFORM_EVEN","solution_childnodes":[ {"child_token":"96_sp_ip_complex","child_option":1} ]}
              ,{"sol_node_type":"SOL_INTERNAL_NODE","using_scheme":"CS_REAL_TRANSFORM_EVEN","solution_childnodes":[ {"child_token":"96_sp_ip_complex","child_option":3} ]}
              ,{"sol_node_type":"SOL_INTERNAL_NODE","using_scheme":"CS_REAL_TRANSFORM_EVEN","solution_childnodes":[ {"child_token":"96_sp_ip_complex","child_option":5} ]}
              ,{"sol_node_type":"SOL_LEAF_NODE","using_scheme":"CS_KERNEL_STOCKHAM","solution_childnodes":[ {"child_token":"kernel_len192_single_sbrr","child_option":0} ]}
              ,{"sol_node_type":"SOL_INTERNAL_NODE","using_scheme":"CS_REAL_TRANSFORM_EVEN","solution_childnodes":[ {"child_token":"96_sp_ip_complex","child_option":7} ]}
              ,{"sol_node_type":"SOL_LEAF_NODE","using_scheme":"CS_KERNEL_STOCKHAM","solution_childnodes":[ {"child_token":"kernel_len192_single_sbrr","child_option":1} ]}
              ,{"sol_node_type":"SOL_LEAF_NODE","using_scheme":"CS_KERNEL_STOCKHAM","solution_childnodes":[ {"child_token":"kernel_len192_single_sbrr","child_option":2} ]}
              ,{"sol_node_type":"SOL_LEAF_NODE","using_scheme":"CS_KERNEL_STOCKHAM","solution_childnodes":[ {"child_token":"kernel_len192_single_sbrr","child_option":3} ]}
              ,{"sol_node_type":"SOL_LEAF_NODE","using_scheme":"CS_KERNEL_STOCKHAM","solution_childnodes":[ {"child_token":"kernel_len192_single_sbrr","child_option":4} ]}
               ]},
{"Problem":{"arch":"gfx90a","token":"2187_sp_ip_complex"},
 "Solutions":[ {"sol_node_type":"SOL_DUMMY","using_scheme":"CS_NONE","solution_childnodes":[  ]}
              ,{"sol_node_type":"SOL_LEAF_NODE","using_scheme":"CS_KERNEL_STOCKHAM","solution_childnodes":[ {"child_token":"kernel_len2187_single_sbrr","child_option":0} ]}
              ,{"sol_node_type":"SOL_LEAF_NODE","using_scheme":"CS_KERNEL_STOCKHAM","solution_childnodes":[ {"child_token":"kernel_len2187_single_sbrr","child_option":1} ]}
               ]},
{"Problem":{"arch":"gfx90a","token":"243_dp_ip_complex"},
 "Solutions":[ {"sol_node_type":"SOL_DUMMY","using_scheme":"CS_NONE","solution_childnodes":[  ]}
              ,{"sol_node_type":"SOL_LEAF_NODE","using_scheme":"CS_KERNEL_STOCKHAM","solution_childnodes":[ {"child_token":"kernel_len243_double_sbrr","child_option":0} ]}
              ,{"sol_node_type":"SOL_LEAF_NODE","using_scheme":"CS_KERNEL_STOCKHAM","solution_childnodes":[ {"child_token":"kernel_len243_double_sbrr","child_option":1} ]}
              ,{"sol_node_type":"SOL_LEAF_NODE","using_scheme":"CS_KERNEL_STOCKHAM","solution_childnodes":[ {"child_token":"kernel_len243_double_sbrr","child_option":2} ]}
              ,{"sol_node_type":"SOL_LEAF_NODE","using_scheme":"CS_KERNEL_STOCKHAM","solution_childnodes":[ {"child_token":"kernel_len243_double_sbrr","child_option":3} ]}
              ,{"sol_node_type":"SOL_LEAF_NODE","using_scheme":"CS_KERNEL_STOCKHAM","solution_childnodes":[ {"child_token":"kernel_len243_double_sbrr","child_option":4} ]}
              ,{"sol_node_type":"SOL_LEAF_NODE","using_scheme":"CS_KERNEL_STOCKHAM","solution_childnodes":[ {"child_token":"kernel_len243_double_sbrr","child_option":5} ]}
               ]},
{"Problem":{"arch":"gfx90a","token":"243_sp_ip_complex"},
 "Solutions":[ {"sol_node_type":"SOL_DUMMY","using_scheme":"CS_NONE","solution_childnodes":[  ]}
              ,{"sol_node_type":"SOL_LEAF_NODE","using_scheme":"CS_KERNEL_STOCKHAM","solution_childnodes":[ {"child_token":"kernel_len243_single_sbrr","child_option":0} ]}
              ,{"sol_node_type":"SOL_LEAF_NODE","using_scheme":"CS_KERNEL_STOCKHAM","solution_childnodes":[ {"child_token":"kernel_len243_single_sbrr","child_option":1} ]}
               ]},
{"Problem":{"arch":"gfx90a","token":"25_sp_ip_complex"},
 "Solutions":[ {"sol_node_type":"SOL_DUMMY","using_scheme":"CS_NONE","solution_childnodes":[  ]}
              ,{"sol_node_type":"SOL_LEAF_NODE","using_scheme":"CS_KERNEL_STOCKHAM","solution_childnodes":[ {"child_token":"kernel_len25_single_sbrr","child_option":0} ]}
              ,{"sol_node_type":"SOL_LEAF_NODE","using_scheme":"CS_KERNEL_STOCKHAM","solution_childnodes":[ {"child_token":"kernel_len25_single_sbrr","child_option":1} ]}
               ]},
{"Problem":{"arch":"gfx90a","token":"26_dp_ip_complex"},
 "Solutions":[ {"sol_node_type":"SOL_DUMMY","using_scheme":"CS_NONE","solution_childnodes":[  ]}
              ,{"sol_node_type":"SOL_LEAF_NODE","using_scheme":"CS_KERNEL_STOCKHAM","solution_childnodes":[ {"child_token":"kernel_len26_double_sbrr","child_option":0} ]}
              ,{"sol_node_type":"SOL_LEAF_NODE","using_scheme":"CS_KERNEL_STOCKHAM","solution_childnodes":[ {"child_token":"kernel_len26_double_sbrr","child_option":1} ]}
               ]},
{"Problem":{"arch":"gfx90a","token":"4096_sp_ip_complex"},
 "Solutions":[ {"sol_node_type":"SOL_DUMMY","using_scheme":"CS_NONE","solution_childnodes":[  ]}
              ,{"sol_node_type":"SOL_LEAF_NODE","using_scheme":"CS_KERNEL_STOCKHAM","solution_childnodes":[ {"child_token":"kernel_len4096_single_sbrr","child_option":0} ]}
               ]},
{"Problem":{"arch":"gfx90a","token":"40_sp_ip_complex"},
 "Solutions":[ {"sol_node_type":"SOL_DUMMY","using_scheme":"CS_NONE","solution_childnodes":[  ]}
              ,{"sol_node_type":"SOL_LEAF_NODE","using_scheme":"CS_KERNEL_STOCKHAM","solution_childnodes":[ {"child_token":"kernel_len40_single_sbrr","child_option":0} ]}
               ]},
{"Problem":{"arch":"gfx90a","token":"42_sp_ip_complex"},
 "Solutions":[ {"sol_node_type":"SOL_DUMMY","using_scheme":"CS_NONE","solution_childnodes":[  ]}
              ,{"sol_node_type":"SOL_LEAF_NODE","using_scheme":"CS_KERNEL_STOCKHAM","solution_childnodes":[ {"child_token":"kernel_len42_single_sbrr","child_option":0} ]}
               ]},
{"Problem":{"arch":"gfx90a","token":"48_sp_ip_complex"},
 "Solutions":[ {"sol_node_type":"SOL_DUMMY","using_scheme":"CS_NONE","solution_childnodes":[  ]}
              ,{"sol_node_type":"SOL_LEAF_NODE","using_scheme":"CS_KERNEL_STOCKHAM","solution_childnodes":[ {"child_token":"kernel_len48_single_sbrr","child_option":0} ]}
              ,{"sol_node_type":"SOL_LEAF_NODE","using_scheme":"CS_KERNEL_STOCKHAM","solution_childnodes":[ {"child_token":"kernel_len48_single_sbrr","child_option":1} ]}
              ,{"sol_node_type":"SOL_LEAF_NODE","using_scheme":"CS_KERNEL_STOCKHAM","solution_childnodes":[ {"child_token":"kernel_len48_single_sbrr","child_option":2} ]}
              ,{"sol_node_type":"SOL_LEAF_NODE","using_scheme":"CS_KERNEL_STOCKHAM","solution_childnodes":[ {"child_token":"kernel_len48_single_sbrr","child_option":3} ]}
               ]},
{"Problem":{"arch":"gfx90a","token":"50_dp_ip_complex"},
 "Solutions":[ {"sol_node_type":"SOL_DUMMY","using_scheme":"CS_NONE","solution_childnodes":[  ]}
              ,{"sol_node_type":"SOL_LEAF_NODE","using_scheme":"CS_KERNEL_STOCKHAM","solution_childnodes":[ {"child_token":"kernel_len50_double_sbrr","child_option":0} ]}
              ,{"sol_node_type":"SOL_LEAF_NODE","using_scheme":"CS_KERNEL_STOCKHAM","solution_childnodes":[ {"child_token":"kernel_len50_double_sbrr","child_option":1} ]}
               ]},
{"Problem":{"arch":"gfx90a","token":"50_sp_ip_complex"},
 "Solutions":[ {"sol_node_type":"SOL_DUMMY","using_scheme":"CS_NONE","solution_childnodes":[  ]}
              ,{"sol_node_type":"SOL_LEAF_NODE","using_scheme":"CS_KERNEL_STOCKHAM","solution_childnodes":[ {"child_token":"kernel_len50_single_sbrr","child_option":0} ]}
              ,{"sol_node_type":"SOL_LEAF_NODE","using_scheme":"CS_KERNEL_STOCKHAM","solution_childnodes":[ {"child_token":"kernel_len50_single_sbrr","child_option":1} ]}
              ,{"sol_node_type":"SOL_LEAF_NODE","using_scheme":"CS_KERNEL_STOCKHAM","solution_childnodes":[ {"child_token":"kernel_len50_single_sbrr","child_option":2} ]}
              ,{"sol_node_type":"SOL_LEAF_NODE","using_scheme":"CS_KERNEL_STOCKHAM","solution_childnodes":[ {"child_token":"kernel_len50_single_sbrr","child_option":3} ]}
              ,{"sol_node_type":"SOL_LEAF_NODE","using_scheme":"CS_KERNEL_STOCKHAM","solution_childnodes":[ {"child_token":"kernel_len50_single_sbrr","child_option":4} ]}
              ,{"sol_node_type":"SOL_LEAF_NODE","using_scheme":"CS_KERNEL_STOCKHAM","solution_childnodes":[ {"child_token":"kernel_len50_single_sbrr","child_option":5} ]}
               ]},
{"Problem":{"arch":"gfx90a","token":"52_dp_ip_complex"},
 "Solutions":[ {"sol_node_type":"SOL_DUMMY","using_scheme":"CS_NONE","solution_childnodes":[  ]}
              ,{"sol_node_type":"SOL_INTERNAL_NODE","using_scheme":"CS_REAL_TRANSFORM_EVEN","solution_childnodes":[ {"child_token":"26_dp_ip_complex","child_option":1} ]}
              ,{"sol_node_type":"SOL_LEAF_NODE","using_scheme":"CS_KERNEL_STOCKHAM","solution_childnodes":[ {"child_token":"kernel_len52_double_sbrr","child_option":0} ]}
              ,{"sol_node_type":"SOL_LEAF_NODE","using_scheme":"CS_KERNEL_STOCKHAM","solution_childnodes":[ {"child_token":"kernel_len52_double_sbrr","child_option":1} ]}
               ]},
{"Problem":{"arch":"gfx90a","token":"52_sp_ip_complex"},
 "Solutions":[ {"sol_node_type":"SOL_DUMMY","using_scheme":"CS_NONE","solution_childnodes":[  ]}
              ,{"sol_node_type":"SOL_LEAF_NODE","using_scheme":"CS_KERNEL_STOCKHAM","solution_childnodes":[ {"child_token":"kernel_len52_single_sbrr","child_option":0} ]}
               ]},
{"Problem":{"arch":"gfx90a","token":"54_sp_ip_complex"},
 "Solutions":[ {"sol_node_type":"SOL_DUMMY","using_scheme":"CS_NONE","solution_childnodes":[  ]}
              ,{"sol_node_type":"SOL_LEAF_NODE","using_scheme":"CS_KERNEL_STOCKHAM","solution_childnodes":[ {"child_token":"kernel_len54_single_sbrr","child_option":0} ]}
              ,{"sol_node_type":"SOL_LEAF_NODE","using_scheme":"CS_KERNEL_STOCKHAM","solution_childnodes":[ {"child_token":"kernel_len54_single_sbrr","child_option":1} ]}
              ,{"sol_node_type":"SOL_LEAF_NODE","using_scheme":"CS_KERNEL_STOCKHAM","solution_childnodes":[ {"child_token":"kernel_len54_single_sbrr","child_option":2} ]}
              ,{"sol_node_type":"SOL_LEAF_NODE","using_scheme":"CS_KERNEL_STOCKHAM","solution_childnodes":[ {"child_token":"kernel_len54_single_sbrr","child_option":3} ]}
               ]},
{"Problem":{"arch":"gfx90a","token":"55_dp_ip_complex"},
 "Solutions":[ {"sol_node_type":"SOL_DUMMY","using_scheme":"CS_NONE","solution_childnodes":[  ]}
              ,{"sol_node_type":"SOL_LEAF_NODE","using_scheme":"CS_KERNEL_STOCKHAM","solution_childnodes":[ {"child_token":"kernel_len55_double_sbrr","child_option":0} ]}
              ,{"sol_node_type":"SOL_LEAF_NODE","using_scheme":"CS_KERNEL_STOCKHAM","solution_childnodes":[ {"child_token":"kernel_len55_double_sbrr","child_option":1} ]}
              ,{"sol_node_type":"SOL_LEAF_NODE","using_scheme":"CS_KERNEL_STOCKHAM","solution_childnodes":[ {"child_token":"kernel_len55_double_sbrr","child_option":2} ]}
               ]},
{"Problem":{"arch":"gfx90a","token":"55_sp_ip_complex"},
 "Solutions":[ {"sol_node_type":"SOL_DUMMY","using_scheme":"CS_NONE","solution_childnodes":[  ]}
              ,{"sol_node_type":"SOL_INTERNAL_NODE","using_scheme":"CS_REAL_TRANSFORM_EVEN","solution_childnodes":[ {"child_token":"54_sp_ip_complex","child_option":2} ]}
              ,{"sol_node_type":"SOL_INTERNAL_NODE","using_scheme":"CS_REAL_TRANSFORM_EVEN","solution_childnodes":[ {"child_token":"54_sp_ip_complex","child_option":4} ]}
              ,{"sol_node_type":"SOL_LEAF_NODE","using_scheme":"CS_KERNEL_STOCKHAM","solution_childnodes":[ {"child_token":"kernel_len55_single_sbrr","child_option":0} ]}
              ,{"sol_node_type":"SOL_LEAF_NODE","using_scheme":"CS_KERNEL_STOCKHAM","solution_childnodes":[ {"child_token":"kernel_len55_single_sbrr","child_option":1} ]}
              ,{"sol_node_type":"SOL_LEAF_NODE","using_scheme":"CS_KERNEL_STOCKHAM","solution_childnodes":[ {"child_token":"kernel_len55_single_sbrr","child_option":2} ]}
              ,{"sol_node_type":"SOL_LEAF_NODE","using_scheme":"CS_KERNEL_STOCKHAM","solution_childnodes":[ {"child_token":"kernel_len55_single_sbrr","child_option":3} ]}
               ]},
{"Problem":{"arch":"gfx90a","token":"56_dp_ip_complex"},
 "Solutions":[ {"sol_node_type":"SOL_DUMMY","using_scheme":"CS_NONE","solution_childnodes":[  ]}
              ,{"sol_node_type":"SOL_LEAF_NODE","using_scheme":"CS_KERNEL_STOCKHAM","solution_childnodes":[ {"child_token":"kernel_len56_double_sbrr","child_option":0} ]}
              ,{"sol_node_type":"SOL_LEAF_NODE","using_scheme":"CS_KERNEL_STOCKHAM","solution_childnodes":[ {"child_token":"kernel_len56_double_sbrr","child_option":1} ]}
              ,{"sol_node_type":"SOL_LEAF_NODE","using_scheme":"CS_KERNEL_STOCKHAM","solution_childnodes":[ {"child_token":"kernel_len56_double_sbrr","child_option":2} ]}
              ,{"sol_node_type":"SOL_LEAF_NODE","using_scheme":"CS_KERNEL_STOCKHAM","solution_childnodes":[ {"child_token":"kernel_len56_double_sbrr","child_option":3} ]}
               ]},
{"Problem":{"arch":"gfx90a","token":"56_sp_ip_complex"},
 "Solutions":[ {"sol_node_type":"SOL_DUMMY","using_scheme":"CS_NONE","solution_childnodes":[  ]}
              ,{"sol_node_type":"SOL_LEAF_NODE","using_scheme":"CS_KERNEL_STOCKHAM","solution_childnodes":[ {"child_token":"kernel_len56_single_sbrr","child_option":0} ]}
              ,{"sol_node_type":"SOL_LEAF_NODE","using_scheme":"CS_KERNEL_STOCKHAM","solution_childnodes":[ {"child_token":"kernel_len56_single_sbrr","child_option":1} ]}
               ]},
{"Problem":{"arch":"gfx90a","token":"64_sp_ip_complex"},
 "Solutions":[ {"sol_node_type":"SOL_DUMMY","using_scheme":"CS_NONE","solution_childnodes":[  ]}
              ,{"sol_node_type":"SOL_LEAF_NODE","using_scheme":"CS_KERNEL_STOCKHAM","solution_childnodes":[ {"child_token":"kernel_len64_single_sbrr","child_option":0} ]}
              ,{"sol_node_type":"SOL_LEAF_NODE","using_scheme":"CS_KERNEL_STOCKHAM","solution_childnodes":[ {"child_token":"kernel_len64_single_sbrr","child_option":1} ]}
               ]},
{"Problem":{"arch":"gfx90a","token":"72_sp_ip_complex"},
 "Solutions":[ {"sol_node_type":"SOL_DUMMY","using_scheme":"CS_NONE","solution_childnodes":[  ]}
              ,{"sol_node_type":"SOL_LEAF_NODE","using_scheme":"CS_KERNEL_STOCKHAM","solution_childnodes":[ {"child_token":"kernel_len72_single_sbrr","child_option":0} ]}
              ,{"sol_node_type":"SOL_LEAF_NODE","using_scheme":"CS_KERNEL_STOCKHAM","solution_childnodes":[ {"child_token":"kernel_len72_single_sbrr","child_option":1} ]}
               ]},
{"Problem":{"arch":"gfx90a","token":"75_dp_ip_complex"},
 "Solutions":[ {"sol_node_type":"SOL_DUMMY","using_scheme":"CS_NONE","solution_childnodes":[  ]}
              ,{"sol_node_type":"SOL_LEAF_NODE","using_scheme":"CS_KERNEL_STOCKHAM","solution_childnodes":[ {"child_token":"kernel_len75_double_sbrr","child_option":0} ]}
               ]},
{"Problem":{"arch":"gfx90a","token":"75_sp_ip_complex"},
 "Solutions":[ {"sol_node_type":"SOL_DUMMY","using_scheme":"CS_NONE","solution_childnodes":[  ]}
              ,{"sol_node_type":"SOL_LEAF_NODE","using_scheme":"CS_KERNEL_STOCKHAM","solution_childnodes":[ {"child_token":"kernel_len75_single_sbrr","child_option":0} ]}
               ]},
{"Problem":{"arch":"gfx90a","token":"81_dp_ip_complex"},
 "Solutions":[ {"sol_node_type":"SOL_DUMMY","using_scheme":"CS_NONE","solution_childnodes":[  ]}
              ,{"sol_node_type":"SOL_LEAF_NODE","using_scheme":"CS_KERNEL_STOCKHAM","solution_childnodes":[ {"child_token":"kernel_len81_double_sbrr","child_option":0} ]}
               ]},
{"Problem":{"arch":"gfx90a","token":"84_sp_ip_complex"},
 "Solutions":[ {"sol_node_type":"SOL_DUMMY","using_scheme":"CS_NONE","solution_childnodes":[  ]}
              ,{"sol_node_type":"SOL_LEAF_NODE","using_scheme":"CS_KERNEL_STOCKHAM","solution_childnodes":[ {"child_token":"kernel_len84_single_sbrr","child_option":0} ]}
              ,{"sol_node_type":"SOL_LEAF_NODE","using_scheme":"CS_KERNEL_STOCKHAM","solution_childnodes":[ {"child_token":"kernel_len84_single_sbrr","child_option":1} ]}
              ,{"sol_node_type":"SOL_LEAF_NODE","using_scheme":"CS_KERNEL_STOCKHAM","solution_childnodes":[ {"child_token":"kernel_len84_single_sbrr","child_option":2} ]}
              ,{"sol_node_type":"SOL_LEAF_NODE","using_scheme":"CS_KERNEL_STOCKHAM","solution_childnodes":[ {"child_token":"kernel_len84_single_sbrr","child_option":3} ]}
               ]},
{"Problem":{"arch":"gfx90a","token":"sbcc_100_dp_ip_complex"},
 "Solutions":[ {"sol_node_type":"SOL_LEAF_NODE","using_scheme":"CS_KERNEL_STOCKHAM_BLOCK_CC","solution_childnodes":[ {"child_token":"kernel_len100_double_sbcc","child_option":0} ]}
              ,{"sol_node_type":"SOL_LEAF_NODE","using_scheme":"CS_KERNEL_STOCKHAM_BLOCK_CC","solution_childnodes":[ {"child_token":"kernel_len100_double_sbcc","child_option":1} ]}
              ,{"sol_node_type":"SOL_LEAF_NODE","using_scheme":"CS_KERNEL_STOCKHAM_BLOCK_CC","solution_childnodes":[ {"child_token":"kernel_len100_double_sbcc","child_option":2} ]}
              ,{"sol_node_type":"SOL_LEAF_NODE","using_scheme":"CS_KERNEL_STOCKHAM_BLOCK_CC","solution_childnodes":[ {"child_token":"kernel_len100_double_sbcc","child_option":3} ]}
              ,{"sol_node_type":"SOL_LEAF_NODE","using_scheme":"CS_KERNEL_STOCKHAM_BLOCK_CC","solution_childnodes":[ {"child_token":"kernel_len100_double_sbcc","child_option":4} ]}
               ]},
{"Problem":{"arch":"gfx90a","token":"sbcc_100_sp_ip_complex"},
 "Solutions":[ {"sol_node_type":"SOL_LEAF_NODE","using_scheme":"CS_KERNEL_STOCKHAM_BLOCK_CC","solution_childnodes":[ {"child_token":"kernel_len100_single_sbcc","child_option":0} ]}
              ,{"sol_node_type":"SOL_LEAF_NODE","using_scheme":"CS_KERNEL_STOCKHAM_BLOCK_CC","solution_childnodes":[ {"child_token":"kernel_len100_single_sbcc","child_option":1} ]}
              ,{"sol_node_type":"SOL_LEAF_NODE","using_scheme":"CS_KERNEL_STOCKHAM_BLOCK_CC","solution_childnodes":[ {"child_token":"kernel_len100_single_sbcc","child_option":2} ]}
              ,{"sol_node_type":"SOL_LEAF_NODE","using_scheme":"CS_KERNEL_STOCKHAM_BLOCK_CC","solution_childnodes":[ {"child_token":"kernel_len100_single_sbcc","child_option":3} ]}
               ]},
{"Problem":{"arch":"gfx90a","token":"sbcc_104_dp_ip_complex"},
 "Solutions":[ {"sol_node_type":"SOL_LEAF_NODE","using_scheme":"CS_KERNEL_STOCKHAM_BLOCK_CC","solution_childnodes":[ {"child_token":"kernel_len104_double_sbcc","child_option":0} ]}
              ,{"sol_node_type":"SOL_LEAF_NODE","using_scheme":"CS_KERNEL_STOCKHAM_BLOCK_CC","solution_childnodes":[ {"child_token":"kernel_len104_double_sbcc","child_option":1} ]}
               ]},
{"Problem":{"arch":"gfx90a","token":"sbcc_104_sp_ip_complex"},
 "Solutions":[ {"sol_node_type":"SOL_LEAF_NODE","using_scheme":"CS_KERNEL_STOCKHAM_BLOCK_CC","solution_childnodes":[ {"child_token":"kernel_len104_single_sbcc","child_option":0} ]}
              ,{"sol_node_type":"SOL_LEAF_NODE","using_scheme":"CS_KERNEL_STOCKHAM_BLOCK_CC","solution_childnodes":[ {"child_token":"kernel_len104_single_sbcc","child_option":1} ]}
               ]},
{"Problem":{"arch":"gfx90a","token":"sbcc_108_sp_ip_complex"},
 "Solutions":[ {"sol_node_type":"SOL_LEAF_NODE","using_scheme":"CS_KERNEL_STOCKHAM_BLOCK_CC","solution_childnodes":[ {"child_token":"kernel_len108_single_sbcc","child_option":0} ]}
              ,{"sol_node_type":"SOL_LEAF_NODE","using_scheme":"CS_KERNEL_STOCKHAM_BLOCK_CC","solution_childnodes":[ {"child_token":"kernel_len108_single_sbcc","child_option":1} ]}
              ,{"sol_node_type":"SOL_LEAF_NODE","using_scheme":"CS_KERNEL_STOCKHAM_BLOCK_CC","solution_childnodes":[ {"child_token":"kernel_len108_single_sbcc","child_option":2} ]}
              ,{"sol_node_type":"SOL_LEAF_NODE","using_scheme":"CS_KERNEL_STOCKHAM_BLOCK_CC","solution_childnodes":[ {"child_token":"kernel_len108_single_sbcc","child_option":3} ]}
              ,{"sol_node_type":"SOL_LEAF_NODE","using_scheme":"CS_KERNEL_STOCKHAM_BLOCK_CC","solution_childnodes":[ {"child_token":"kernel_len108_single_sbcc","child_option":4} ]}
              ,{"sol_node_type":"SOL_LEAF_NODE","using_scheme":"CS_KERNEL_STOCKHAM_BLOCK_CC","solution_childnodes":[ {"child_token":"kernel_len108_single_sbcc","child_option":5} ]}
              ,{"sol_node_type":"SOL_LEAF_NODE","using_scheme":"CS_KERNEL_STOCKHAM_BLOCK_CC","solution_childnodes":[ {"child_token":"kernel_len108_single_sbcc","child_option":6} ]}
               ]},
{"Problem":{"arch":"gfx90a","token":"sbcc_112_sp_ip_complex"},
 "Solutions":[ {"sol_node_type":"SOL_LEAF_NODE","using_scheme":"CS_KERNEL_STOCKHAM_BLOCK_CC","solution_childnodes":[ {"child_token":"kernel_len112_single_sbcc","child_option":0} ]}
              ,{"sol_node_type":"SOL_LEAF_NODE","using_scheme":"CS_KERNEL_STOCKHAM_BLOCK_CC","solution_childnodes":[ {"child_token":"kernel_len112_single_sbcc","child_option":1} ]}
              ,{"sol_node_type":"SOL_LEAF_NODE","using_scheme":"CS_KERNEL_STOCKHAM_BLOCK_CC","solution_childnodes":[ {"child_token":"kernel_len112_single_sbcc","child_option":2} ]}
               ]},
{"Problem":{"arch":"gfx90a","token":"sbcc_125_dp_ip_complex"},
 "Solutions":[ {"sol_node_type":"SOL_LEAF_NODE","using_scheme":"CS_KERNEL_STOCKHAM_BLOCK_CC","solution_childnodes":[ {"child_token":"kernel_len125_double_sbcc","child_option":0} ]}
              ,{"sol_node_type":"SOL_LEAF_NODE","using_scheme":"CS_KERNEL_STOCKHAM_BLOCK_CC","solution_childnodes":[ {"child_token":"kernel_len125_double_sbcc","child_option":1} ]}
               ]},
{"Problem":{"arch":"gfx90a","token":"sbcc_125_sp_ip_complex"},
 "Solutions":[ {"sol_node_type":"SOL_LEAF_NODE","using_scheme":"CS_KERNEL_STOCKHAM_BLOCK_CC","solution_childnodes":[ {"child_token":"kernel_len125_single_sbcc","child_option":0} ]}
              ,{"sol_node_type":"SOL_LEAF_NODE","using_scheme":"CS_KERNEL_STOCKHAM_BLOCK_CC","solution_childnodes":[ {"child_token":"kernel_len125_single_sbcc","child_option":1} ]}
              ,{"sol_node_type":"SOL_LEAF_NODE","using_scheme":"CS_KERNEL_STOCKHAM_BLOCK_CC","solution_childnodes":[ {"child_token":"kernel_len125_single_sbcc","child_option":2} ]}
               ]},
{"Problem":{"arch":"gfx90a","token":"sbcc_128_sp_ip_complex"},
 "Solutions":[ {"sol_node_type":"SOL_LEAF_NODE","using_scheme":"CS_KERNEL_STOCKHAM_BLOCK_CC","solution_childnodes":[ {"child_token":"kernel_len128_single_sbcc","child_option":0} ]}
              ,{"sol_node_type":"SOL_LEAF_NODE","using_scheme":"CS_KERNEL_STOCKHAM_BLOCK_CC","solution_childnodes":[ {"child_token":"kernel_len128_single_sbcc","child_option":1} ]}
              ,{"sol_node_type":"SOL_LEAF_NODE","using_scheme":"CS_KERNEL_STOCKHAM_BLOCK_CC","solution_childnodes":[ {"child_token":"kernel_len128_single_sbcc","child_option":2} ]}
              ,{"sol_node_type":"SOL_LEAF_NODE","using_scheme":"CS_KERNEL_STOCKHAM_BLOCK_CC","solution_childnodes":[ {"child_token":"kernel_len128_single_sbcc","child_option":3} ]}
               ]},
{"Problem":{"arch":"gfx90a","token":"sbcc_160_sp_ip_complex"},
 "Solutions":[ {"sol_node_type":"SOL_LEAF_NODE","using_scheme":"CS_KERNEL_STOCKHAM_BLOCK_CC","solution_childnodes":[ {"child_token":"kernel_len160_single_sbcc","child_option":0} ]}
              ,{"sol_node_type":"SOL_LEAF_NODE","using_scheme":"CS_KERNEL_STOCKHAM_BLOCK_CC","solution_childnodes":[ {"child_token":"kernel_len160_single_sbcc","child_option":1} ]}
              ,{"sol_node_type":"SOL_LEAF_NODE","using_scheme":"CS_KERNEL_STOCKHAM_BLOCK_CC","solution_childnodes":[ {"child_token":"kernel_len160_single_sbcc","child_option":2} ]}
              ,{"sol_node_type":"SOL_LEAF_NODE","using_scheme":"CS_KERNEL_STOCKHAM_BLOCK_CC","solution_childnodes":[ {"child_token":"kernel_len160_single_sbcc","child_option":3} ]}
              ,{"sol_node_type":"SOL_LEAF_NODE","using_scheme":"CS_KERNEL_STOCKHAM_BLOCK_CC","solution_childnodes":[ {"child_token":"kernel_len160_single_sbcc","child_option":4} ]}
              ,{"sol_node_type":"SOL_LEAF_NODE","using_scheme":"CS_KERNEL_STOCKHAM_BLOCK_CC","solution_childnodes":[ {"child_token":"kernel_len160_single_sbcc","child_option":5} ]}
               ]},
{"Problem":{"arch":"gfx90a","token":"sbcc_168_dp_ip_complex"},
 "Solutions":[ {"sol_node_type":"SOL_LEAF_NODE","using_scheme":"CS_KERNEL_STOCKHAM_BLOCK_CC","solution_childnodes":[ {"child_token":"kernel_len168_double_sbcc","child_option":0} ]}
              ,{"sol_node_type":"SOL_LEAF_NODE","using_scheme":"CS_KERNEL_STOCKHAM_BLOCK_CC","solution_childnodes":[ {"child_token":"kernel_len168_double_sbcc","child_option":1} ]}
              ,{"sol_node_type":"SOL_LEAF_NODE","using_scheme":"CS_KERNEL_STOCKHAM_BLOCK_CC","solution_childnodes":[ {"child_token":"kernel_len168_double_sbcc","child_option":2} ]}
               ]},
{"Problem":{"arch":"gfx90a","token":"sbcc_168_sp_ip_complex"},
 "Solutions":[ {"sol_node_type":"SOL_LEAF_NODE","using_scheme":"CS_KERNEL_STOCKHAM_BLOCK_CC","solution_childnodes":[ {"child_token":"kernel_len168_single_sbcc","child_option":0} ]}
              ,{"sol_node_type":"SOL_LEAF_NODE","using_scheme":"CS_KERNEL_STOCKHAM_BLOCK_CC","solution_childnodes":[ {"child_token":"kernel_len168_single_sbcc","child_option":1} ]}
              ,{"sol_node_type":"SOL_LEAF_NODE","using_scheme":"CS_KERNEL_STOCKHAM_BLOCK_CC","solution_childnodes":[ {"child_token":"kernel_len168_single_sbcc","child_option":2} ]}
              ,{"sol_node_type":"SOL_LEAF_NODE","using_scheme":"CS_KERNEL_STOCKHAM_BLOCK_CC","solution_childnodes":[ {"child_token":"kernel_len168_single_sbcc","child_option":3} ]}
              ,{"sol_node_type":"SOL_LEAF_NODE","using_scheme":"CS_KERNEL_STOCKHAM_BLOCK_CC","solution_childnodes":[ {"child_token":"kernel_len168_single_sbcc","child_option":4} ]}
              ,{"sol_node_type":"SOL_LEAF_NODE","using_scheme":"CS_KERNEL_STOCKHAM_BLOCK_CC","solution_childnodes":[ {"child_token":"kernel_len168_single_sbcc","child_option":5} ]}
              ,{"sol_node_type":"SOL_LEAF_NODE","using_scheme":"CS_KERNEL_STOCKHAM_BLOCK_CC","solution_childnodes":[ {"child_token":"kernel_len168_single_sbcc","child_option":6} ]}
              ,{"sol_node_type":"SOL_LEAF_NODE","using_scheme":"CS_KERNEL_STOCKHAM_BLOCK_CC","solution_childnodes":[ {"child_token":"kernel_len168_single_sbcc","child_option":7} ]}
              ,{"sol_node_type":"SOL_LEAF_NODE","using_scheme":"CS_KERNEL_STOCKHAM_BLOCK_CC","solution_childnodes":[ {"child_token":"kernel_len168_single_sbcc","child_option":8} ]}
              ,{"sol_node_type":"SOL_LEAF_NODE","using_scheme":"CS_KERNEL_STOCKHAM_BLOCK_CC","solution_childnodes":[ {"child_token":"kernel_len168_single_sbcc","child_option":9} ]}
               ]},
{"Problem":{"arch":"gfx90a","token":"sbcc_192_sp_ip_complex"},
 "Solutions":[ {"sol_node_type":"SOL_LEAF_NODE","using_scheme":"CS_KERNEL_STOCKHAM_BLOCK_CC","solution_childnodes":[ {"child_token":"kernel_len192_single_sbcc","child_option":0} ]}
              ,{"sol_node_type":"SOL_LEAF_NODE","using_scheme":"CS_KERNEL_STOCKHAM_BLOCK_CC","solution_childnodes":[ {"child_token":"kernel_len192_single_sbcc","child_option":1} ]}
              ,{"sol_node_type":"SOL_LEAF_NODE","using_scheme":"CS_KERNEL_STOCKHAM_BLOCK_CC","solution_childnodes":[ {"child_token":"kernel_len192_single_sbcc","child_option":2} ]}
              ,{"sol_node_type":"SOL_LEAF_NODE","using_scheme":"CS_KERNEL_STOCKHAM_BLOCK_CC","solution_childnodes":[ {"child_token":"kernel_len192_single_sbcc","child_option":3} ]}
              ,{"sol_node_type":"SOL_LEAF_NODE","using_scheme":"CS_KERNEL_STOCKHAM_BLOCK_CC","solution_childnodes":[ {"child_token":"kernel_len192_single_sbcc","child_option":4} ]}
              ,{"sol_node_type":"SOL_LEAF_NODE","using_scheme":"CS_KERNEL_STOCKHAM_BLOCK_CC","solution_childnodes":[ {"child_token":"kernel_len192_single_sbcc","child_option":5} ]}
              ,{"sol_node_type":"SOL_LEAF_NODE","using_scheme":"CS_KERNEL_STOCKHAM_BLOCK_CC","solution_childnodes":[ {"child_token":"kernel_len192_single_sbcc","child_option":6} ]}
              ,{"sol_node_type":"SOL_LEAF_NODE","using_scheme":"CS_KERNEL_STOCKHAM_BLOCK_CC","solution_childnodes":[ {"child_token":"kernel_len192_single_sbcc","child_option":7} ]}
              ,{"sol_node_type":"SOL_LEAF_NODE","using_scheme":"CS_KERNEL_STOCKHAM_BLOCK_CC","solution_childnodes":[ {"child_token":"kernel_len192_single_sbcc","child_option":8} ]}
              ,{"sol_node_type":"SOL_LEAF_NODE","using_scheme":"CS_KERNEL_STOCKHAM_BLOCK_CC","solution_childnodes":[ {"child_token":"kernel_len192_single_sbcc","child_option":9} ]}
              ,{"sol_node_type":"SOL_LEAF_NODE","using_scheme":"CS_KERNEL_STOCKHAM_BLOCK_CC","solution_childnodes":[ {"child_token":"kernel_len192_single_sbcc","child_option":10} ]}
               ]},
{"Problem":{"arch":"gfx90a","token":"sbcc_200_dp_ip_complex"},
 "Solutions":[ {"sol_node_type":"SOL_LEAF_NODE","using_scheme":"CS_KERNEL_STOCKHAM_BLOCK_CC","solution_childnodes":[ {"child_token":"kernel_len200_double_sbcc","child_option":0} ]}
               ]},
{"Problem":{"arch":"gfx90a","token":"sbcc_200_sp_ip_complex"},
 "Solutions":[ {"sol_node_type":"SOL_LEAF_NODE","using_scheme":"CS_KERNEL_STOCKHAM_BLOCK_CC","solution_childnodes":[ {"child_token":"kernel_len200_single_sbcc","child_option":0} ]}
              ,{"sol_node_type":"SOL_LEAF_NODE","using_scheme":"CS_KERNEL_STOCKHAM_BLOCK_CC","solution_childnodes":[ {"child_token":"kernel_len200_single_sbcc","child_option":1} ]}
              ,{"sol_node_type":"SOL_LEAF_NODE","using_scheme":"CS_KERNEL_STOCKHAM_BLOCK_CC","solution_childnodes":[ {"child_token":"kernel_len200_single_sbcc","child_option":2} ]}
              ,{"sol_node_type":"SOL_LEAF_NODE","using_scheme":"CS_KERNEL_STOCKHAM_BLOCK_CC","solution_childnodes":[ {"child_token":"kernel_len200_single_sbcc","child_option":3} ]}
              ,{"sol_node_type":"SOL_LEAF_NODE","using_scheme":"CS_KERNEL_STOCKHAM_BLOCK_CC","solution_childnodes":[ {"child_token":"kernel_len200_single_sbcc","child_option":4} ]}
              ,{"sol_node_type":"SOL_LEAF_NODE","using_scheme":"CS_KERNEL_STOCKHAM_BLOCK_CC","solution_childnodes":[ {"child_token":"kernel_len200_single_sbcc","child_option":5} ]}
               ]},
{"Problem":{"arch":"gfx90a","token":"sbcc_208_dp_ip_complex"},
 "Solutions":[ {"sol_node_type":"SOL_LEAF_NODE","using_scheme":"CS_KERNEL_STOCKHAM_BLOCK_CC","solution_childnodes":[ {"child_token":"kernel_len208_double_sbcc","child_option":0} ]}
              ,{"sol_node_type":"SOL_LEAF_NODE","using_scheme":"CS_KERNEL_STOCKHAM_BLOCK_CC","solution_childnodes":[ {"child_token":"kernel_len208_double_sbcc","child_option":1} ]}
               ]},
{"Problem":{"arch":"gfx90a","token":"sbcc_208_sp_ip_complex"},
 "Solutions":[ {"sol_node_type":"SOL_LEAF_NODE","using_scheme":"CS_KERNEL_STOCKHAM_BLOCK_CC","solution_childnodes":[ {"child_token":"kernel_len208_single_sbcc","child_option":0} ]}
              ,{"sol_node_type":"SOL_LEAF_NODE","using_scheme":"CS_KERNEL_STOCKHAM_BLOCK_CC","solution_childnodes":[ {"child_token":"kernel_len208_single_sbcc","child_option":1} ]}
              ,{"sol_node_type":"SOL_LEAF_NODE","using_scheme":"CS_KERNEL_STOCKHAM_BLOCK_CC","solution_childnodes":[ {"child_token":"kernel_len208_single_sbcc","child_option":2} ]}
               ]},
{"Problem":{"arch":"gfx90a","token":"sbcc_216_sp_ip_complex"},
 "Solutions":[ {"sol_node_type":"SOL_LEAF_NODE","using_scheme":"CS_KERNEL_STOCKHAM_BLOCK_CC","solution_childnodes":[ {"child_token":"kernel_len216_single_sbcc","child_option":0} ]}
              ,{"sol_node_type":"SOL_LEAF_NODE","using_scheme":"CS_KERNEL_STOCKHAM_BLOCK_CC","solution_childnodes":[ {"child_token":"kernel_len216_single_sbcc","child_option":1} ]}
              ,{"sol_node_type":"SOL_LEAF_NODE","using_scheme":"CS_KERNEL_STOCKHAM_BLOCK_CC","solution_childnodes":[ {"child_token":"kernel_len216_single_sbcc","child_option":2} ]}
              ,{"sol_node_type":"SOL_LEAF_NODE","using_scheme":"CS_KERNEL_STOCKHAM_BLOCK_CC","solution_childnodes":[ {"child_token":"kernel_len216_single_sbcc","child_option":3} ]}
              ,{"sol_node_type":"SOL_LEAF_NODE","using_scheme":"CS_KERNEL_STOCKHAM_BLOCK_CC","solution_childnodes":[ {"child_token":"kernel_len216_single_sbcc","child_option":4} ]}
              ,{"sol_node_type":"SOL_LEAF_NODE","using_scheme":"CS_KERNEL_STOCKHAM_BLOCK_CC","solution_childnodes":[ {"child_token":"kernel_len216_single_sbcc","child_option":5} ]}
               ]},
{"Problem":{"arch":"gfx90a","token":"sbcc_224_dp_ip_complex"},
 "Solutions":[ {"sol_node_type":"SOL_LEAF_NODE","using_scheme":"CS_KERNEL_STOCKHAM_BLOCK_CC","solution_childnodes":[ {"child_token":"kernel_len224_double_sbcc","child_option":0} ]}
               ]},
{"Problem":{"arch":"gfx90a","token":"sbcc_224_sp_ip_complex"},
 "Solutions":[ {"sol_node_type":"SOL_LEAF_NODE","using_scheme":"CS_KERNEL_STOCKHAM_BLOCK_CC","solution_childnodes":[ {"child_token":"kernel_len224_single_sbcc","child_option":0} ]}
              ,{"sol_node_type":"SOL_LEAF_NODE","using_scheme":"CS_KERNEL_STOCKHAM_BLOCK_CC","solution_childnodes":[ {"child_token":"kernel_len224_single_sbcc","child_option":1} ]}
              ,{"sol_node_type":"SOL_LEAF_NODE","using_scheme":"CS_KERNEL_STOCKHAM_BLOCK_CC","solution_childnodes":[ {"child_token":"kernel_len224_single_sbcc","child_option":2} ]}
              ,{"sol_node_type":"SOL_LEAF_NODE","using_scheme":"CS_KERNEL_STOCKHAM_BLOCK_CC","solution_childnodes":[ {"child_token":"kernel_len224_single_sbcc","child_option":3} ]}
              ,{"sol_node_type":"SOL_LEAF_NODE","using_scheme":"CS_KERNEL_STOCKHAM_BLOCK_CC","solution_childnodes":[ {"child_token":"kernel_len224_single_sbcc","child_option":4} ]}
               ]},
{"Problem":{"arch":"gfx90a","token":"sbcc_240_sp_ip_complex"},
 "Solutions":[ {"sol_node_type":"SOL_LEAF_NODE","using_scheme":"CS_KERNEL_STOCKHAM_BLOCK_CC","solution_childnodes":[ {"child_token":"kernel_len240_single_sbcc","child_option":0} ]}
              ,{"sol_node_type":"SOL_LEAF_NODE","using_scheme":"CS_KERNEL_STOCKHAM_BLOCK_CC","solution_childnodes":[ {"child_token":"kernel_len240_single_sbcc","child_option":1} ]}
              ,{"sol_node_type":"SOL_LEAF_NODE","using_scheme":"CS_KERNEL_STOCKHAM_BLOCK_CC","solution_childnodes":[ {"child_token":"kernel_len240_single_sbcc","child_option":2} ]}
              ,{"sol_node_type":"SOL_LEAF_NODE","using_scheme":"CS_KERNEL_STOCKHAM_BLOCK_CC","solution_childnodes":[ {"child_token":"kernel_len240_single_sbcc","child_option":3} ]}
              ,{"sol_node_type":"SOL_LEAF_NODE","using_scheme":"CS_KERNEL_STOCKHAM_BLOCK_CC","solution_childnodes":[ {"child_token":"kernel_len240_single_sbcc","child_option":4} ]}
              ,{"sol_node_type":"SOL_LEAF_NODE","using_scheme":"CS_KERNEL_STOCKHAM_BLOCK_CC","solution_childnodes":[ {"child_token":"kernel_len240_single_sbcc","child_option":5} ]}
              ,{"sol_node_type":"SOL_LEAF_NODE","using_scheme":"CS_KERNEL_STOCKHAM_BLOCK_CC","solution_childnodes":[ {"child_token":"kernel_len240_single_sbcc","child_option":6} ]}
               ]},
{"Problem":{"arch":"gfx90a","token":"sbcc_243_dp_ip_complex"},
 "Solutions":[ {"sol_node_type":"SOL_LEAF_NODE","using_scheme":"CS_KERNEL_STOCKHAM_BLOCK_CC","solution_childnodes":[ {"child_token":"kernel_len243_double_sbcc","child_option":0} ]}
              ,{"sol_node_type":"SOL_LEAF_NODE","using_scheme":"CS_KERNEL_STOCKHAM_BLOCK_CC","solution_childnodes":[ {"child_token":"kernel_len243_double_sbcc","child_option":1} ]}
              ,{"sol_node_type":"SOL_LEAF_NODE","using_scheme":"CS_KERNEL_STOCKHAM_BLOCK_CC","solution_childnodes":[ {"child_token":"kernel_len243_double_sbcc","child_option":2} ]}
               ]},
{"Problem":{"arch":"gfx90a","token":"sbcc_243_sp_ip_complex"},
 "Solutions":[ {"sol_node_type":"SOL_LEAF_NODE","using_scheme":"CS_KERNEL_STOCKHAM_BLOCK_CC","solution_childnodes":[ {"child_token":"kernel_len243_single_sbcc","child_option":0} ]}
               ]},
{"Problem":{"arch":"gfx90a","token":"sbcc_280_sp_ip_complex"},
 "Solutions":[ {"sol_node_type":"SOL_LEAF_NODE","using_scheme":"CS_KERNEL_STOCKHAM_BLOCK_CC","solution_childnodes":[ {"child_token":"kernel_len280_single_sbcc","child_option":0} ]}
              ,{"sol_node_type":"SOL_LEAF_NODE","using_scheme":"CS_KERNEL_STOCKHAM_BLOCK_CC","solution_childnodes":[ {"child_token":"kernel_len280_single_sbcc","child_option":1} ]}
               ]},
{"Problem":{"arch":"gfx90a","token":"sbcc_336_dp_ip_complex"},
 "Solutions":[ {"sol_node_type":"SOL_LEAF_NODE","using_scheme":"CS_KERNEL_STOCKHAM_BLOCK_CC","solution_childnodes":[ {"child_token":"kernel_len336_double_sbcc","child_option":0} ]}
              ,{"sol_node_type":"SOL_LEAF_NODE","using_scheme":"CS_KERNEL_STOCKHAM_BLOCK_CC","solution_childnodes":[ {"child_token":"kernel_len336_double_sbcc","child_option":1} ]}
              ,{"sol_node_type":"SOL_LEAF_NODE","using_scheme":"CS_KERNEL_STOCKHAM_BLOCK_CC","solution_childnodes":[ {"child_token":"kernel_len336_double_sbcc","child_option":2} ]}
              ,{"sol_node_type":"SOL_LEAF_NODE","using_scheme":"CS_KERNEL_STOCKHAM_BLOCK_CC","solution_childnodes":[ {"child_token":"kernel_len336_double_sbcc","child_option":3} ]}
              ,{"sol_node_type":"SOL_LEAF_NODE","using_scheme":"CS_KERNEL_STOCKHAM_BLOCK_CC","solution_childnodes":[ {"child_token":"kernel_len336_double_sbcc","child_option":4} ]}
              ,{"sol_node_type":"SOL_LEAF_NODE","using_scheme":"CS_KERNEL_STOCKHAM_BLOCK_CC","solution_childnodes":[ {"child_token":"kernel_len336_double_sbcc","child_option":5} ]}
              ,{"sol_node_type":"SOL_LEAF_NODE","using_scheme":"CS_KERNEL_STOCKHAM_BLOCK_CC","solution_childnodes":[ {"child_token":"kernel_len336_double_sbcc","child_option":6} ]}
              ,{"sol_node_type":"SOL_LEAF_NODE","using_scheme":"CS_KERNEL_STOCKHAM_BLOCK_CC","solution_childnodes":[ {"child_token":"kernel_len336_double_sbcc","child_option":7} ]}
               ]},
{"Problem":{"arch":"gfx90a","token":"sbcc_343_dp_ip_complex"},
 "Solutions":[ {"sol_node_type":"SOL_LEAF_NODE","using_scheme":"CS_KERNEL_STOCKHAM_BLOCK_CC","solution_childnodes":[ {"child_token":"kernel_len343_double_sbcc","child_option":0} ]}
              ,{"sol_node_type":"SOL_LEAF_NODE","using_scheme":"CS_KERNEL_STOCKHAM_BLOCK_CC","solution_childnodes":[ {"child_token":"kernel_len343_double_sbcc","child_option":1} ]}
               ]},
{"Problem":{"arch":"gfx90a","token":"sbcc_60_sp_ip_complex"},
 "Solutions":[ {"sol_node_type":"SOL_LEAF_NODE","using_scheme":"CS_KERNEL_STOCKHAM_BLOCK_CC","solution_childnodes":[ {"child_token":"kernel_len60_single_sbcc","child_option":0} ]}
              ,{"sol_node_type":"SOL_LEAF_NODE","using_scheme":"CS_KERNEL_STOCKHAM_BLOCK_CC","solution_childnodes":[ {"child_token":"kernel_len60_single_sbcc","child_option":1} ]}
               ]},
{"Problem":{"arch":"gfx90a","token":"sbcc_64_dp_ip_complex"},
 "Solutions":[ {"sol_node_type":"SOL_LEAF_NODE","using_scheme":"CS_KERNEL_STOCKHAM_BLOCK_CC","solution_childnodes":[ {"child_token":"kernel_len64_double_sbcc","child_option":0} ]}
              ,{"sol_node_type":"SOL_LEAF_NODE","using_scheme":"CS_KERNEL_STOCKHAM_BLOCK_CC","solution_childnodes":[ {"child_token":"kernel_len64_double_sbcc","child_option":1} ]}
              ,{"sol_node_type":"SOL_LEAF_NODE","using_scheme":"CS_KERNEL_STOCKHAM_BLOCK_CC","solution_childnodes":[ {"child_token":"kernel_len64_double_sbcc","child_option":2} ]}
              ,{"sol_node_type":"SOL_LEAF_NODE","using_scheme":"CS_KERNEL_STOCKHAM_BLOCK_CC","solution_childnodes":[ {"child_token":"kernel_len64_double_sbcc","child_option":3} ]}
              ,{"sol_node_type":"SOL_LEAF_NODE","using_scheme":"CS_KERNEL_STOCKHAM_BLOCK_CC","solution_childnodes":[ {"child_token":"kernel_len64_double_sbcc","child_option":4} ]}
               ]},
{"Problem":{"arch":"gfx90a","token":"sbcc_64_sp_ip_complex"},
 "Solutions":[ {"sol_node_type":"SOL_LEAF_NODE","using_scheme":"CS_KERNEL_STOCKHAM_BLOCK_CC","solution_childnodes":[ {"child_token":"kernel_len64_single_sbcc","child_option":0} ]}
              ,{"sol_node_type":"SOL_LEAF_NODE","using_scheme":"CS_KERNEL_STOCKHAM_BLOCK_CC","solution_childnodes":[ {"child_token":"kernel_len64_single_sbcc","child_option":1} ]}
              ,{"sol_node_type":"SOL_LEAF_NODE","using_scheme":"CS_KERNEL_STOCKHAM_BLOCK_CC","solution_childnodes":[ {"child_token":"kernel_len64_single_sbcc","child_option":2} ]}
               ]},
{"Problem":{"arch":"gfx90a","token":"sbcc_72_sp_ip_complex"},
 "Solutions":[ {"sol_node_type":"SOL_LEAF_NODE","using_scheme":"CS_KERNEL_STOCKHAM_BLOCK_CC","solution_childnodes":[ {"child_token":"kernel_len72_single_sbcc","child_option":0} ]}
              ,{"sol_node_type":"SOL_LEAF_NODE","using_scheme":"CS_KERNEL_STOCKHAM_BLOCK_CC","solution_childnodes":[ {"child_token":"kernel_len72_single_sbcc","child_option":1} ]}
              ,{"sol_node_type":"SOL_LEAF_NODE","using_scheme":"CS_KERNEL_STOCKHAM_BLOCK_CC","solution_childnodes":[ {"child_token":"kernel_len72_single_sbcc","child_option":2} ]}
              ,{"sol_node_type":"SOL_LEAF_NODE","using_scheme":"CS_KERNEL_STOCKHAM_BLOCK_CC","solution_childnodes":[ {"child_token":"kernel_len72_single_sbcc","child_option":3} ]}
               ]},
{"Problem":{"arch":"gfx90a","token":"sbcc_80_sp_ip_complex"},
 "Solutions":[ {"sol_node_type":"SOL_LEAF_NODE","using_scheme":"CS_KERNEL_STOCKHAM_BLOCK_CC","solution_childnodes":[ {"child_token":"kernel_len80_single_sbcc","child_option":0} ]}
              ,{"sol_node_type":"SOL_LEAF_NODE","using_scheme":"CS_KERNEL_STOCKHAM_BLOCK_CC","solution_childnodes":[ {"child_token":"kernel_len80_single_sbcc","child_option":1} ]}
              ,{"sol_node_type":"SOL_LEAF_NODE","using_scheme":"CS_KERNEL_STOCKHAM_BLOCK_CC","solution_childnodes":[ {"child_token":"kernel_len80_single_sbcc","child_option":2} ]}
              ,{"sol_node_type":"SOL_LEAF_NODE","using_scheme":"CS_KERNEL_STOCKHAM_BLOCK_CC","solution_childnodes":[ {"child_token":"kernel_len80_single_sbcc","child_option":3} ]}
              ,{"sol_node_type":"SOL_LEAF_NODE","using_scheme":"CS_KERNEL_STOCKHAM_BLOCK_CC","solution_childnodes":[ {"child_token":"kernel_len80_single_sbcc","child_option":4} ]}
               ]},
{"Problem":{"arch":"gfx90a","token":"sbcc_81_dp_ip_complex"},
 "Solutions":[ {"sol_node_type":"SOL_LEAF_NODE","using_scheme":"CS_KERNEL_STOCKHAM_BLOCK_CC","solution_childnodes":[ {"child_token":"kernel_len81_double_sbcc","child_option":0} ]}
               ]},
{"Problem":{"arch":"gfx90a","token":"sbcc_81_sp_ip_complex"},
 "Solutions":[ {"sol_node_type":"SOL_LEAF_NODE","using_scheme":"CS_KERNEL_STOCKHAM_BLOCK_CC","solution_childnodes":[ {"child_token":"kernel_len81_single_sbcc","child_option":0} ]}
              ,{"sol_node_type":"SOL_LEAF_NODE","using_scheme":"CS_KERNEL_STOCKHAM_BLOCK_CC","solution_childnodes":[ {"child_token":"kernel_len81_single_sbcc","child_option":1} ]}
               ]},
{"Problem":{"arch":"gfx90a","token":"sbcc_84_sp_ip_complex"},
 "Solutions":[ {"sol_node_type":"SOL_LEAF_NODE","using_scheme":"CS_KERNEL_STOCKHAM_BLOCK_CC","solution_childnodes":[ {"child_token":"kernel_len84_single_sbcc","child_option":0} ]}
              ,{"sol_node_type":"SOL_LEAF_NODE","using_scheme":"CS_KERNEL_STOCKHAM_BLOCK_CC","solution_childnodes":[ {"child_token":"kernel_len84_single_sbcc","child_option":1} ]}
              ,{"sol_node_type":"SOL_LEAF_NODE","using_scheme":"CS_KERNEL_STOCKHAM_BLOCK_CC","solution_childnodes":[ {"child_token":"kernel_len84_single_sbcc","child_option":2} ]}
              ,{"sol_node_type":"SOL_LEAF_NODE","using_scheme":"CS_KERNEL_STOCKHAM_BLOCK_CC","solution_childnodes":[ {"child_token":"kernel_len84_single_sbcc","child_option":3} ]}
               ]},
{"Problem":{"arch":"gfx90a","token":"sbcc_96_dp_ip_complex"},
 "Solutions":[ {"sol_node_type":"SOL_LEAF_NODE","using_scheme":"CS_KERNEL_STOCKHAM_BLOCK_CC","solution_childnodes":[ {"child_token":"kernel_len96_double_sbcc","child_option":0} ]}
              ,{"sol_node_type":"SOL_LEAF_NODE","using_scheme":"CS_KERNEL_STOCKHAM_BLOCK_CC","solution_childnodes":[ {"child_token":"kernel_len96_double_sbcc","child_option":1} ]}
               ]},
{"Problem":{"arch":"gfx90a","token":"sbcc_96_sp_ip_complex"},
 "Solutions":[ {"sol_node_type":"SOL_LEAF_NODE","using_scheme":"CS_KERNEL_STOCKHAM_BLOCK_CC","solution_childnodes":[ {"child_token":"kernel_len96_single_sbcc","child_option":0} ]}
              ,{"sol_node_type":"SOL_LEAF_NODE","using_scheme":"CS_KERNEL_STOCKHAM_BLOCK_CC","solution_childnodes":[ {"child_token":"kernel_len96_single_sbcc","child_option":1} ]}
              ,{"sol_node_type":"SOL_LEAF_NODE","using_scheme":"CS_KERNEL_STOCKHAM_BLOCK_CC","solution_childnodes":[ {"child_token":"kernel_len96_single_sbcc","child_option":2} ]}
              ,{"sol_node_type":"SOL_LEAF_NODE","using_scheme":"CS_KERNEL_STOCKHAM_BLOCK_CC","solution_childnodes":[ {"child_token":"kernel_len96_single_sbcc","child_option":3} ]}
              ,{"sol_node_type":"SOL_LEAF_NODE","using_scheme":"CS_KERNEL_STOCKHAM_BLOCK_CC","solution_childnodes":[ {"child_token":"kernel_len96_single_sbcc","child_option":4} ]}
              ,{"sol_node_type":"SOL_LEAF_NODE","using_scheme":"CS_KERNEL_STOCKHAM_BLOCK_CC","solution_childnodes":[ {"child_token":"kernel_len96_single_sbcc","child_option":5} ]}
               ]},
{"Problem":{"arch":"gfx90a","token":"sbrc_100_dp_ip_complex"},
 "Solutions":[ {"sol_node_type":"SOL_LEAF_NODE","using_scheme":"CS_KERNEL_STOCKHAM_BLOCK_RC","solution_childnodes":[ {"child_token":"kernel_len100_double_sbrc","child_option":0} ]}
               ]},
{"Problem":{"arch":"gfx90a","token":"sbrc_112_dp_ip_complex"},
 "Solutions":[ {"sol_node_type":"SOL_LEAF_NODE","using_scheme":"CS_KERNEL_STOCKHAM_BLOCK_RC","solution_childnodes":[ {"child_token":"kernel_len112_double_sbrc","child_option":0} ]}
              ,{"sol_node_type":"SOL_LEAF_NODE","using_scheme":"CS_KERNEL_STOCKHAM_BLOCK_RC","solution_childnodes":[ {"child_token":"kernel_len112_double_sbrc","child_option":1} ]}
              ,{"sol_node_type":"SOL_LEAF_NODE","using_scheme":"CS_KERNEL_STOCKHAM_BLOCK_RC","solution_childnodes":[ {"child_token":"kernel_len112_double_sbrc","child_option":2} ]}
               ]},
{"Problem":{"arch":"gfx90a","token":"sbrc_125_dp_ip_complex"},
 "Solutions":[ {"sol_node_type":"SOL_LEAF_NODE","using_scheme":"CS_KERNEL_STOCKHAM_BLOCK_RC","solution_childnodes":[ {"child_token":"kernel_len125_double_sbrc","child_option":0} ]}
               ]},
{"Problem":{"arch":"gfx90a","token":"sbrc_128_dp_ip_complex"},
 "Solutions":[ {"sol_node_type":"SOL_LEAF_NODE","using_scheme":"CS_KERNEL_STOCKHAM_BLOCK_RC","solution_childnodes":[ {"child_token":"kernel_len128_double_sbrc","child_option":0} ]}
              ,{"sol_node_type":"SOL_LEAF_NODE","using_scheme":"CS_KERNEL_STOCKHAM_BLOCK_RC","solution_childnodes":[ {"child_token":"kernel_len128_double_sbrc","child_option":1} ]}
              ,{"sol_node_type":"SOL_LEAF_NODE","using_scheme":"CS_KERNEL_STOCKHAM_BLOCK_RC","solution_childnodes":[ {"child_token":"kernel_len128_double_sbrc","child_option":2} ]}
              ,{"sol_node_type":"SOL_LEAF_NODE","using_scheme":"CS_KERNEL_STOCKHAM_BLOCK_RC","solution_childnodes":[ {"child_token":"kernel_len128_double_sbrc","child_option":3} ]}
              ,{"sol_node_type":"SOL_LEAF_NODE","using_scheme":"CS_KERNEL_STOCKHAM_BLOCK_RC","solution_childnodes":[ {"child_token":"kernel_len128_double_sbrc","child_option":4} ]}
               ]},
{"Problem":{"arch":"gfx90a","token":"sbrc_192_dp_ip_complex"},
 "Solutions":[ {"sol_node_type":"SOL_LEAF_NODE","using_scheme":"CS_KERNEL_STOCKHAM_BLOCK_RC","solution_childnodes":[ {"child_token":"kernel_len192_double_sbrc","child_option":0} ]}
              ,{"sol_node_type":"SOL_LEAF_NODE","using_scheme":"CS_KERNEL_STOCKHAM_BLOCK_RC","solution_childnodes":[ {"child_token":"kernel_len192_double_sbrc","child_option":1} ]}
              ,{"sol_node_type":"SOL_LEAF_NODE","using_scheme":"CS_KERNEL_STOCKHAM_BLOCK_RC","solution_childnodes":[ {"child_token":"kernel_len192_double_sbrc","child_option":2} ]}
               ]},
{"Problem":{"arch":"gfx90a","token":"sbrc_256_dp_ip_complex"},
 "Solutions":[ {"sol_node_type":"SOL_LEAF_NODE","using_scheme":"CS_KERNEL_STOCKHAM_BLOCK_RC","solution_childnodes":[ {"child_token":"kernel_len256_double_sbrc","child_option":0} ]}
               ]},
{"Problem":{"arch":"gfx90a","token":"sbrc_49_dp_ip_complex"},
 "Solutions":[ {"sol_node_type":"SOL_LEAF_NODE","using_scheme":"CS_KERNEL_STOCKHAM_BLOCK_RC","solution_childnodes":[ {"child_token":"kernel_len49_double_sbrc","child_option":0} ]}
              ,{"sol_node_type":"SOL_LEAF_NODE","using_scheme":"CS_KERNEL_STOCKHAM_BLOCK_RC","solution_childnodes":[ {"child_token":"kernel_len49_double_sbrc","child_option":1} ]}
               ]},
{"Problem":{"arch":"gfx90a","token":"sbrc_81_dp_ip_complex"},
 "Solutions":[ {"sol_node_type":"SOL_LEAF_NODE","using_scheme":"CS_KERNEL_STOCKHAM_BLOCK_RC","solution_childnodes":[ {"child_token":"kernel_len81_double_sbrc","child_option":0} ]}
               ]},
{"Problem":{"arch":"gfx90a","token":"sbrc_81_sp_ip_complex"},
 "Solutions":[ {"sol_node_type":"SOL_LEAF_NODE","using_scheme":"CS_KERNEL_STOCKHAM_BLOCK_RC","solution_childnodes":[ {"child_token":"kernel_len81_single_sbrc","child_option":0} ]}
              ,{"sol_node_type":"SOL_LEAF_NODE","using_scheme":"CS_KERNEL_STOCKHAM_BLOCK_RC","solution_childnodes":[ {"child_token":"kernel_len81_single_sbrc","child_option":1} ]}
              ,{"sol_node_type":"SOL_LEAF_NODE","using_scheme":"CS_KERNEL_STOCKHAM_BLOCK_RC","solution_childnodes":[ {"child_token":"kernel_len81_single_sbrc","child_option":2} ]}
               ]},
{"Problem":{"arch":"gfx90a","token":"sbcr_336_dp_ip_complex"},
 "Solutions":[ {"sol_node_type":"SOL_LEAF_NODE","using_scheme":"CS_KERNEL_STOCKHAM_BLOCK_CR","solution_childnodes":[ {"child_token":"kernel_len336_double_sbcr","child_option":0} ]}
              ,{"sol_node_type":"SOL_LEAF_NODE","using_scheme":"CS_KERNEL_STOCKHAM_BLOCK_CR","solution_childnodes":[ {"child_token":"kernel_len336_double_sbcr","child_option":1} ]}
              ,{"sol_node_type":"SOL_LEAF_NODE","using_scheme":"CS_KERNEL_STOCKHAM_BLOCK_CR","solution_childnodes":[ {"child_token":"kernel_len336_double_sbcr","child_option":2} ]}
              ,{"sol_node_type":"SOL_LEAF_NODE","using_scheme":"CS_KERNEL_STOCKHAM_BLOCK_CR","solution_childnodes":[ {"child_token":"kernel_len336_double_sbcr","child_option":3} ]}
               ]},
{"Problem":{"arch":"gfx90a","token":"sbcr_56_dp_ip_complex"},
 "Solutions":[ {"sol_node_type":"SOL_LEAF_NODE","using_scheme":"CS_KERNEL_STOCKHAM_BLOCK_CR","solution_childnodes":[ {"child_token":"kernel_len56_double_sbcr","child_option":0} ]}
              ,{"sol_node_type":"SOL_LEAF_NODE","using_scheme":"CS_KERNEL_STOCKHAM_BLOCK_CR","solution_childnodes":[ {"child_token":"kernel_len56_double_sbcr","child_option":1} ]}
               ]},
{"Problem":{"arch":"gfx90a","token":"sbrc_xy_z_256_sp_ip_complex"},
 "Solutions":[ {"sol_node_type":"SOL_LEAF_NODE","using_scheme":"CS_KERNEL_STOCKHAM_TRANSPOSE_XY_Z","solution_childnodes":[ {"child_token":"kernel_len256_single_sbrc_xy_z","child_option":0} ]}
              ,{"sol_node_type":"SOL_LEAF_NODE","using_scheme":"CS_KERNEL_STOCKHAM_TRANSPOSE_XY_Z","solution_childnodes":[ {"child_token":"kernel_len256_single_sbrc_xy_z","child_option":1} ]}
               ]},
{"Problem":{"arch":"gfx90a","token":"leafnode_token_builtin_kernel"},
 "Solutions":[ {"sol_node_type":"SOL_LEAF_NODE","using_scheme":"CS_KERNEL_TRANSPOSE","solution_childnodes":[ {"child_token":"kernel_token_builtin_kernel","child_option":0} ]}
              ,{"sol_node_type":"SOL_LEAF_NODE","using_scheme":"CS_KERNEL_TRANSPOSE_XY_Z","solution_childnodes":[ {"child_token":"kernel_token_builtin_kernel","child_option":0} ]}
              ,{"sol_node_type":"SOL_LEAF_NODE","using_scheme":"CS_KERNEL_TRANSPOSE_Z_XY","solution_childnodes":[ {"child_token":"kernel_token_builtin_kernel","child_option":0} ]}
              ,{"sol_node_type":"SOL_LEAF_NODE","using_scheme":"CS_KERNEL_COPY_R_TO_CMPLX","solution_childnodes":[ {"child_token":"kernel_token_builtin_kernel","child_option":0} ]}
              ,{"sol_node_type":"SOL_LEAF_NODE","using_scheme":"CS_KERNEL_COPY_CMPLX_TO_HERM","solution_childnodes":[ {"child_token":"kernel_token_builtin_kernel","child_option":0} ]}
              ,{"sol_node_type":"SOL_LEAF_NODE","using_scheme":"CS_KERNEL_R_TO_CMPLX","solution_childnodes":[ {"child_token":"kernel_token_builtin_kernel","child_option":0} ]}
              ,{"sol_node_type":"SOL_LEAF_NODE","using_scheme":"CS_KERNEL_COPY_HERM_TO_CMPLX","solution_childnodes":[ {"child_token":"kernel_token_builtin_kernel","child_option":0} ]}
              ,{"sol_node_type":"SOL_LEAF_NODE","using_scheme":"CS_KERNEL_COPY_CMPLX_TO_R","solution_childnodes":[ {"child_token":"kernel_token_builtin_kernel","child_option":0} ]}
              ,{"sol_node_type":"SOL_LEAF_NODE","using_scheme":"CS_KERNEL_CMPLX_TO_R","solution_childnodes":[ {"child_token":"kernel_token_builtin_kernel","child_option":0} ]}
               ]},
{"Problem":{"arch":"gfx90a","token":"10_20_sp_ip_complex"},
 "Solutions":[ {"sol_node_type":"SOL_DUMMY","using_scheme":"CS_NONE","solution_childnodes":[  ]}
              ,{"sol_node_type":"SOL_LEAF_NODE","using_scheme":"CS_KERNEL_2D_SINGLE","solution_childnodes":[ {"child_token":"kernel_len10x20_single_2d_single","child_option":0} ]}
               ]},
{"Problem":{"arch":"gfx90a","token":"20_10_sp_ip_complex"},
 "Solutions":[ {"sol_node_type":"SOL_DUMMY","using_scheme":"CS_NONE","solution_childnodes":[  ]}
              ,{"sol_node_type":"SOL_LEAF_NODE","using_scheme":"CS_KERNEL_2D_SINGLE","solution_childnodes":[ {"child_token":"kernel_len20x10_single_2d_single","child_option":0} ]}
               ]},
{"Problem":{"arch":"gfx90a","token":"26_64_sp_ip_complex"},
 "Solutions":[ {"sol_node_type":"SOL_DUMMY","using_scheme":"CS_NONE","solution_childnodes":[  ]}
              ,{"sol_node_type":"SOL_LEAF_NODE","using_scheme":"CS_KERNEL_2D_SINGLE","solution_childnodes":[ {"child_token":"kernel_len26x64_single_2d_single","child_option":0} ]}
               ]},
{"Problem":{"arch":"gfx90a","token":"26_72_sp_ip_complex"},
 "Solutions":[ {"sol_node_type":"SOL_DUMMY","using_scheme":"CS_NONE","solution_childnodes":[  ]}
              ,{"sol_node_type":"SOL_LEAF_NODE","using_scheme":"CS_KERNEL_2D_SINGLE","solution_childnodes":[ {"child_token":"kernel_len26x72_single_2d_single","child_option":0} ]}
               ]},
{"Problem":{"arch":"gfx90a","token":"30_60_sp_ip_complex"},
 "Solutions":[ {"sol_node_type":"SOL_DUMMY","using_scheme":"CS_NONE","solution_childnodes":[  ]}
              ,{"sol_node_type":"SOL_LEAF_NODE","using_scheme":"CS_KERNEL_2D_SINGLE","solution_childnodes":[ {"child_token":"kernel_len30x60_single_2d_single","child_option":0} ]}
               ]},
{"Problem":{"arch":"gfx90a","token":"32_16_sp_ip_complex"},
 "Solutions":[ {"sol_node_type":"SOL_DUMMY","using_scheme":"CS_NONE","solution_childnodes":[  ]}
              ,{"sol_node_type":"SOL_LEAF_NODE","using_scheme":"CS_KERNEL_2D_SINGLE","solution_childnodes":[ {"child_token":"kernel_len32x16_single_2d_single","child_option":0} ]}
               ]},
{"Problem":{"arch":"gfx90a","token":"32_64_sp_ip_complex"},
 "Solutions":[ {"sol_node_type":"SOL_DUMMY","using_scheme":"CS_NONE","solution_childnodes":[  ]}
              ,{"sol_node_type":"SOL_LEAF_NODE","using_scheme":"CS_KERNEL_2D_SINGLE","solution_childnodes":[ {"child_token":"kernel_len32x64_single_2d_single","child_option":0} ]}
               ]},
{"Problem":{"arch":"gfx90a","token":"36_72_sp_ip_complex"},
 "Solutions":[ {"sol_node_type":"SOL_DUMMY","using_scheme":"CS_NONE","solution_childnodes":[  ]}
              ,{"sol_node_type":"SOL_LEAF_NODE","using_scheme":"CS_KERNEL_2D_SINGLE","solution_childnodes":[ {"child_token":"kernel_len36x72_single_2d_single","child_option":0} ]}
               ]},
{"Problem":{"arch":"gfx90a","token":"36_80_sp_ip_complex"},
 "Solutions":[ {"sol_node_type":"SOL_DUMMY","using_scheme":"CS_NONE","solution_childnodes":[  ]}
              ,{"sol_node_type":"SOL_LEAF_NODE","using_scheme":"CS_KERNEL_2D_SINGLE","solution_childnodes":[ {"child_token":"kernel_len36x80_single_2d_single","child_option":0} ]}
               ]},
{"Problem":{"arch":"gfx90a","token":"36_84_sp_ip_complex"},
 "Solutions":[ {"sol_node_type":"SOL_DUMMY","using_scheme":"CS_NONE","solution_childnodes":[  ]}
              ,{"sol_node_type":"SOL_LEAF_NODE","using_scheme":"CS_KERNEL_2D_SINGLE","solution_childnodes":[ {"child_token":"kernel_len36x84_single_2d_single","child_option":0} ]}
               ]},
{"Problem":{"arch":"gfx90a","token":"40_80_sp_ip_complex"},
 "Solutions":[ {"sol_node_type":"SOL_DUMMY","using_scheme":"CS_NONE","solution_childnodes":[  ]}
              ,{"sol_node_type":"SOL_LEAF_NODE","using_scheme":"CS_KERNEL_2D_SINGLE","solution_childnodes":[ {"child_token":"kernel_len40x80_single_2d_single","child_option":0} ]}
               ]},
{"Problem":{"arch":"gfx90a","token":"42_84_sp_ip_complex"},
 "Solutions":[ {"sol_node_type":"SOL_DUMMY","using_scheme":"CS_NONE","solution_childnodes":[  ]}
              ,{"sol_node_type":"SOL_LEAF_NODE","using_scheme":"CS_KERNEL_2D_SINGLE","solution_childnodes":[ {"child_token":"kernel_len42x84_single_2d_single","child_option":0} ]}
               ]},
{"Problem":{"arch":"gfx90a","token":"42_96_sp_ip_complex"},
 "Solutions":[ {"sol_node_type":"SOL_DUMMY","using_scheme":"CS_NONE","solution_childnodes":[  ]}
              ,{"sol_node_type":"SOL_LEAF_NODE","using_scheme":"CS_KERNEL_2D_SINGLE","solution_childnodes":[ {"child_token":"kernel_len42x96_single_2d_single","child_option":0} ]}
               ]},
{"Problem":{"arch":"gfx90a","token":"60_30_sp_ip_complex"},
 "Solutions":[ {"sol_node_type":"SOL_DUMMY","using_scheme":"CS_NONE","solution_childnodes":[  ]}
              ,{"sol_node_type":"SOL_LEAF_NODE","using_scheme":"CS_KERNEL_2D_SINGLE","solution_childnodes":[ {"child_token":"kernel_len60x30_single_2d_single","child_option":0} ]}
               ]},
{"Problem":{"arch":"gfx90a","token":"64_26_sp_ip_complex"},
 "Solutions":[ {"sol_node_type":"SOL_DUMMY","using_scheme":"CS_NONE","solution_childnodes":[  ]}
              ,{"sol_node_type":"SOL_LEAF_NODE","using_scheme":"CS_KERNEL_2D_SINGLE","solution_childnodes":[ {"child_token":"kernel_len64x26_single_2d_single","child_option":0} ]}
               ]},
{"Problem":{"arch":"gfx90a","token":"64_32_sp_ip_complex"},
 "Solutions":[ {"sol_node_type":"SOL_DUMMY","using_scheme":"CS_NONE","solution_childnodes":[  ]}
              ,{"sol_node_type":"SOL_LEAF_NODE","using_scheme":"CS_KERNEL_2D_SINGLE","solution_childnodes":[ {"child_token":"kernel_len64x32_single_2d_single","child_option":0} ]}
               ]},
{"Problem":{"arch":"gfx90a","token":"72_26_sp_ip_complex"},
 "Solutions":[ {"sol_node_type":"SOL_DUMMY","using_scheme":"CS_NONE","solution_childnodes":[  ]}
              ,{"sol_node_type":"SOL_LEAF_NODE","using_scheme":"CS_KERNEL_2D_SINGLE","solution_childnodes":[ {"child_token":"kernel_len72x26_single_2d_single","child_option":0} ]}
               ]},
{"Problem":{"arch":"gfx90a","token":"72_36_sp_ip_complex"},
 "Solutions":[ {"sol_node_type":"SOL_DUMMY","using_scheme":"CS_NONE","solution_childnodes":[  ]}
              ,{"sol_node_type":"SOL_LEAF_NODE","using_scheme":"CS_KERNEL_2D_SINGLE","solution_childnodes":[ {"child_token":"kernel_len72x36_single_2d_single","child_option":0} ]}
               ]},
{"Problem":{"arch":"gfx90a","token":"80_36_sp_ip_complex"},
 "Solutions":[ {"sol_node_type":"SOL_DUMMY","using_scheme":"CS_NONE","solution_childnodes":[  ]}
              ,{"sol_node_type":"SOL_LEAF_NODE","using_scheme":"CS_KERNEL_2D_SINGLE","solution_childnodes":[ {"child_token":"kernel_len80x36_single_2d_single","child_option":0} ]}
               ]},
{"Problem":{"arch":"gfx90a","token":"80_40_sp_ip_complex"},
 "Solutions":[ {"sol_node_type":"SOL_DUMMY","using_scheme":"CS_NONE","solution_childnodes":[  ]}
              ,{"sol_node_type":"SOL_LEAF_NODE","using_scheme":"CS_KERNEL_2D_SINGLE","solution_childnodes":[ {"child_token":"kernel_len80x40_single_2d_single","child_option":0} ]}
               ]},
{"Problem":{"arch":"gfx90a","token":"84_36_sp_ip_complex"},
 "Solutions":[ {"sol_node_type":"SOL_DUMMY","using_scheme":"CS_NONE","solution_childnodes":[  ]}
              ,{"sol_node_type":"SOL_LEAF_NODE","using_scheme":"CS_KERNEL_2D_SINGLE","solution_childnodes":[ {"child_token":"kernel_len84x36_single_2d_single","child_option":0} ]}
               ]},
{"Problem":{"arch":"gfx90a","token":"84_42_sp_ip_complex"},
 "Solutions":[ {"sol_node_type":"SOL_DUMMY","using_scheme":"CS_NONE","solution_childnodes":[  ]}
              ,{"sol_node_type":"SOL_LEAF_NODE","using_scheme":"CS_KERNEL_2D_SINGLE","solution_childnodes":[ {"child_token":"kernel_len84x42_single_2d_single","child_option":0} ]}
               ]},
{"Problem":{"arch":"gfx90a","token":"84_7_sp_ip_complex"},
 "Solutions":[ {"sol_node_type":"SOL_DUMMY","using_scheme":"CS_NONE","solution_childnodes":[  ]}
              ,{"sol_node_type":"SOL_LEAF_NODE","using_scheme":"CS_KERNEL_2D_SINGLE","solution_childnodes":[ {"child_token":"kernel_len84x7_single_2d_single","child_option":0} ]}
               ]},
{"Problem":{"arch":"gfx90a","token":"96_42_sp_ip_complex"},
 "Solutions":[ {"sol_node_type":"SOL_DUMMY","using_scheme":"CS_NONE","solution_childnodes":[  ]}
              ,{"sol_node_type":"SOL_LEAF_NODE","using_scheme":"CS_KERNEL_2D_SINGLE","solution_childnodes":[ {"child_token":"kernel_len96x42_single_2d_single","child_option":0} ]}
               ]},
{"Problem":{"arch":"gfx90a","token":"16807_dp_ip_real_bwd"},
 "Solutions":[ {"sol_node_type":"SOL_INTERNAL_NODE","using_scheme":"CS_REAL_TRANSFORM_USING_CMPLX","solution_childnodes":[ {"child_token":"leafnode_token_builtin_kernel","child_option":6},{"child_token":"16807_dp_ip_complex","child_option":1},{"child_token":"leafnode_token_builtin_kernel","child_option":7} ]}
               ]},
{"Problem":{"arch":"gfx90a","token":"16807_dp_op_real_bwd"},
 "Solutions":[ {"sol_node_type":"SOL_INTERNAL_NODE","using_scheme":"CS_REAL_TRANSFORM_USING_CMPLX","solution_childnodes":[ {"child_token":"leafnode_token_builtin_kernel","child_option":6},{"child_token":"16807_dp_ip_complex","child_option":1},{"child_token":"leafnode_token_builtin_kernel","child_option":7} ]}
               ]},
{"Problem":{"arch":"gfx90a","token":"243_dp_ip_real_bwd"},
 "Solutions":[ {"sol_node_type":"SOL_INTERNAL_NODE","using_scheme":"CS_REAL_TRANSFORM_USING_CMPLX","solution_childnodes":[ {"child_token":"leafnode_token_builtin_kernel","child_option":6},{"child_token":"243_dp_ip_complex","child_option":4},{"child_token":"leafnode_token_builtin_kernel","child_option":7} ]}
               ]},
{"Problem":{"arch":"gfx90a","token":"243_dp_ip_real_fwd"},
 "Solutions":[ {"sol_node_type":"SOL_INTERNAL_NODE","using_scheme":"CS_REAL_TRANSFORM_USING_CMPLX","solution_childnodes":[ {"child_token":"leafnode_token_builtin_kernel","child_option":3},{"child_token":"243_dp_ip_complex","child_option":3},{"child_token":"leafnode_token_builtin_kernel","child_option":4} ]}
               ]},
{"Problem":{"arch":"gfx90a","token":"243_dp_op_real_fwd"},
 "Solutions":[ {"sol_node_type":"SOL_INTERNAL_NODE","using_scheme":"CS_REAL_TRANSFORM_USING_CMPLX","solution_childnodes":[ {"child_token":"leafnode_token_builtin_kernel","child_option":3},{"child_token":"243_dp_ip_complex","child_option":1},{"child_token":"leafnode_token_builtin_kernel","child_option":4} ]}
               ]},
{"Problem":{"arch":"gfx90a","token":"55_55_75_dp_op_real_bwd"},
 "Solutions":[ {"sol_node_type":"SOL_INTERNAL_NODE","using_scheme":"CS_REAL_TRANSFORM_USING_CMPLX","solution_childnodes":[ {"child_token":"leafnode_token_builtin_kernel","child_option":6},{"child_token":"55_55_75_dp_ip_complex","child_option":1},{"child_token":"leafnode_token_builtin_kernel","child_option":7} ]}
               ]},
{"Problem":{"arch":"gfx90a","token":"55_55_75_sp_op_real_bwd"},
 "Solutions":[ {"sol_node_type":"SOL_INTERNAL_NODE","using_scheme":"CS_REAL_TRANSFORM_USING_CMPLX","solution_childnodes":[ {"child_token":"leafnode_token_builtin_kernel","child_option":6},{"child_token":"55_55_75_sp_ip_complex","child_option":2},{"child_token":"leafnode_token_builtin_kernel","child_option":7} ]}
               ]},
{"Problem":{"arch":"gfx90a","token":"55_55_75_sp_op_real_fwd"},
 "Solutions":[ {"sol_node_type":"SOL_INTERNAL_NODE","using_scheme":"CS_REAL_TRANSFORM_USING_CMPLX","solution_childnodes":[ {"child_token":"leafnode_token_builtin_kernel","child_option":3},{"child_token":"55_55_75_sp_ip_complex","child_option":1},{"child_token":"leafnode_token_builtin_kernel","child_option":4} ]}
               ]},
{"Problem":{"arch":"gfx90a","token":"55_55_dp_op_real_bwd"},
 "Solutions":[ {"sol_node_type":"SOL_INTERNAL_NODE","using_scheme":"CS_REAL_TRANSFORM_USING_CMPLX","solution_childnodes":[ {"child_token":"leafnode_token_builtin_kernel","child_option":6},{"child_token":"55_55_dp_ip_complex","child_option":1},{"child_token":"leafnode_token_builtin_kernel","child_option":7} ]}
               ]},
{"Problem":{"arch":"gfx90a","token":"100_sp_ip_complex"},
 "Solutions":[ {"sol_node_type":"SOL_DUMMY","using_scheme":"CS_NONE","solution_childnodes":[  ]}
              ,{"sol_node_type":"SOL_INTERNAL_NODE","using_scheme":"CS_REAL_TRANSFORM_EVEN","solution_childnodes":[ {"child_token":"50_sp_ip_complex","child_option":1} ]}
              ,{"sol_node_type":"SOL_INTERNAL_NODE","using_scheme":"CS_REAL_TRANSFORM_EVEN","solution_childnodes":[ {"child_token":"50_sp_ip_complex","child_option":3} ]}
              ,{"sol_node_type":"SOL_LEAF_NODE","using_scheme":"CS_KERNEL_STOCKHAM","solution_childnodes":[ {"child_token":"kernel_len100_single_sbrr","child_option":0} ]}
              ,{"sol_node_type":"SOL_LEAF_NODE","using_scheme":"CS_KERNEL_STOCKHAM","solution_childnodes":[ {"child_token":"kernel_len100_single_sbrr","child_option":1} ]}
              ,{"sol_node_type":"SOL_LEAF_NODE","using_scheme":"CS_KERNEL_STOCKHAM","solution_childnodes":[ {"child_token":"kernel_len100_single_sbrr","child_option":2} ]}
              ,{"sol_node_type":"SOL_INTERNAL_NODE","using_scheme":"CS_REAL_TRANSFORM_EVEN","solution_childnodes":[ {"child_token":"50_sp_ip_complex","child_option":6} ]}
               ]},
{"Problem":{"arch":"gfx90a","token":"101_sp_ip_complex"},
 "Solutions":[ {"sol_node_type":"SOL_DUMMY","using_scheme":"CS_NONE","solution_childnodes":[  ]}
              ,{"sol_node_type":"SOL_INTERNAL_NODE","using_scheme":"CS_REAL_TRANSFORM_EVEN","solution_childnodes":[ {"child_token":"100_sp_ip_complex","child_option":4} ]}
               ]},
{"Problem":{"arch":"gfx90a","token":"104_dp_ip_complex"},
 "Solutions":[ {"sol_node_type":"SOL_DUMMY","using_scheme":"CS_NONE","solution_childnodes":[  ]}
              ,{"sol_node_type":"SOL_INTERNAL_NODE","using_scheme":"CS_REAL_TRANSFORM_EVEN","solution_childnodes":[ {"child_token":"52_dp_ip_complex","child_option":2} ]}
               ]},
{"Problem":{"arch":"gfx90a","token":"104_sp_ip_complex"},
 "Solutions":[ {"sol_node_type":"SOL_DUMMY","using_scheme":"CS_NONE","solution_childnodes":[  ]}
              ,{"sol_node_type":"SOL_INTERNAL_NODE","using_scheme":"CS_REAL_TRANSFORM_EVEN","solution_childnodes":[ {"child_token":"52_sp_ip_complex","child_option":1} ]}
               ]},
{"Problem":{"arch":"gfx90a","token":"109_sp_ip_complex"},
 "Solutions":[ {"sol_node_type":"SOL_DUMMY","using_scheme":"CS_NONE","solution_childnodes":[  ]}
              ,{"sol_node_type":"SOL_INTERNAL_NODE","using_scheme":"CS_REAL_TRANSFORM_EVEN","solution_childnodes":[ {"child_token":"108_sp_ip_complex","child_option":4} ]}
               ]},
{"Problem":{"arch":"gfx90a","token":"113_sp_ip_complex"},
 "Solutions":[ {"sol_node_type":"SOL_DUMMY","using_scheme":"CS_NONE","solution_childnodes":[  ]}
              ,{"sol_node_type":"SOL_INTERNAL_NODE","using_scheme":"CS_REAL_TRANSFORM_EVEN","solution_childnodes":[ {"child_token":"112_sp_ip_complex","child_option":3} ]}
               ]},
{"Problem":{"arch":"gfx90a","token":"129_sp_ip_complex"},
 "Solutions":[ {"sol_node_type":"SOL_DUMMY","using_scheme":"CS_NONE","solution_childnodes":[  ]}
              ,{"sol_node_type":"SOL_INTERNAL_NODE","using_scheme":"CS_REAL_TRANSFORM_EVEN","solution_childnodes":[ {"child_token":"128_sp_ip_complex","child_option":1} ]}
               ]},
{"Problem":{"arch":"gfx90a","token":"144_sp_ip_complex"},
 "Solutions":[ {"sol_node_type":"SOL_DUMMY","using_scheme":"CS_NONE","solution_childnodes":[  ]}
              ,{"sol_node_type":"SOL_INTERNAL_NODE","using_scheme":"CS_REAL_TRANSFORM_EVEN","solution_childnodes":[ {"child_token":"72_sp_ip_complex","child_option":1} ]}
               ]},
{"Problem":{"arch":"gfx90a","token":"16384_dp_ip_real_bwd"},
 "Solutions":[ {"sol_node_type":"SOL_INTERNAL_NODE","using_scheme":"CS_REAL_TRANSFORM_EVEN","solution_childnodes":[ {"child_token":"leafnode_token_builtin_kernel","child_option":8},{"child_token":"8192_dp_ip_complex","child_option":3} ]}
               ]},
{"Problem":{"arch":"gfx90a","token":"16384_dp_ip_real_fwd"},
 "Solutions":[ {"sol_node_type":"SOL_INTERNAL_NODE","using_scheme":"CS_REAL_TRANSFORM_EVEN","solution_childnodes":[ {"child_token":"8192_dp_ip_complex","child_option":1},{"child_token":"leafnode_token_builtin_kernel","child_option":5} ]}
               ]},
{"Problem":{"arch":"gfx90a","token":"16384_dp_op_real_fwd"},
 "Solutions":[ {"sol_node_type":"SOL_INTERNAL_NODE","using_scheme":"CS_REAL_TRANSFORM_EVEN","solution_childnodes":[ {"child_token":"8192_dp_ip_complex","child_option":2},{"child_token":"leafnode_token_builtin_kernel","child_option":5} ]}
               ]},
{"Problem":{"arch":"gfx90a","token":"168_sp_ip_complex"},
 "Solutions":[ {"sol_node_type":"SOL_DUMMY","using_scheme":"CS_NONE","solution_childnodes":[  ]}
              ,{"sol_node_type":"SOL_INTERNAL_NODE","using_scheme":"CS_REAL_TRANSFORM_EVEN","solution_childnodes":[ {"child_token":"84_sp_ip_complex","child_option":1} ]}
              ,{"sol_node_type":"SOL_INTERNAL_NODE","using_scheme":"CS_REAL_TRANSFORM_EVEN","solution_childnodes":[ {"child_token":"84_sp_ip_complex","child_option":3} ]}
               ]},
{"Problem":{"arch":"gfx90a","token":"200_dp_ip_complex"},
 "Solutions":[ {"sol_node_type":"SOL_DUMMY","using_scheme":"CS_NONE","solution_childnodes":[  ]}
              ,{"sol_node_type":"SOL_INTERNAL_NODE","using_scheme":"CS_REAL_TRANSFORM_EVEN","solution_childnodes":[ {"child_token":"100_dp_ip_complex","child_option":2} ]}
               ]},
{"Problem":{"arch":"gfx90a","token":"200_sp_ip_complex"},
 "Solutions":[ {"sol_node_type":"SOL_DUMMY","using_scheme":"CS_NONE","solution_childnodes":[  ]}
              ,{"sol_node_type":"SOL_INTERNAL_NODE","using_scheme":"CS_REAL_TRANSFORM_EVEN","solution_childnodes":[ {"child_token":"100_sp_ip_complex","child_option":3} ]}
              ,{"sol_node_type":"SOL_INTERNAL_NODE","using_scheme":"CS_REAL_TRANSFORM_EVEN","solution_childnodes":[ {"child_token":"100_sp_ip_complex","child_option":5} ]}
               ]},
{"Problem":{"arch":"gfx90a","token":"216_sp_ip_complex"},
 "Solutions":[ {"sol_node_type":"SOL_DUMMY","using_scheme":"CS_NONE","solution_childnodes":[  ]}
              ,{"sol_node_type":"SOL_INTERNAL_NODE","using_scheme":"CS_REAL_TRANSFORM_EVEN","solution_childnodes":[ {"child_token":"108_sp_ip_complex","child_option":3} ]}
               ]},
{"Problem":{"arch":"gfx90a","token":"224_sp_ip_complex"},
 "Solutions":[ {"sol_node_type":"SOL_DUMMY","using_scheme":"CS_NONE","solution_childnodes":[  ]}
              ,{"sol_node_type":"SOL_INTERNAL_NODE","using_scheme":"CS_REAL_TRANSFORM_EVEN","solution_childnodes":[ {"child_token":"112_sp_ip_complex","child_option":2} ]}
               ]},
{"Problem":{"arch":"gfx90a","token":"256_sp_ip_complex"},
 "Solutions":[ {"sol_node_type":"SOL_DUMMY","using_scheme":"CS_NONE","solution_childnodes":[  ]}
              ,{"sol_node_type":"SOL_LEAF_NODE","using_scheme":"CS_KERNEL_STOCKHAM","solution_childnodes":[ {"child_token":"kernel_len256_single_sbrr","child_option":0} ]}
              ,{"sol_node_type":"SOL_INTERNAL_NODE","using_scheme":"CS_REAL_TRANSFORM_EVEN","solution_childnodes":[ {"child_token":"128_sp_ip_complex","child_option":1} ]}
              ,{"sol_node_type":"SOL_INTERNAL_NODE","using_scheme":"CS_REAL_TRANSFORM_EVEN","solution_childnodes":[ {"child_token":"128_sp_ip_complex","child_option":3} ]}
               ]},
{"Problem":{"arch":"gfx90a","token":"486_dp_ip_real_bwd"},
 "Solutions":[ {"sol_node_type":"SOL_INTERNAL_NODE","using_scheme":"CS_REAL_TRANSFORM_EVEN","solution_childnodes":[ {"child_token":"243_dp_ip_complex","child_option":5} ]}
               ]},
{"Problem":{"arch":"gfx90a","token":"486_dp_ip_real_fwd"},
 "Solutions":[ {"sol_node_type":"SOL_INTERNAL_NODE","using_scheme":"CS_REAL_TRANSFORM_EVEN","solution_childnodes":[ {"child_token":"243_dp_ip_complex","child_option":2} ]}
               ]},
{"Problem":{"arch":"gfx90a","token":"486_dp_op_real_bwd"},
 "Solutions":[ {"sol_node_type":"SOL_INTERNAL_NODE","using_scheme":"CS_REAL_TRANSFORM_EVEN","solution_childnodes":[ {"child_token":"243_dp_ip_complex","child_option":6} ]}
               ]},
{"Problem":{"arch":"gfx90a","token":"486_dp_op_real_fwd"},
 "Solutions":[ {"sol_node_type":"SOL_INTERNAL_NODE","using_scheme":"CS_REAL_TRANSFORM_EVEN","solution_childnodes":[ {"child_token":"243_dp_ip_complex","child_option":2} ]}
               ]},
{"Problem":{"arch":"gfx90a","token":"49_sp_ip_complex"},
 "Solutions":[ {"sol_node_type":"SOL_DUMMY","using_scheme":"CS_NONE","solution_childnodes":[  ]}
              ,{"sol_node_type":"SOL_INTERNAL_NODE","using_scheme":"CS_REAL_TRANSFORM_EVEN","solution_childnodes":[ {"child_token":"48_sp_ip_complex","child_option":4} ]}
              ,{"sol_node_type":"SOL_INTERNAL_NODE","using_scheme":"CS_REAL_TRANSFORM_EVEN","solution_childnodes":[ {"child_token":"48_sp_ip_complex","child_option":2} ]}
              ,{"sol_node_type":"SOL_INTERNAL_NODE","using_scheme":"CS_REAL_TRANSFORM_EVEN","solution_childnodes":[ {"child_token":"48_sp_ip_complex","child_option":3} ]}
               ]},
{"Problem":{"arch":"gfx90a","token":"51_dp_ip_complex"},
 "Solutions":[ {"sol_node_type":"SOL_DUMMY","using_scheme":"CS_NONE","solution_childnodes":[  ]}
              ,{"sol_node_type":"SOL_INTERNAL_NODE","using_scheme":"CS_REAL_TRANSFORM_EVEN","solution_childnodes":[ {"child_token":"50_dp_ip_complex","child_option":2} ]}
               ]},
{"Problem":{"arch":"gfx90a","token":"51_sp_ip_complex"},
 "Solutions":[ {"sol_node_type":"SOL_DUMMY","using_scheme":"CS_NONE","solution_childnodes":[  ]}
              ,{"sol_node_type":"SOL_INTERNAL_NODE","using_scheme":"CS_REAL_TRANSFORM_EVEN","solution_childnodes":[ {"child_token":"50_sp_ip_complex","child_option":2} ]}
              ,{"sol_node_type":"SOL_INTERNAL_NODE","using_scheme":"CS_REAL_TRANSFORM_EVEN","solution_childnodes":[ {"child_token":"50_sp_ip_complex","child_option":4} ]}
              ,{"sol_node_type":"SOL_INTERNAL_NODE","using_scheme":"CS_REAL_TRANSFORM_EVEN","solution_childnodes":[ {"child_token":"50_sp_ip_complex","child_option":5} ]}
               ]},
{"Problem":{"arch":"gfx90a","token":"53_dp_ip_complex"},
 "Solutions":[ {"sol_node_type":"SOL_DUMMY","using_scheme":"CS_NONE","solution_childnodes":[  ]}
              ,{"sol_node_type":"SOL_INTERNAL_NODE","using_scheme":"CS_REAL_TRANSFORM_EVEN","solution_childnodes":[ {"child_token":"52_dp_ip_complex","child_option":3} ]}
               ]},
{"Problem":{"arch":"gfx90a","token":"57_sp_ip_complex"},
 "Solutions":[ {"sol_node_type":"SOL_DUMMY","using_scheme":"CS_NONE","solution_childnodes":[  ]}
              ,{"sol_node_type":"SOL_INTERNAL_NODE","using_scheme":"CS_REAL_TRANSFORM_EVEN","solution_childnodes":[ {"child_token":"56_sp_ip_complex","child_option":2} ]}
               ]},
{"Problem":{"arch":"gfx90a","token":"65_sp_ip_complex"},
 "Solutions":[ {"sol_node_type":"SOL_DUMMY","using_scheme":"CS_NONE","solution_childnodes":[  ]}
              ,{"sol_node_type":"SOL_INTERNAL_NODE","using_scheme":"CS_REAL_TRANSFORM_EVEN","solution_childnodes":[ {"child_token":"64_sp_ip_complex","child_option":2} ]}
               ]},
{"Problem":{"arch":"gfx90a","token":"73_sp_ip_complex"},
 "Solutions":[ {"sol_node_type":"SOL_DUMMY","using_scheme":"CS_NONE","solution_childnodes":[  ]}
              ,{"sol_node_type":"SOL_INTERNAL_NODE","using_scheme":"CS_REAL_TRANSFORM_EVEN","solution_childnodes":[ {"child_token":"72_sp_ip_complex","child_option":2} ]}
               ]},
{"Problem":{"arch":"gfx90a","token":"80_sp_ip_complex"},
 "Solutions":[ {"sol_node_type":"SOL_DUMMY","using_scheme":"CS_NONE","solution_childnodes":[  ]}
              ,{"sol_node_type":"SOL_INTERNAL_NODE","using_scheme":"CS_REAL_TRANSFORM_EVEN","solution_childnodes":[ {"child_token":"40_sp_ip_complex","child_option":1} ]}
               ]},
{"Problem":{"arch":"gfx90a","token":"85_sp_ip_complex"},
 "Solutions":[ {"sol_node_type":"SOL_DUMMY","using_scheme":"CS_NONE","solution_childnodes":[  ]}
              ,{"sol_node_type":"SOL_INTERNAL_NODE","using_scheme":"CS_REAL_TRANSFORM_EVEN","solution_childnodes":[ {"child_token":"84_sp_ip_complex","child_option":2} ]}
              ,{"sol_node_type":"SOL_INTERNAL_NODE","using_scheme":"CS_REAL_TRANSFORM_EVEN","solution_childnodes":[ {"child_token":"84_sp_ip_complex","child_option":4} ]}
               ]},
{"Problem":{"arch":"gfx90a","token":"96_sp_ip_complex"},
 "Solutions":[ {"sol_node_type":"SOL_DUMMY","using_scheme":"CS_NONE","solution_childnodes":[  ]}
              ,{"sol_node_type":"SOL_LEAF_NODE","using_scheme":"CS_KERNEL_STOCKHAM","solution_childnodes":[ {"child_token":"kernel_len96_single_sbrr","child_option":0} ]}
              ,{"sol_node_type":"SOL_LEAF_NODE","using_scheme":"CS_KERNEL_STOCKHAM","solution_childnodes":[ {"child_token":"kernel_len96_single_sbrr","child_option":1} ]}
              ,{"sol_node_type":"SOL_LEAF_NODE","using_scheme":"CS_KERNEL_STOCKHAM","solution_childnodes":[ {"child_token":"kernel_len96_single_sbrr","child_option":2} ]}
              ,{"sol_node_type":"SOL_LEAF_NODE","using_scheme":"CS_KERNEL_STOCKHAM","solution_childnodes":[ {"child_token":"kernel_len96_single_sbrr","child_option":3} ]}
              ,{"sol_node_type":"SOL_LEAF_NODE","using_scheme":"CS_KERNEL_STOCKHAM","solution_childnodes":[ {"child_token":"kernel_len96_single_sbrr","child_option":4} ]}
              ,{"sol_node_type":"SOL_LEAF_NODE","using_scheme":"CS_KERNEL_STOCKHAM","solution_childnodes":[ {"child_token":"kernel_len96_single_sbrr","child_option":5} ]}
              ,{"sol_node_type":"SOL_LEAF_NODE","using_scheme":"CS_KERNEL_STOCKHAM","solution_childnodes":[ {"child_token":"kernel_len96_single_sbrr","child_option":6} ]}
              ,{"sol_node_type":"SOL_LEAF_NODE","using_scheme":"CS_KERNEL_STOCKHAM","solution_childnodes":[ {"child_token":"kernel_len96_single_sbrr","child_option":7} ]}
              ,{"sol_node_type":"SOL_INTERNAL_NODE","using_scheme":"CS_REAL_TRANSFORM_EVEN","solution_childnodes":[ {"child_token":"48_sp_ip_complex","child_option":1} ]}
              ,{"sol_node_type":"SOL_INTERNAL_NODE","using_scheme":"CS_REAL_TRANSFORM_EVEN","solution_childnodes":[ {"child_token":"48_sp_ip_complex","child_option":2} ]}
               ]},
{"Problem":{"arch":"gfx90a","token":"97_sp_ip_complex"},
 "Solutions":[ {"sol_node_type":"SOL_DUMMY","using_scheme":"CS_NONE","solution_childnodes":[  ]}
              ,{"sol_node_type":"SOL_INTERNAL_NODE","using_scheme":"CS_REAL_TRANSFORM_EVEN","solution_childnodes":[ {"child_token":"96_sp_ip_complex","child_option":2} ]}
              ,{"sol_node_type":"SOL_INTERNAL_NODE","using_scheme":"CS_REAL_TRANSFORM_EVEN","solution_childnodes":[ {"child_token":"96_sp_ip_complex","child_option":4} ]}
              ,{"sol_node_type":"SOL_INTERNAL_NODE","using_scheme":"CS_REAL_TRANSFORM_EVEN","solution_childnodes":[ {"child_token":"96_sp_ip_complex","child_option":6} ]}
              ,{"sol_node_type":"SOL_INTERNAL_NODE","using_scheme":"CS_REAL_TRANSFORM_EVEN","solution_childnodes":[ {"child_token":"96_sp_ip_complex","child_option":8} ]}
               ]},
{"Problem":{"arch":"gfx90a","token":"52_26_dp_op_real_fwd"},
 "Solutions":[ {"sol_node_type":"SOL_INTERNAL_NODE","using_scheme":"CS_REAL_2D_EVEN","solution_childnodes":[ {"child_token":"52_dp_ip_complex","child_option":1},{"child_token":"26_dp_ip_complex","child_option":2} ]}
               ]},
{"Problem":{"arch":"gfx90a","token":"100_100_100_dp_op_real_bwd"},
 "Solutions":[ {"sol_node_type":"SOL_INTERNAL_NODE","using_scheme":"CS_REAL_3D_EVEN","solution_childnodes":[ {"child_token":"sbcc_100_dp_ip_complex","child_option":3},{"child_token":"sbcc_100_dp_ip_complex","child_option":4},{"child_token":"51_dp_ip_complex","child_option":1} ]}
               ]},
{"Problem":{"arch":"gfx90a","token":"100_100_100_dp_op_real_fwd"},
 "Solutions":[ {"sol_node_type":"SOL_INTERNAL_NODE","using_scheme":"CS_REAL_3D_EVEN","solution_childnodes":[ {"child_token":"100_dp_ip_complex","child_option":1},{"child_token":"sbcc_100_dp_ip_complex","child_option":1},{"child_token":"sbcc_100_dp_ip_complex","child_option":2} ]}
               ]},
{"Problem":{"arch":"gfx90a","token":"100_100_100_sp_op_real_bwd"},
 "Solutions":[ {"sol_node_type":"SOL_INTERNAL_NODE","using_scheme":"CS_REAL_3D_EVEN","solution_childnodes":[ {"child_token":"sbcc_100_sp_ip_complex","child_option":2},{"child_token":"sbcc_100_sp_ip_complex","child_option":3},{"child_token":"51_sp_ip_complex","child_option":1} ]}
               ]},
{"Problem":{"arch":"gfx90a","token":"100_100_100_sp_op_real_fwd"},
 "Solutions":[ {"sol_node_type":"SOL_INTERNAL_NODE","using_scheme":"CS_REAL_3D_EVEN","solution_childnodes":[ {"child_token":"100_sp_ip_complex","child_option":1},{"child_token":"sbcc_100_sp_ip_complex","child_option":0},{"child_token":"sbcc_100_sp_ip_complex","child_option":1} ]}
               ]},
{"Problem":{"arch":"gfx90a","token":"100_100_208_sp_op_real_bwd"},
 "Solutions":[ {"sol_node_type":"SOL_INTERNAL_NODE","using_scheme":"CS_REAL_3D_EVEN","solution_childnodes":[ {"child_token":"sbcc_208_sp_ip_complex","child_option":2},{"child_token":"sbcc_100_sp_ip_complex","child_option":3},{"child_token":"51_sp_ip_complex","child_option":3} ]}
               ]},
{"Problem":{"arch":"gfx90a","token":"100_100_208_sp_op_real_fwd"},
 "Solutions":[ {"sol_node_type":"SOL_INTERNAL_NODE","using_scheme":"CS_REAL_3D_EVEN","solution_childnodes":[ {"child_token":"100_sp_ip_complex","child_option":2},{"child_token":"sbcc_208_sp_ip_complex","child_option":0},{"child_token":"sbcc_100_sp_ip_complex","child_option":3} ]}
               ]},
{"Problem":{"arch":"gfx90a","token":"100_104_216_sp_op_real_bwd"},
 "Solutions":[ {"sol_node_type":"SOL_INTERNAL_NODE","using_scheme":"CS_REAL_3D_EVEN","solution_childnodes":[ {"child_token":"sbcc_216_sp_ip_complex","child_option":1},{"child_token":"sbcc_104_sp_ip_complex","child_option":1},{"child_token":"51_sp_ip_complex","child_option":3} ]}
               ]},
{"Problem":{"arch":"gfx90a","token":"100_104_216_sp_op_real_fwd"},
 "Solutions":[ {"sol_node_type":"SOL_INTERNAL_NODE","using_scheme":"CS_REAL_3D_EVEN","solution_childnodes":[ {"child_token":"100_sp_ip_complex","child_option":6},{"child_token":"sbcc_216_sp_ip_complex","child_option":0},{"child_token":"sbcc_104_sp_ip_complex","child_option":0} ]}
               ]},
{"Problem":{"arch":"gfx90a","token":"104_104_208_dp_op_real_bwd"},
 "Solutions":[ {"sol_node_type":"SOL_INTERNAL_NODE","using_scheme":"CS_REAL_3D_EVEN","solution_childnodes":[ {"child_token":"sbcc_208_dp_ip_complex","child_option":1},{"child_token":"sbcc_104_dp_ip_complex","child_option":1},{"child_token":"53_dp_ip_complex","child_option":1} ]}
               ]},
{"Problem":{"arch":"gfx90a","token":"104_104_208_dp_op_real_fwd"},
 "Solutions":[ {"sol_node_type":"SOL_INTERNAL_NODE","using_scheme":"CS_REAL_3D_EVEN","solution_childnodes":[ {"child_token":"104_dp_ip_complex","child_option":1},{"child_token":"sbcc_208_dp_ip_complex","child_option":0},{"child_token":"sbcc_104_dp_ip_complex","child_option":0} ]}
               ]},
{"Problem":{"arch":"gfx90a","token":"104_108_224_sp_op_real_fwd"},
 "Solutions":[ {"sol_node_type":"SOL_INTERNAL_NODE","using_scheme":"CS_REAL_3D_EVEN","solution_childnodes":[ {"child_token":"104_sp_ip_complex","child_option":1},{"child_token":"sbcc_224_sp_ip_complex","child_option":0},{"child_token":"sbcc_108_sp_ip_complex","child_option":2} ]}
               ]},
{"Problem":{"arch":"gfx90a","token":"108_108_224_sp_op_real_bwd"},
 "Solutions":[ {"sol_node_type":"SOL_INTERNAL_NODE","using_scheme":"CS_REAL_3D_EVEN","solution_childnodes":[ {"child_token":"sbcc_224_sp_ip_complex","child_option":2},{"child_token":"sbcc_108_sp_ip_complex","child_option":4},{"child_token":"55_sp_ip_complex","child_option":1} ]}
               ]},
{"Problem":{"arch":"gfx90a","token":"108_108_224_sp_op_real_fwd"},
 "Solutions":[ {"sol_node_type":"SOL_INTERNAL_NODE","using_scheme":"CS_REAL_3D_EVEN","solution_childnodes":[ {"child_token":"108_sp_ip_complex","child_option":1},{"child_token":"sbcc_224_sp_ip_complex","child_option":1},{"child_token":"sbcc_108_sp_ip_complex","child_option":3} ]}
               ]},
{"Problem":{"arch":"gfx90a","token":"108_108_240_sp_op_real_bwd"},
 "Solutions":[ {"sol_node_type":"SOL_INTERNAL_NODE","using_scheme":"CS_REAL_3D_EVEN","solution_childnodes":[ {"child_token":"sbcc_240_sp_ip_complex","child_option":1},{"child_token":"sbcc_108_sp_ip_complex","child_option":6},{"child_token":"55_sp_ip_complex","child_option":1} ]}
               ]},
{"Problem":{"arch":"gfx90a","token":"108_108_240_sp_op_real_fwd"},
 "Solutions":[ {"sol_node_type":"SOL_INTERNAL_NODE","using_scheme":"CS_REAL_3D_EVEN","solution_childnodes":[ {"child_token":"108_sp_ip_complex","child_option":1},{"child_token":"sbcc_240_sp_ip_complex","child_option":0},{"child_token":"sbcc_108_sp_ip_complex","child_option":5} ]}
               ]},
{"Problem":{"arch":"gfx90a","token":"108_112_240_sp_op_real_bwd"},
 "Solutions":[ {"sol_node_type":"SOL_INTERNAL_NODE","using_scheme":"CS_REAL_3D_EVEN","solution_childnodes":[ {"child_token":"sbcc_240_sp_ip_complex","child_option":2},{"child_token":"sbcc_112_sp_ip_complex","child_option":1},{"child_token":"55_sp_ip_complex","child_option":2} ]}
               ]},
{"Problem":{"arch":"gfx90a","token":"108_112_240_sp_op_real_fwd"},
 "Solutions":[ {"sol_node_type":"SOL_INTERNAL_NODE","using_scheme":"CS_REAL_3D_EVEN","solution_childnodes":[ {"child_token":"108_sp_ip_complex","child_option":2},{"child_token":"sbcc_240_sp_ip_complex","child_option":2},{"child_token":"sbcc_112_sp_ip_complex","child_option":0} ]}
               ]},
{"Problem":{"arch":"gfx90a","token":"112_112_240_sp_op_real_bwd"},
 "Solutions":[ {"sol_node_type":"SOL_INTERNAL_NODE","using_scheme":"CS_REAL_3D_EVEN","solution_childnodes":[ {"child_token":"sbcc_240_sp_ip_complex","child_option":4},{"child_token":"sbcc_112_sp_ip_complex","child_option":2},{"child_token":"57_sp_ip_complex","child_option":1} ]}
               ]},
{"Problem":{"arch":"gfx90a","token":"112_112_240_sp_op_real_fwd"},
 "Solutions":[ {"sol_node_type":"SOL_INTERNAL_NODE","using_scheme":"CS_REAL_3D_EVEN","solution_childnodes":[ {"child_token":"112_sp_ip_complex","child_option":1},{"child_token":"sbcc_240_sp_ip_complex","child_option":3},{"child_token":"sbcc_112_sp_ip_complex","child_option":2} ]}
               ]},
{"Problem":{"arch":"gfx90a","token":"128_128_280_sp_op_real_bwd"},
 "Solutions":[ {"sol_node_type":"SOL_INTERNAL_NODE","using_scheme":"CS_REAL_3D_EVEN","solution_childnodes":[ {"child_token":"sbcc_280_sp_ip_complex","child_option":1},{"child_token":"sbcc_128_sp_ip_complex","child_option":3},{"child_token":"65_sp_ip_complex","child_option":1} ]}
               ]},
{"Problem":{"arch":"gfx90a","token":"128_128_280_sp_op_real_fwd"},
 "Solutions":[ {"sol_node_type":"SOL_INTERNAL_NODE","using_scheme":"CS_REAL_3D_EVEN","solution_childnodes":[ {"child_token":"128_sp_ip_complex","child_option":2},{"child_token":"sbcc_280_sp_ip_complex","child_option":0},{"child_token":"sbcc_128_sp_ip_complex","child_option":2} ]}
               ]},
{"Problem":{"arch":"gfx90a","token":"144_84_80_sp_op_real_bwd"},
 "Solutions":[ {"sol_node_type":"SOL_INTERNAL_NODE","using_scheme":"CS_REAL_3D_EVEN","solution_childnodes":[ {"child_token":"sbcc_80_sp_ip_complex","child_option":4},{"child_token":"sbcc_84_sp_ip_complex","child_option":3},{"child_token":"73_sp_ip_complex","child_option":1} ]}
               ]},
{"Problem":{"arch":"gfx90a","token":"144_84_80_sp_op_real_fwd"},
 "Solutions":[ {"sol_node_type":"SOL_INTERNAL_NODE","using_scheme":"CS_REAL_3D_EVEN","solution_childnodes":[ {"child_token":"144_sp_ip_complex","child_option":1},{"child_token":"sbcc_80_sp_ip_complex","child_option":3},{"child_token":"sbcc_84_sp_ip_complex","child_option":2} ]}
               ]},
{"Problem":{"arch":"gfx90a","token":"14_84_80_sp_op_real_bwd"},
 "Solutions":[ {"sol_node_type":"SOL_INTERNAL_NODE","using_scheme":"CS_REAL_3D_EVEN","solution_childnodes":[ {"child_token":"sbcc_80_sp_ip_complex","child_option":2},{"child_token":"84_7_sp_ip_complex","child_option":1} ]}
               ]},
{"Problem":{"arch":"gfx90a","token":"168_160_160_sp_op_real_bwd"},
 "Solutions":[ {"sol_node_type":"SOL_INTERNAL_NODE","using_scheme":"CS_REAL_3D_EVEN","solution_childnodes":[ {"child_token":"sbcc_160_sp_ip_complex","child_option":0},{"child_token":"sbcc_160_sp_ip_complex","child_option":1},{"child_token":"85_sp_ip_complex","child_option":1} ]}
               ]},
{"Problem":{"arch":"gfx90a","token":"168_160_160_sp_op_real_fwd"},
 "Solutions":[ {"sol_node_type":"SOL_INTERNAL_NODE","using_scheme":"CS_REAL_3D_EVEN","solution_childnodes":[ {"child_token":"168_sp_ip_complex","child_option":1},{"child_token":"sbcc_160_sp_ip_complex","child_option":0},{"child_token":"sbcc_160_sp_ip_complex","child_option":1} ]}
               ]},
{"Problem":{"arch":"gfx90a","token":"168_168_160_sp_op_real_bwd"},
 "Solutions":[ {"sol_node_type":"SOL_INTERNAL_NODE","using_scheme":"CS_REAL_3D_EVEN","solution_childnodes":[ {"child_token":"sbcc_160_sp_ip_complex","child_option":1},{"child_token":"sbcc_168_sp_ip_complex","child_option":1},{"child_token":"85_sp_ip_complex","child_option":2} ]}
               ]},
{"Problem":{"arch":"gfx90a","token":"168_168_160_sp_op_real_fwd"},
 "Solutions":[ {"sol_node_type":"SOL_INTERNAL_NODE","using_scheme":"CS_REAL_3D_EVEN","solution_childnodes":[ {"child_token":"168_sp_ip_complex","child_option":2},{"child_token":"sbcc_160_sp_ip_complex","child_option":0},{"child_token":"sbcc_168_sp_ip_complex","child_option":0} ]}
               ]},
{"Problem":{"arch":"gfx90a","token":"192_168_160_sp_op_real_bwd"},
 "Solutions":[ {"sol_node_type":"SOL_INTERNAL_NODE","using_scheme":"CS_REAL_3D_EVEN","solution_childnodes":[ {"child_token":"sbcc_160_sp_ip_complex","child_option":3},{"child_token":"sbcc_168_sp_ip_complex","child_option":3},{"child_token":"97_sp_ip_complex","child_option":1} ]}
               ]},
{"Problem":{"arch":"gfx90a","token":"192_168_160_sp_op_real_fwd"},
 "Solutions":[ {"sol_node_type":"SOL_INTERNAL_NODE","using_scheme":"CS_REAL_3D_EVEN","solution_childnodes":[ {"child_token":"192_sp_ip_complex","child_option":1},{"child_token":"sbcc_160_sp_ip_complex","child_option":2},{"child_token":"sbcc_168_sp_ip_complex","child_option":2} ]}
               ]},
{"Problem":{"arch":"gfx90a","token":"192_168_168_sp_op_real_bwd"},
 "Solutions":[ {"sol_node_type":"SOL_INTERNAL_NODE","using_scheme":"CS_REAL_3D_EVEN","solution_childnodes":[ {"child_token":"sbcc_168_sp_ip_complex","child_option":2},{"child_token":"sbcc_168_sp_ip_complex","child_option":6},{"child_token":"97_sp_ip_complex","child_option":2} ]}
               ]},
{"Problem":{"arch":"gfx90a","token":"192_168_168_sp_op_real_fwd"},
 "Solutions":[ {"sol_node_type":"SOL_INTERNAL_NODE","using_scheme":"CS_REAL_3D_EVEN","solution_childnodes":[ {"child_token":"192_sp_ip_complex","child_option":2},{"child_token":"sbcc_168_sp_ip_complex","child_option":4},{"child_token":"sbcc_168_sp_ip_complex","child_option":5} ]}
               ]},
{"Problem":{"arch":"gfx90a","token":"192_192_168_sp_op_real_bwd"},
 "Solutions":[ {"sol_node_type":"SOL_INTERNAL_NODE","using_scheme":"CS_REAL_3D_EVEN","solution_childnodes":[ {"child_token":"sbcc_168_sp_ip_complex","child_option":7},{"child_token":"192_sp_ip_complex","child_option":4},{"child_token":"97_sp_ip_complex","child_option":3} ]}
               ]},
{"Problem":{"arch":"gfx90a","token":"192_192_168_sp_op_real_fwd"},
 "Solutions":[ {"sol_node_type":"SOL_INTERNAL_NODE","using_scheme":"CS_REAL_3D_EVEN","solution_childnodes":[ {"child_token":"192_sp_ip_complex","child_option":3},{"child_token":"sbcc_168_sp_ip_complex","child_option":5},{"child_token":"192_sp_ip_complex","child_option":4} ]}
               ]},
{"Problem":{"arch":"gfx90a","token":"192_192_192_sp_op_real_bwd"},
 "Solutions":[ {"sol_node_type":"SOL_INTERNAL_NODE","using_scheme":"CS_REAL_3D_EVEN","solution_childnodes":[ {"child_token":"sbcc_192_sp_ip_complex","child_option":2},{"child_token":"sbcc_192_sp_ip_complex","child_option":3},{"child_token":"97_sp_ip_complex","child_option":4} ]}
               ]},
{"Problem":{"arch":"gfx90a","token":"192_192_192_sp_op_real_fwd"},
 "Solutions":[ {"sol_node_type":"SOL_INTERNAL_NODE","using_scheme":"CS_REAL_3D_EVEN","solution_childnodes":[ {"child_token":"192_sp_ip_complex","child_option":5},{"child_token":"sbcc_192_sp_ip_complex","child_option":0},{"child_token":"sbcc_192_sp_ip_complex","child_option":1} ]}
               ]},
{"Problem":{"arch":"gfx90a","token":"200_192_192_sp_op_real_bwd"},
 "Solutions":[ {"sol_node_type":"SOL_INTERNAL_NODE","using_scheme":"CS_REAL_3D_EVEN","solution_childnodes":[ {"child_token":"sbcc_192_sp_ip_complex","child_option":5},{"child_token":"sbcc_192_sp_ip_complex","child_option":6},{"child_token":"101_sp_ip_complex","child_option":1} ]}
               ]},
{"Problem":{"arch":"gfx90a","token":"200_192_192_sp_op_real_fwd"},
 "Solutions":[ {"sol_node_type":"SOL_INTERNAL_NODE","using_scheme":"CS_REAL_3D_EVEN","solution_childnodes":[ {"child_token":"200_sp_ip_complex","child_option":1},{"child_token":"sbcc_192_sp_ip_complex","child_option":0},{"child_token":"sbcc_192_sp_ip_complex","child_option":4} ]}
               ]},
{"Problem":{"arch":"gfx90a","token":"200_200_192_sp_op_real_bwd"},
 "Solutions":[ {"sol_node_type":"SOL_INTERNAL_NODE","using_scheme":"CS_REAL_3D_EVEN","solution_childnodes":[ {"child_token":"192_sp_ip_complex","child_option":7},{"child_token":"sbcc_200_sp_ip_complex","child_option":1},{"child_token":"101_sp_ip_complex","child_option":1} ]}
               ]},
{"Problem":{"arch":"gfx90a","token":"200_200_192_sp_op_real_fwd"},
 "Solutions":[ {"sol_node_type":"SOL_INTERNAL_NODE","using_scheme":"CS_REAL_3D_EVEN","solution_childnodes":[ {"child_token":"200_sp_ip_complex","child_option":2},{"child_token":"192_sp_ip_complex","child_option":6},{"child_token":"sbcc_200_sp_ip_complex","child_option":0} ]}
               ]},
{"Problem":{"arch":"gfx90a","token":"200_200_200_dp_op_real_fwd"},
 "Solutions":[ {"sol_node_type":"SOL_INTERNAL_NODE","using_scheme":"CS_REAL_3D_EVEN","solution_childnodes":[ {"child_token":"200_dp_ip_complex","child_option":1},{"child_token":"sbcc_200_dp_ip_complex","child_option":0},{"child_token":"sbcc_200_dp_ip_complex","child_option":0} ]}
               ]},
{"Problem":{"arch":"gfx90a","token":"200_200_200_sp_op_real_fwd"},
 "Solutions":[ {"sol_node_type":"SOL_INTERNAL_NODE","using_scheme":"CS_REAL_3D_EVEN","solution_childnodes":[ {"child_token":"200_sp_ip_complex","child_option":1},{"child_token":"sbcc_200_sp_ip_complex","child_option":4},{"child_token":"sbcc_200_sp_ip_complex","child_option":5} ]}
               ]},
{"Problem":{"arch":"gfx90a","token":"20_20_25_sp_op_real_bwd"},
 "Solutions":[ {"sol_node_type":"SOL_INTERNAL_NODE","using_scheme":"CS_REAL_3D_EVEN","solution_childnodes":[ {"child_token":"25_sp_ip_complex","child_option":2},{"child_token":"20_10_sp_ip_complex","child_option":1} ]}
               ]},
{"Problem":{"arch":"gfx90a","token":"20_20_25_sp_op_real_fwd"},
 "Solutions":[ {"sol_node_type":"SOL_INTERNAL_NODE","using_scheme":"CS_REAL_3D_EVEN","solution_childnodes":[ {"child_token":"10_20_sp_ip_complex","child_option":1},{"child_token":"25_sp_ip_complex","child_option":1} ]}
               ]},
{"Problem":{"arch":"gfx90a","token":"216_216_216_sp_op_real_bwd"},
 "Solutions":[ {"sol_node_type":"SOL_INTERNAL_NODE","using_scheme":"CS_REAL_3D_EVEN","solution_childnodes":[ {"child_token":"sbcc_216_sp_ip_complex","child_option":4},{"child_token":"sbcc_216_sp_ip_complex","child_option":5},{"child_token":"109_sp_ip_complex","child_option":1} ]}
               ]},
{"Problem":{"arch":"gfx90a","token":"216_216_216_sp_op_real_fwd"},
 "Solutions":[ {"sol_node_type":"SOL_INTERNAL_NODE","using_scheme":"CS_REAL_3D_EVEN","solution_childnodes":[ {"child_token":"216_sp_ip_complex","child_option":1},{"child_token":"sbcc_216_sp_ip_complex","child_option":2},{"child_token":"sbcc_216_sp_ip_complex","child_option":3} ]}
               ]},
{"Problem":{"arch":"gfx90a","token":"224_224_240_sp_op_real_bwd"},
 "Solutions":[ {"sol_node_type":"SOL_INTERNAL_NODE","using_scheme":"CS_REAL_3D_EVEN","solution_childnodes":[ {"child_token":"sbcc_240_sp_ip_complex","child_option":6},{"child_token":"sbcc_224_sp_ip_complex","child_option":4},{"child_token":"113_sp_ip_complex","child_option":1} ]}
               ]},
{"Problem":{"arch":"gfx90a","token":"224_224_240_sp_op_real_fwd"},
 "Solutions":[ {"sol_node_type":"SOL_INTERNAL_NODE","using_scheme":"CS_REAL_3D_EVEN","solution_childnodes":[ {"child_token":"224_sp_ip_complex","child_option":1},{"child_token":"sbcc_240_sp_ip_complex","child_option":5},{"child_token":"sbcc_224_sp_ip_complex","child_option":3} ]}
               ]},
{"Problem":{"arch":"gfx90a","token":"256_128_128_sp_op_real_bwd"},
 "Solutions":[ {"sol_node_type":"SOL_INTERNAL_NODE","using_scheme":"CS_REAL_3D_EVEN","solution_childnodes":[ {"child_token":"sbcc_128_sp_ip_complex","child_option":0},{"child_token":"sbcc_128_sp_ip_complex","child_option":0},{"child_token":"129_sp_ip_complex","child_option":1} ]}
               ]},
{"Problem":{"arch":"gfx90a","token":"256_128_128_sp_op_real_fwd"},
 "Solutions":[ {"sol_node_type":"SOL_INTERNAL_NODE","using_scheme":"CS_REAL_3D_EVEN","solution_childnodes":[ {"child_token":"256_sp_ip_complex","child_option":3},{"child_token":"sbcc_128_sp_ip_complex","child_option":2},{"child_token":"sbcc_128_sp_ip_complex","child_option":0} ]}
               ]},
{"Problem":{"arch":"gfx90a","token":"32_32_42_sp_op_real_bwd"},
 "Solutions":[ {"sol_node_type":"SOL_INTERNAL_NODE","using_scheme":"CS_REAL_3D_EVEN","solution_childnodes":[ {"child_token":"42_sp_ip_complex","child_option":1},{"child_token":"32_16_sp_ip_complex","child_option":1} ]}
               ]},
{"Problem":{"arch":"gfx90a","token":"52_64_64_sp_op_real_bwd"},
 "Solutions":[ {"sol_node_type":"SOL_INTERNAL_NODE","using_scheme":"CS_REAL_3D_EVEN","solution_childnodes":[ {"child_token":"sbcc_64_sp_ip_complex","child_option":1},{"child_token":"64_26_sp_ip_complex","child_option":1} ]}
               ]},
{"Problem":{"arch":"gfx90a","token":"52_64_64_sp_op_real_fwd"},
 "Solutions":[ {"sol_node_type":"SOL_INTERNAL_NODE","using_scheme":"CS_REAL_3D_EVEN","solution_childnodes":[ {"child_token":"26_64_sp_ip_complex","child_option":1},{"child_token":"sbcc_64_sp_ip_complex","child_option":0} ]}
               ]},
{"Problem":{"arch":"gfx90a","token":"52_72_72_sp_op_real_bwd"},
 "Solutions":[ {"sol_node_type":"SOL_INTERNAL_NODE","using_scheme":"CS_REAL_3D_EVEN","solution_childnodes":[ {"child_token":"sbcc_72_sp_ip_complex","child_option":1},{"child_token":"72_26_sp_ip_complex","child_option":1} ]}
               ]},
{"Problem":{"arch":"gfx90a","token":"52_72_72_sp_op_real_fwd"},
 "Solutions":[ {"sol_node_type":"SOL_INTERNAL_NODE","using_scheme":"CS_REAL_3D_EVEN","solution_childnodes":[ {"child_token":"26_72_sp_ip_complex","child_option":1},{"child_token":"sbcc_72_sp_ip_complex","child_option":0} ]}
               ]},
{"Problem":{"arch":"gfx90a","token":"60_60_60_sp_op_real_bwd"},
 "Solutions":[ {"sol_node_type":"SOL_INTERNAL_NODE","using_scheme":"CS_REAL_3D_EVEN","solution_childnodes":[ {"child_token":"sbcc_60_sp_ip_complex","child_option":1},{"child_token":"60_30_sp_ip_complex","child_option":1} ]}
               ]},
{"Problem":{"arch":"gfx90a","token":"60_60_60_sp_op_real_fwd"},
 "Solutions":[ {"sol_node_type":"SOL_INTERNAL_NODE","using_scheme":"CS_REAL_3D_EVEN","solution_childnodes":[ {"child_token":"30_60_sp_ip_complex","child_option":1},{"child_token":"sbcc_60_sp_ip_complex","child_option":0} ]}
               ]},
{"Problem":{"arch":"gfx90a","token":"72_72_160_sp_op_real_bwd"},
 "Solutions":[ {"sol_node_type":"SOL_INTERNAL_NODE","using_scheme":"CS_REAL_3D_EVEN","solution_childnodes":[ {"child_token":"sbcc_160_sp_ip_complex","child_option":4},{"child_token":"72_36_sp_ip_complex","child_option":1} ]}
               ]},
{"Problem":{"arch":"gfx90a","token":"72_72_160_sp_op_real_fwd"},
 "Solutions":[ {"sol_node_type":"SOL_INTERNAL_NODE","using_scheme":"CS_REAL_3D_EVEN","solution_childnodes":[ {"child_token":"36_72_sp_ip_complex","child_option":1},{"child_token":"sbcc_160_sp_ip_complex","child_option":1} ]}
               ]},
{"Problem":{"arch":"gfx90a","token":"72_72_72_sp_op_real_bwd"},
 "Solutions":[ {"sol_node_type":"SOL_INTERNAL_NODE","using_scheme":"CS_REAL_3D_EVEN","solution_childnodes":[ {"child_token":"sbcc_72_sp_ip_complex","child_option":3},{"child_token":"72_36_sp_ip_complex","child_option":1} ]}
               ]},
{"Problem":{"arch":"gfx90a","token":"72_72_72_sp_op_real_fwd"},
 "Solutions":[ {"sol_node_type":"SOL_INTERNAL_NODE","using_scheme":"CS_REAL_3D_EVEN","solution_childnodes":[ {"child_token":"36_72_sp_ip_complex","child_option":1},{"child_token":"sbcc_72_sp_ip_complex","child_option":2} ]}
               ]},
{"Problem":{"arch":"gfx90a","token":"72_80_160_sp_op_real_bwd"},
 "Solutions":[ {"sol_node_type":"SOL_INTERNAL_NODE","using_scheme":"CS_REAL_3D_EVEN","solution_childnodes":[ {"child_token":"sbcc_160_sp_ip_complex","child_option":4},{"child_token":"80_36_sp_ip_complex","child_option":1} ]}
               ]},
{"Problem":{"arch":"gfx90a","token":"72_80_160_sp_op_real_fwd"},
 "Solutions":[ {"sol_node_type":"SOL_INTERNAL_NODE","using_scheme":"CS_REAL_3D_EVEN","solution_childnodes":[ {"child_token":"36_80_sp_ip_complex","child_option":1},{"child_token":"sbcc_160_sp_ip_complex","child_option":5} ]}
               ]},
{"Problem":{"arch":"gfx90a","token":"72_84_84_sp_op_real_bwd"},
 "Solutions":[ {"sol_node_type":"SOL_INTERNAL_NODE","using_scheme":"CS_REAL_3D_EVEN","solution_childnodes":[ {"child_token":"sbcc_84_sp_ip_complex","child_option":1},{"child_token":"84_36_sp_ip_complex","child_option":1} ]}
               ]},
{"Problem":{"arch":"gfx90a","token":"72_84_84_sp_op_real_fwd"},
 "Solutions":[ {"sol_node_type":"SOL_INTERNAL_NODE","using_scheme":"CS_REAL_3D_EVEN","solution_childnodes":[ {"child_token":"36_84_sp_ip_complex","child_option":1},{"child_token":"sbcc_84_sp_ip_complex","child_option":0} ]}
               ]},
{"Problem":{"arch":"gfx90a","token":"80_108_108_sp_op_real_fwd"},
 "Solutions":[ {"sol_node_type":"SOL_INTERNAL_NODE","using_scheme":"CS_REAL_3D_EVEN","solution_childnodes":[ {"child_token":"80_sp_ip_complex","child_option":1},{"child_token":"sbcc_108_sp_ip_complex","child_option":0},{"child_token":"sbcc_108_sp_ip_complex","child_option":1} ]}
               ]},
{"Problem":{"arch":"gfx90a","token":"80_80_160_sp_op_real_bwd"},
 "Solutions":[ {"sol_node_type":"SOL_INTERNAL_NODE","using_scheme":"CS_REAL_3D_EVEN","solution_childnodes":[ {"child_token":"sbcc_160_sp_ip_complex","child_option":4},{"child_token":"80_40_sp_ip_complex","child_option":1} ]}
               ]},
{"Problem":{"arch":"gfx90a","token":"80_80_160_sp_op_real_fwd"},
 "Solutions":[ {"sol_node_type":"SOL_INTERNAL_NODE","using_scheme":"CS_REAL_3D_EVEN","solution_childnodes":[ {"child_token":"40_80_sp_ip_complex","child_option":1},{"child_token":"sbcc_160_sp_ip_complex","child_option":1} ]}
               ]},
{"Problem":{"arch":"gfx90a","token":"80_80_168_sp_op_real_bwd"},
 "Solutions":[ {"sol_node_type":"SOL_INTERNAL_NODE","using_scheme":"CS_REAL_3D_EVEN","solution_childnodes":[ {"child_token":"sbcc_168_sp_ip_complex","child_option":9},{"child_token":"80_40_sp_ip_complex","child_option":1} ]}
               ]},
{"Problem":{"arch":"gfx90a","token":"80_80_168_sp_op_real_fwd"},
 "Solutions":[ {"sol_node_type":"SOL_INTERNAL_NODE","using_scheme":"CS_REAL_3D_EVEN","solution_childnodes":[ {"child_token":"40_80_sp_ip_complex","child_option":1},{"child_token":"sbcc_168_sp_ip_complex","child_option":8} ]}
               ]},
{"Problem":{"arch":"gfx90a","token":"80_80_80_sp_op_real_bwd"},
 "Solutions":[ {"sol_node_type":"SOL_INTERNAL_NODE","using_scheme":"CS_REAL_3D_EVEN","solution_childnodes":[ {"child_token":"sbcc_80_sp_ip_complex","child_option":1},{"child_token":"80_40_sp_ip_complex","child_option":1} ]}
               ]},
{"Problem":{"arch":"gfx90a","token":"80_80_80_sp_op_real_fwd"},
 "Solutions":[ {"sol_node_type":"SOL_INTERNAL_NODE","using_scheme":"CS_REAL_3D_EVEN","solution_childnodes":[ {"child_token":"40_80_sp_ip_complex","child_option":1},{"child_token":"sbcc_80_sp_ip_complex","child_option":0} ]}
               ]},
{"Problem":{"arch":"gfx90a","token":"84_84_192_sp_op_real_bwd"},
 "Solutions":[ {"sol_node_type":"SOL_INTERNAL_NODE","using_scheme":"CS_REAL_3D_EVEN","solution_childnodes":[ {"child_token":"sbcc_192_sp_ip_complex","child_option":8},{"child_token":"84_42_sp_ip_complex","child_option":1} ]}
               ]},
{"Problem":{"arch":"gfx90a","token":"84_84_192_sp_op_real_fwd"},
 "Solutions":[ {"sol_node_type":"SOL_INTERNAL_NODE","using_scheme":"CS_REAL_3D_EVEN","solution_childnodes":[ {"child_token":"42_84_sp_ip_complex","child_option":1},{"child_token":"sbcc_192_sp_ip_complex","child_option":7} ]}
               ]},
{"Problem":{"arch":"gfx90a","token":"84_96_192_sp_op_real_bwd"},
 "Solutions":[ {"sol_node_type":"SOL_INTERNAL_NODE","using_scheme":"CS_REAL_3D_EVEN","solution_childnodes":[ {"child_token":"sbcc_192_sp_ip_complex","child_option":10},{"child_token":"96_42_sp_ip_complex","child_option":1} ]}
               ]},
{"Problem":{"arch":"gfx90a","token":"84_96_192_sp_op_real_fwd"},
 "Solutions":[ {"sol_node_type":"SOL_INTERNAL_NODE","using_scheme":"CS_REAL_3D_EVEN","solution_childnodes":[ {"child_token":"42_96_sp_ip_complex","child_option":1},{"child_token":"sbcc_192_sp_ip_complex","child_option":9} ]}
               ]},
{"Problem":{"arch":"gfx90a","token":"96_100_200_sp_op_real_bwd"},
 "Solutions":[ {"sol_node_type":"SOL_INTERNAL_NODE","using_scheme":"CS_REAL_3D_EVEN","solution_childnodes":[ {"child_token":"sbcc_200_sp_ip_complex","child_option":3},{"child_token":"sbcc_100_sp_ip_complex","child_option":1},{"child_token":"49_sp_ip_complex","child_option":2} ]}
               ]},
{"Problem":{"arch":"gfx90a","token":"96_100_200_sp_op_real_fwd"},
 "Solutions":[ {"sol_node_type":"SOL_INTERNAL_NODE","using_scheme":"CS_REAL_3D_EVEN","solution_childnodes":[ {"child_token":"96_sp_ip_complex","child_option":9},{"child_token":"sbcc_200_sp_ip_complex","child_option":2},{"child_token":"sbcc_100_sp_ip_complex","child_option":1} ]}
               ]},
{"Problem":{"arch":"gfx90a","token":"96_96_192_sp_op_real_bwd"},
 "Solutions":[ {"sol_node_type":"SOL_INTERNAL_NODE","using_scheme":"CS_REAL_3D_EVEN","solution_childnodes":[ {"child_token":"192_sp_ip_complex","child_option":9},{"child_token":"sbcc_96_sp_ip_complex","child_option":1},{"child_token":"49_sp_ip_complex","child_option":1} ]}
               ]},
{"Problem":{"arch":"gfx90a","token":"96_96_192_sp_op_real_fwd"},
 "Solutions":[ {"sol_node_type":"SOL_INTERNAL_NODE","using_scheme":"CS_REAL_3D_EVEN","solution_childnodes":[ {"child_token":"96_sp_ip_complex","child_option":9},{"child_token":"192_sp_ip_complex","child_option":8},{"child_token":"sbcc_96_sp_ip_complex","child_option":0} ]}
               ]},
{"Problem":{"arch":"gfx90a","token":"96_96_200_sp_op_real_fwd"},
 "Solutions":[ {"sol_node_type":"SOL_INTERNAL_NODE","using_scheme":"CS_REAL_3D_EVEN","solution_childnodes":[ {"child_token":"96_sp_ip_complex","child_option":9},{"child_token":"sbcc_200_sp_ip_complex","child_option":3},{"child_token":"sbcc_96_sp_ip_complex","child_option":2} ]}
               ]},
{"Problem":{"arch":"gfx90a","token":"96_96_96_sp_op_real_bwd"},
 "Solutions":[ {"sol_node_type":"SOL_INTERNAL_NODE","using_scheme":"CS_REAL_3D_EVEN","solution_childnodes":[ {"child_token":"sbcc_96_sp_ip_complex","child_option":4},{"child_token":"sbcc_96_sp_ip_complex","child_option":5},{"child_token":"49_sp_ip_complex","child_option":3} ]}
               ]},
{"Problem":{"arch":"gfx90a","token":"96_96_96_sp_op_real_fwd"},
 "Solutions":[ {"sol_node_type":"SOL_INTERNAL_NODE","using_scheme":"CS_REAL_3D_EVEN","solution_childnodes":[ {"child_token":"96_sp_ip_complex","child_option":10},{"child_token":"sbcc_96_sp_ip_complex","child_option":3},{"child_token":"sbcc_96_sp_ip_complex","child_option":2} ]}
               ]},
{"Problem":{"arch":"gfx90a","token":"14348907_sp_ip_complex"},
 "Solutions":[ {"sol_node_type":"SOL_INTERNAL_NODE","using_scheme":"CS_L1D_TRTRT","solution_childnodes":[ {"child_token":"leafnode_token_builtin_kernel","child_option":0},{"child_token":"6561_sp_ip_complex","child_option":3},{"child_token":"leafnode_token_builtin_kernel","child_option":0},{"child_token":"2187_sp_ip_complex","child_option":2},{"child_token":"leafnode_token_builtin_kernel","child_option":0} ]}
               ]},
{"Problem":{"arch":"gfx90a","token":"16777216_sp_ip_complex"},
 "Solutions":[ {"sol_node_type":"SOL_INTERNAL_NODE","using_scheme":"CS_L1D_TRTRT","solution_childnodes":[ {"child_token":"leafnode_token_builtin_kernel","child_option":0},{"child_token":"4096_sp_ip_complex","child_option":1},{"child_token":"leafnode_token_builtin_kernel","child_option":0},{"child_token":"4096_sp_ip_complex","child_option":1},{"child_token":"leafnode_token_builtin_kernel","child_option":0} ]}
               ]},
{"Problem":{"arch":"gfx90a","token":"10000_dp_op_complex"},
 "Solutions":[ {"sol_node_type":"SOL_INTERNAL_NODE","using_scheme":"CS_L1D_CC","solution_childnodes":[ {"child_token":"sbcc_100_dp_ip_complex","child_option":0},{"child_token":"sbrc_100_dp_ip_complex","child_option":0} ]}
               ]},
{"Problem":{"arch":"gfx90a","token":"10752_dp_op_complex"},
 "Solutions":[ {"sol_node_type":"SOL_INTERNAL_NODE","using_scheme":"CS_L1D_CC","solution_childnodes":[ {"child_token":"sbcc_96_dp_ip_complex","child_option":1},{"child_token":"sbrc_112_dp_ip_complex","child_option":1} ]}
               ]},
{"Problem":{"arch":"gfx90a","token":"15625_dp_op_complex"},
 "Solutions":[ {"sol_node_type":"SOL_INTERNAL_NODE","using_scheme":"CS_L1D_CC","solution_childnodes":[ {"child_token":"sbcc_125_dp_ip_complex","child_option":1},{"child_token":"sbrc_125_dp_ip_complex","child_option":0} ]}
               ]},
{"Problem":{"arch":"gfx90a","token":"16384_dp_op_complex"},
 "Solutions":[ {"sol_node_type":"SOL_INTERNAL_NODE","using_scheme":"CS_L1D_CC","solution_childnodes":[ {"child_token":"sbcc_64_dp_ip_complex","child_option":1},{"child_token":"sbrc_256_dp_ip_complex","child_option":0} ]}
               ]},
{"Problem":{"arch":"gfx90a","token":"16807_dp_ip_complex"},
 "Solutions":[ {"sol_node_type":"SOL_DUMMY","using_scheme":"CS_NONE","solution_childnodes":[  ]}
              ,{"sol_node_type":"SOL_INTERNAL_NODE","using_scheme":"CS_L1D_CC","solution_childnodes":[ {"child_token":"sbcc_343_dp_ip_complex","child_option":1},{"child_token":"sbrc_49_dp_ip_complex","child_option":1} ]}
               ]},
{"Problem":{"arch":"gfx90a","token":"16807_dp_op_complex"},
 "Solutions":[ {"sol_node_type":"SOL_INTERNAL_NODE","using_scheme":"CS_L1D_CC","solution_childnodes":[ {"child_token":"sbcc_343_dp_ip_complex","child_option":0},{"child_token":"sbrc_49_dp_ip_complex","child_option":0} ]}
               ]},
{"Problem":{"arch":"gfx90a","token":"18816_dp_op_complex"},
 "Solutions":[ {"sol_node_type":"SOL_INTERNAL_NODE","using_scheme":"CS_L1D_CC","solution_childnodes":[ {"child_token":"sbcc_168_dp_ip_complex","child_option":0},{"child_token":"sbrc_112_dp_ip_complex","child_option":2} ]}
               ]},
{"Problem":{"arch":"gfx90a","token":"21504_dp_op_complex"},
 "Solutions":[ {"sol_node_type":"SOL_INTERNAL_NODE","using_scheme":"CS_L1D_CC","solution_childnodes":[ {"child_token":"sbcc_168_dp_ip_complex","child_option":0},{"child_token":"sbrc_128_dp_ip_complex","child_option":0} ]}
               ]},
{"Problem":{"arch":"gfx90a","token":"32256_dp_op_complex"},
 "Solutions":[ {"sol_node_type":"SOL_INTERNAL_NODE","using_scheme":"CS_L1D_CC","solution_childnodes":[ {"child_token":"sbcc_168_dp_ip_complex","child_option":2},{"child_token":"sbrc_192_dp_ip_complex","child_option":0} ]}
               ]},
{"Problem":{"arch":"gfx90a","token":"43008_dp_op_complex"},
 "Solutions":[ {"sol_node_type":"SOL_INTERNAL_NODE","using_scheme":"CS_L1D_CC","solution_childnodes":[ {"child_token":"sbcc_224_dp_ip_complex","child_option":0},{"child_token":"sbrc_192_dp_ip_complex","child_option":2} ]}
               ]},
{"Problem":{"arch":"gfx90a","token":"6561_sp_ip_complex"},
 "Solutions":[ {"sol_node_type":"SOL_DUMMY","using_scheme":"CS_NONE","solution_childnodes":[  ]}
              ,{"sol_node_type":"SOL_INTERNAL_NODE","using_scheme":"CS_L1D_CC","solution_childnodes":[ {"child_token":"sbcc_81_sp_ip_complex","child_option":0},{"child_token":"sbrc_81_sp_ip_complex","child_option":0} ]}
              ,{"sol_node_type":"SOL_INTERNAL_NODE","using_scheme":"CS_L1D_CC","solution_childnodes":[ {"child_token":"sbcc_81_sp_ip_complex","child_option":0},{"child_token":"sbrc_81_sp_ip_complex","child_option":1} ]}
              ,{"sol_node_type":"SOL_INTERNAL_NODE","using_scheme":"CS_L1D_CC","solution_childnodes":[ {"child_token":"sbcc_81_sp_ip_complex","child_option":1},{"child_token":"sbrc_81_sp_ip_complex","child_option":2} ]}
               ]},
{"Problem":{"arch":"gfx90a","token":"8192_dp_ip_complex"},
 "Solutions":[ {"sol_node_type":"SOL_DUMMY","using_scheme":"CS_NONE","solution_childnodes":[  ]}
              ,{"sol_node_type":"SOL_INTERNAL_NODE","using_scheme":"CS_L1D_CC","solution_childnodes":[ {"child_token":"sbcc_64_dp_ip_complex","child_option":2},{"child_token":"sbrc_128_dp_ip_complex","child_option":2} ]}
              ,{"sol_node_type":"SOL_INTERNAL_NODE","using_scheme":"CS_L1D_CC","solution_childnodes":[ {"child_token":"sbcc_64_dp_ip_complex","child_option":3},{"child_token":"sbrc_128_dp_ip_complex","child_option":3} ]}
              ,{"sol_node_type":"SOL_INTERNAL_NODE","using_scheme":"CS_L1D_CC","solution_childnodes":[ {"child_token":"sbcc_64_dp_ip_complex","child_option":4},{"child_token":"sbrc_128_dp_ip_complex","child_option":4} ]}
               ]},
{"Problem":{"arch":"gfx90a","token":"8192_dp_op_complex"},
 "Solutions":[ {"sol_node_type":"SOL_INTERNAL_NODE","using_scheme":"CS_L1D_CC","solution_childnodes":[ {"child_token":"sbcc_64_dp_ip_complex","child_option":0},{"child_token":"sbrc_128_dp_ip_complex","child_option":1} ]}
               ]},
{"Problem":{"arch":"gfx90a","token":"4096_4096_sp_ip_complex"},
 "Solutions":[ {"sol_node_type":"SOL_INTERNAL_NODE","using_scheme":"CS_2D_RTRT","solution_childnodes":[ {"child_token":"4096_sp_ip_complex","child_option":1},{"child_token":"leafnode_token_builtin_kernel","child_option":0},{"child_token":"4096_sp_ip_complex","child_option":1},{"child_token":"leafnode_token_builtin_kernel","child_option":0} ]}
               ]},
{"Problem":{"arch":"gfx90a","token":"55_55_dp_ip_complex"},
 "Solutions":[ {"sol_node_type":"SOL_DUMMY","using_scheme":"CS_NONE","solution_childnodes":[  ]}
              ,{"sol_node_type":"SOL_INTERNAL_NODE","using_scheme":"CS_2D_RTRT","solution_childnodes":[ {"child_token":"55_dp_ip_complex","child_option":1},{"child_token":"leafnode_token_builtin_kernel","child_option":0},{"child_token":"55_dp_ip_complex","child_option":2},{"child_token":"leafnode_token_builtin_kernel","child_option":0} ]}
               ]},
{"Problem":{"arch":"gfx90a","token":"6561_6561_sp_ip_complex"},
 "Solutions":[ {"sol_node_type":"SOL_INTERNAL_NODE","using_scheme":"CS_2D_RTRT","solution_childnodes":[ {"child_token":"6561_sp_ip_complex","child_option":2},{"child_token":"leafnode_token_builtin_kernel","child_option":0},{"child_token":"6561_sp_ip_complex","child_option":2},{"child_token":"leafnode_token_builtin_kernel","child_option":0} ]}
               ]},
{"Problem":{"arch":"gfx90a","token":"125_125_sp_ip_complex"},
 "Solutions":[ {"sol_node_type":"SOL_DUMMY","using_scheme":"CS_NONE","solution_childnodes":[  ]}
              ,{"sol_node_type":"SOL_INTERNAL_NODE","using_scheme":"CS_2D_RC","solution_childnodes":[ {"child_token":"125_sp_ip_complex","child_option":1},{"child_token":"sbcc_125_sp_ip_complex","child_option":0} ]}
              ,{"sol_node_type":"SOL_INTERNAL_NODE","using_scheme":"CS_2D_RC","solution_childnodes":[ {"child_token":"125_sp_ip_complex","child_option":2},{"child_token":"sbcc_125_sp_ip_complex","child_option":0} ]}
               ]},
{"Problem":{"arch":"gfx90a","token":"243_243_sp_ip_complex"},
 "Solutions":[ {"sol_node_type":"SOL_DUMMY","using_scheme":"CS_NONE","solution_childnodes":[  ]}
              ,{"sol_node_type":"SOL_INTERNAL_NODE","using_scheme":"CS_2D_RC","solution_childnodes":[ {"child_token":"243_sp_ip_complex","child_option":1},{"child_token":"sbcc_243_sp_ip_complex","child_option":0} ]}
               ]},
{"Problem":{"arch":"gfx90a","token":"56_336_dp_ip_complex"},
 "Solutions":[ {"sol_node_type":"SOL_DUMMY","using_scheme":"CS_NONE","solution_childnodes":[  ]}
              ,{"sol_node_type":"SOL_INTERNAL_NODE","using_scheme":"CS_2D_RC","solution_childnodes":[ {"child_token":"56_dp_ip_complex","child_option":1},{"child_token":"sbcc_336_dp_ip_complex","child_option":0} ]}
              ,{"sol_node_type":"SOL_INTERNAL_NODE","using_scheme":"CS_2D_RC","solution_childnodes":[ {"child_token":"56_dp_ip_complex","child_option":2},{"child_token":"sbcc_336_dp_ip_complex","child_option":2} ]}
              ,{"sol_node_type":"SOL_INTERNAL_NODE","using_scheme":"CS_2D_RC","solution_childnodes":[ {"child_token":"56_dp_ip_complex","child_option":3},{"child_token":"sbcc_336_dp_ip_complex","child_option":4} ]}
              ,{"sol_node_type":"SOL_INTERNAL_NODE","using_scheme":"CS_2D_RC","solution_childnodes":[ {"child_token":"56_dp_ip_complex","child_option":4},{"child_token":"sbcc_336_dp_ip_complex","child_option":5} ]}
              ,{"sol_node_type":"SOL_INTERNAL_NODE","using_scheme":"CS_2D_RC","solution_childnodes":[ {"child_token":"56_dp_ip_complex","child_option":1},{"child_token":"sbcc_336_dp_ip_complex","child_option":7} ]}
               ]},
{"Problem":{"arch":"gfx90a","token":"81_81_dp_ip_complex"},
 "Solutions":[ {"sol_node_type":"SOL_DUMMY","using_scheme":"CS_NONE","solution_childnodes":[  ]}
              ,{"sol_node_type":"SOL_INTERNAL_NODE","using_scheme":"CS_2D_RC","solution_childnodes":[ {"child_token":"81_dp_ip_complex","child_option":1},{"child_token":"sbcc_81_dp_ip_complex","child_option":0} ]}
               ]},
{"Problem":{"arch":"gfx90a","token":"81_81_dp_op_complex"},
 "Solutions":[ {"sol_node_type":"SOL_INTERNAL_NODE","using_scheme":"CS_2D_RC","solution_childnodes":[ {"child_token":"81_dp_ip_complex","child_option":1},{"child_token":"sbcc_81_dp_ip_complex","child_option":0} ]}
               ]},
{"Problem":{"arch":"gfx90a","token":"55_55_75_dp_ip_complex"},
 "Solutions":[ {"sol_node_type":"SOL_DUMMY","using_scheme":"CS_NONE","solution_childnodes":[  ]}
              ,{"sol_node_type":"SOL_INTERNAL_NODE","using_scheme":"CS_3D_TRTRTR","solution_childnodes":[ {"child_token":"leafnode_token_builtin_kernel","child_option":2},{"child_token":"55_dp_ip_complex","child_option":3},{"child_token":"leafnode_token_builtin_kernel","child_option":2},{"child_token":"75_dp_ip_complex","child_option":1},{"child_token":"leafnode_token_builtin_kernel","child_option":2},{"child_token":"55_dp_ip_complex","child_option":3} ]}
               ]},
{"Problem":{"arch":"gfx90a","token":"55_55_75_sp_ip_complex"},
 "Solutions":[ {"sol_node_type":"SOL_DUMMY","using_scheme":"CS_NONE","solution_childnodes":[  ]}
              ,{"sol_node_type":"SOL_INTERNAL_NODE","using_scheme":"CS_3D_TRTRTR","solution_childnodes":[ {"child_token":"leafnode_token_builtin_kernel","child_option":2},{"child_token":"55_sp_ip_complex","child_option":3},{"child_token":"leafnode_token_builtin_kernel","child_option":2},{"child_token":"75_sp_ip_complex","child_option":1},{"child_token":"leafnode_token_builtin_kernel","child_option":2},{"child_token":"55_sp_ip_complex","child_option":4} ]}
              ,{"sol_node_type":"SOL_INTERNAL_NODE","using_scheme":"CS_3D_TRTRTR","solution_childnodes":[ {"child_token":"leafnode_token_builtin_kernel","child_option":2},{"child_token":"55_sp_ip_complex","child_option":5},{"child_token":"leafnode_token_builtin_kernel","child_option":2},{"child_token":"75_sp_ip_complex","child_option":1},{"child_token":"leafnode_token_builtin_kernel","child_option":2},{"child_token":"55_sp_ip_complex","child_option":6} ]}
               ]},
{"Problem":{"arch":"gfx90a","token":"243_243_243_sp_ip_complex"},
 "Solutions":[ {"sol_node_type":"SOL_INTERNAL_NODE","using_scheme":"CS_3D_RTRT","solution_childnodes":[ {"child_token":"243_243_sp_ip_complex","child_option":1},{"child_token":"leafnode_token_builtin_kernel","child_option":1},{"child_token":"243_sp_ip_complex","child_option":2},{"child_token":"leafnode_token_builtin_kernel","child_option":2} ]}
               ]},
{"Problem":{"arch":"gfx90a","token":"256_256_256_sp_ip_complex"},
 "Solutions":[ {"sol_node_type":"SOL_INTERNAL_NODE","using_scheme":"CS_3D_BLOCK_RC","solution_childnodes":[ {"child_token":"sbrc_xy_z_256_sp_ip_complex","child_option":0},{"child_token":"sbrc_xy_z_256_sp_ip_complex","child_option":1},{"child_token":"256_sp_ip_complex","child_option":1},{"child_token":"leafnode_token_builtin_kernel","child_option":1} ]}
               ]},
{"Problem":{"arch":"gfx90a","token":"56_336_336_dp_op_complex"},
 "Solutions":[ {"sol_node_type":"SOL_INTERNAL_NODE","using_scheme":"CS_3D_BLOCK_CR","solution_childnodes":[ {"child_token":"sbcr_336_dp_ip_complex","child_option":2},{"child_token":"sbcr_336_dp_ip_complex","child_option":3},{"child_token":"sbcr_56_dp_ip_complex","child_option":1} ]}
               ]},
{"Problem":{"arch":"gfx90a","token":"56_336_336_dp_op_complex_fwd_batch_1_istride_1_56_18816_ostride_1_56_18816_idist_6322176_odist_6322176_ioffset_0_ooffset_0"},
 "Solutions":[ {"sol_node_type":"SOL_INTERNAL_NODE","using_scheme":"CS_3D_BLOCK_CR","solution_childnodes":[ {"child_token":"sbcr_336_dp_ip_complex","child_option":0},{"child_token":"sbcr_336_dp_ip_complex","child_option":1},{"child_token":"sbcr_56_dp_ip_complex","child_option":0} ]}
               ]},
{"Problem":{"arch":"gfx90a","token":"125_125_125_sp_ip_complex"},
 "Solutions":[ {"sol_node_type":"SOL_INTERNAL_NODE","using_scheme":"CS_3D_RC","solution_childnodes":[ {"child_token":"125_125_sp_ip_complex","child_option":2},{"child_token":"sbcc_125_sp_ip_complex","child_option":2} ]}
               ]},
{"Problem":{"arch":"gfx90a","token":"56_336_336_dp_ip_complex"},
 "Solutions":[ {"sol_node_type":"SOL_INTERNAL_NODE","using_scheme":"CS_3D_RC","solution_childnodes":[ {"child_token":"56_336_dp_ip_complex","child_option":5},{"child_token":"sbcc_336_dp_ip_complex","child_option":6} ]}
               ]},
{"Problem":{"arch":"gfx90a","token":"56_336_336_dp_ip_complex_fwd_batch_1_istride_1_56_18816_ostride_1_56_18816_idist_6322176_odist_6322176_ioffset_0_ooffset_0"},
 "Solutions":[ {"sol_node_type":"SOL_INTERNAL_NODE","using_scheme":"CS_3D_RC","solution_childnodes":[ {"child_token":"56_336_dp_ip_complex","child_option":4},{"child_token":"sbcc_336_dp_ip_complex","child_option":6} ]}
               ]},
{"Problem":{"arch":"gfx90a","token":"81_81_81_dp_op_complex"},
 "Solutions":[ {"sol_node_type":"SOL_INTERNAL_NODE","using_scheme":"CS_3D_RC","solution_childnodes":[ {"child_token":"81_81_dp_ip_complex","child_option":1},{"child_token":"sbcc_81_dp_ip_complex","child_option":0} ]}
               ]} ]
}
